Journal's MAIN field,Field,Journal,Website,Publisher type,Publisher,Institution,Institution type,Country,Business model,Scimago Journal Title,APC Euros,Scimago Rank,Scimago Quartile,H index,PCI partner
Development,Reproduction,Reproduction,https://rep.bioscientifica.com/,Non-profit,Bioscientifica / Society for Endocrinology,Society for Reproduction and Fertility,Society/Association,,Hybrid,,2458,1.096,Q1 (Embryology; Obstetrics and Gynecology; Reproductive Medicine),177,No
Development,Reproduction,"Reproduction, Fertility and Development",https://connectsci.au/rd,Non-profit,CSIRO Publishing,-,,Australia,Hybrid,,2336,0.327,Q3 (Animal Science and Zoology; Biotechnology; Reproductive Medicine),87,No
Development,Reproduction,Reproductive Biology,https://www.sciencedirect.com/journal/reproductive-biology,For-profit,Elsevier,-,,Netherlands,Hybrid,,2351,0.611,Q1 (Animal Science and Zoology),48,No
Development,Reproduction,Reproductive Biology and Endocrinology,https://link.springer.com/journal/12958,For-profit,Springer Nature,-,,Germany/UK,OA,,2738,1.265,Q1 (Developmental Biology; Endocrinology; Obstetrics and Gynecology; Reproductive Medicine),118,No
Development,Reproduction,Journal of Reproductive Medicine,https://www.thereproductivemedicine.com/Home/index,Non-profit,"Journal of Reproductive Medicine, Inc.",,,,,,,0.114,Q4 (Obstetrics and Gynecology; Reproductive Medicine),76,No
Development,Reproduction,Journal of Reproduction and Development,https://www.jstage.jst.go.jp/browse/jrd/,Non-profit,J-STAGE,The Society for Reproduction and Development,Society/Association,Japan,OA,,1404,0.636,Q1 (Animal Science and Zoology),63,No
Development,Reproduction,Journal of Ovarian Research,https://ovarianresearch.biomedcentral.com/,For-profit,Springer Nature (BioMed Central),,,UK,OA,,2057,1.099,Q1 (Obstetrics and Gynecology),66,No
Development,Reproduction,Human Fertility,https://www.tandfonline.com/journals/ihuf20,For-profit Society-run,Taylor & Francis Group,British Fertility Society,Society/Association,UK,OA,,2447,0.633,Q2 (Medicine; Obstetrics and Gynecology; Reproductive Medicine),49,No
Development,Reproduction,Animal Reproduction Science,https://www.sciencedirect.com/journal/animal-reproduction-science,For-profit,Elsevier,,,Netherlands,Hybrid,,2372,0.637,Q1 (Animal Science and Zoology; Food Animals),124,No
Development,Reproduction,American Journal of Reproductive Immunology,https://onlinelibrary.wiley.com/journal/16000897,For-profit,John Wiley & Sons,,,USA,Hybrid,,3212,0.835,Q2 (Immunology and Allergy; Obstetrics and Gynecology; Reproductive Medicine),119,No
Development,Childhood and Adolescence,Journal of Human Lactation,https://journals.sagepub.com/home/jhl,For-profit Society-run,Sage Publishing,International Lactation Consultant Association,Society/Association,USA,Hybrid,,2543,0.636,Q2 (Medicine; Obstetrics and Gynecology),74,No
Development,Generalist,EMBO Reports,https://www.embopress.org/journal/14693178,For-profit Society-run,Springer Nature,European Molecular Biology Organization (EMBO) Press,,Germany/UK,OA,,5946,2.756,Q1 (Biochemistry; Genetics; Molecular Biology),219,No
Development,Aging,Mechanisms of Ageing and Development,https://www.journals.elsevier.com/mechanisms-of-ageing-and-development,For-profit Society-run,Elsevier,"European Society of Preventive, Regenerative and Anti-aging Medicine (ESAAM)",Society/Association,Netherlands,Hybrid,,3544,1.83,Q1 (Aging; Developmental Biology),139,No
Development,Aging,The International Journal of Aging and Human Development,https://journals.sagepub.com/home/ahdb,For-profit,Sage Publishing,-,,USA,,,,0.792,Q2 (Developmental and Educational Psychology; Geriatrics and Gerontology),72,No
Development,Aging,The Journals of Gerontology Series A: Biological Sciences and Medical Sciences,https://academic.oup.com/biomedgerontology?login=false,University Press,Oxford University Press (OUP),,,UK,Hybrid,Journals of Gerontology - Series A Biological Sciences and Medical Sciences,3854,1.334,Q1 (Geriatrics and Gerontology),230,No
Development,Aging,The Journals of Gerontology Series B: Psychological Sciences and Social Sciences,https://academic.oup.com/psychsocgerontology?login=false,University Press,Oxford University Press (OUP),,,UK,Hybrid,Journals of Gerontology - Series B Psychological Sciences and Social Sciences ,2999,1.995,Q1 (Clinical Psychology; Geriatrics and Gerontology; Gerontology; Health; Life-span and Life-course Studies; Medicine; Social Psychology; Sociology and Political Science),186,No
Development,Aging,Geriatrics and Gerontology International,https://onlinelibrary.wiley.com/journal/14470594,For-profit Society-run,John Wiley & Sons,Japan Geriatrics Society,Society/Association,USA,Hybrid,,2052,0.763,Q2 (Geriatrics and Gerontology; Gerontology; Health; Medicine),83,No
Development,Aging,GeroScience,https://link.springer.com/journal/11357,For-profit Society-run,Springer Nature,American Aging Association (AGE),Society/Association,Germany / UK,Hybrid,,2688,1.564,Q1 (Aging; Cardiology and Cardiovascular Medicine; Complementary and Alternative Medicine; Geriatrics and Gerontology; Veterinary),95,No
Development,Aging,Gériatrie et Psychologie Neuropsychiatrie du Vieillissement,https://www.jle.com/fr/revues/gpn/revue.phtml,For-profit Society-run,John Libbery Eurotext,Société française de gériatrie et de gérontologie (SFGG); Société francophone de psychogériatrie et de psychiatrie de la personne âgée (SF3PA); Association des jeunes gériatres (AJG),Society/Association,France,Hybrid,,424,0.19,Q4 (Biological Psychiatry; Geriatrics and Gerontology; Medicine; Neurology; Neuropsychology and Physiological Psychology),22,No
Development,Aging,Gerontology,https://karger.com/ger,For-profit,Karger Publishers,,,Switzerland,Hybrid,,2678,0.98,Q2 (Geriatrics and Gerontology),120,No
Development,Aging,Experimental Aging Research,https://www.tandfonline.com/journals/uear20,For-profit,Taylor & Francis Group,,,UK,,,,0.576,Q1 (Arts and Humanities),59,No
Development,Aging,Clinical Gerontologist,https://www.tandfonline.com/journals/wcli20,For-profit,Taylor & Francis Group,,,UK,,,,1.046,Q1 (Clinical Psychology; Gerontology; Health),46,No
Development,Aging,Biogerontology,https://link.springer.com/journal/10522,For-profit,Springer Nature,,,Germany / UK,Hybrid,,3589,1.152,Q1 (Gerontology),95,No
Development,Aging,Australasian Journal on Ageing,https://onlinelibrary.wiley.com/journal/17416612,For-profit,John Wiley & Sons,,,USA,Hybrid,,2606,0.706,Q1 (Community and Home Care),50,No
Development,Aging,Age and Ageing,https://academic.oup.com/ageing?login=false,University Press,Oxford University Press (OUP),,,UK,Hybrid,,2956,1.993,Q1 (Aging; Geriatrics and Gerontology; Medicine),175,No
Development,Aging,Ageing Research Reviews,https://www.sciencedirect.com/journal/ageing-research-reviews,For-profit,Elsevier,,,Netherlands,Hybrid,,2949,4.216,Q1 (Aging; Biochemistry; Biotechnology; Molecular Biology; Neurology),181,No
Development,Aging,Aging and Mental Health,https://www.tandfonline.com/journals/camh20,For-profit,Taylor & Francis Group,,,UK,Hybrid,,1690,1.356,Q1 (Geriatrics and Gerontology; Gerontology; Psychiatry and Mental Health),119,No
Development,Aging,Aging Cell,https://onlinelibrary.wiley.com/journal/14749726,For-profit Society-run,John Wiley & Sons,The Anatomical Society,Society/Association,UK,OA,,2400,2.905,Q1 (Aging; Cell Biology),181,No
Development,Aging,Aging Clinical and Experimental Research,https://link.springer.com/journal/40520,For-profit Society-run,Springer Nature,"European Society for Clinical and Economic Aspects of Osteoporosis, Osteoarthritis and Musculoskeletal Diseases",Society/Association,Germany / UK,OA,,3321,1.144,Q2 (Aging; Geriatrics and Gerontology),95,No
Development,Aging,Aging and Disease,https://www.aginganddisease.org/EN/2152-5250/home.shtml,Non-profit,International Society on Aging and Disease (ISOAD),International Society on Aging and Disease (ISOAD),Society/Association,USA,OA,,2397,2.143,Q1 (Cell Biology; Geriatrics and Gerontology; Neurology; Pathology and Forensic Medicine),88,No
Development,Aging,Journal of Aging Research,https://onlinelibrary.wiley.com/journal/9025,For-profit,John Wiley & Sons,,,UK,OA,,673,0.633,Q3 (Geriatrics and Gerontology),61,No
Development,Aging,Ageing International,https://link.springer.com/journal/12126,For-profit,Springer Nature,,,Germany / UK,Hybrid,,2136,0.529,Q2 (Health),47,No
Development,Aging,Nature Aging,https://www.nature.com/nataging,For-profit,Springer Nature,,,Germany / UK,Hybrid,,10439,7.081,Q1 (Aging; Geriatrics and Gerontology; Neuroscience),51,No
Development,Aging,Journal of Aging Studies,https://www.sciencedirect.com/journal/journal-of-aging-studies,For-profit,Elsevier,,,Netherlands,Hybrid,,1785,0.765,"Q1 (Issues, Ethics and Legal Aspects)",86,No
Development,Aging,Journal of Aging and Health,https://journals.sagepub.com/home/jah,For-profit,Sage Publishing,,,USA,Hybrid,,269,1.143,Q1 (Community and Home Care; Gerontology; Health; Life-span and Life-course Studies; Sociology and Political Science),93,No
Development,Aging,Frontiers in Aging,https://www.frontiersin.org/journals/aging,For-profit,Frontiers Media SA,,,Switzerland,OA,,1647,1.455,Q1 (Genetics; Molecular Biology; Physiology),20,No
Development,Aging,The American Journal of Geriatric Psychiatry,https://www.ajgponline.org/,For-profit Society-run,Elsevier,American Association for Geriatric Psychiatry (AAGP),Society/Association,Netherlands,Hybrid,,3194,1.378,Q1 (Geriatrics and Gerontology; Psychiatry and Mental Health),150,No
