Journal's MAIN field,Field,Journal,Website,Publisher type,Publisher,Institution,Institution type,Country,Business model,APC Euros,Scimago Rank,Scimago Quartile,H index,PCI partner
Generalist,Anatomy,Journal of Anatomy,https://onlinelibrary.wiley.com/journal/14697580,For-profit,John Wiley & Sons,,,USA,Hybrid,2164,0.655,"Q2 (Anatomy; Ecology, Evolution, Behavior and Systematics; Histology)",140,No
Generalist,Anatomy,European Journal of Anatomy,https://eurjanat.com/,Non-profit,Spanish Society of Anatomy,,,,,,0.154,Q4 (Anatomy),22,No
Generalist,Anatomy,Clinical Anatomy,https://onlinelibrary.wiley.com/journal/10982353,For-profit Society-run,John Wiley & Sons,American Association of Clinical Anatomists; British Association of Clinical Anatomists,Society,USA,,,0.788,Q1 (Anatomy),93,No
Generalist,Anatomy,Annals of Anatomy,https://www.sciencedirect.com/journal/annals-of-anatomy-anatomischer-anzeiger,For-profit Society-run,Elsevier,Anatomische Gesellschaft,Society,Netherlands,,,0.571,Q2 (Anatomy; Medicine),67,No
Generalist,Anatomy,Anatomical Sciences Education,https://anatomypubs.onlinelibrary.wiley.com/journal/19359780?journalRedirectCheck=true,For-profit Society-run,John Wiley & Sons,American Association for Anatomy,Society,USA,,,1.216,Q1 (Anatomy; Embryology; Histology; Medicine),76,No
Generalist,Anatomy,Anatomical Science International,https://link.springer.com/journal/12565,For-profit Society-run,Springer Nature,Japanese Association of Anatomists,Society,Germany / UK,Hybrid,,0.448,Q2 (Anatomy),46,No
Generalist,Anatomy,The Anatomical Record,https://anatomypubs.onlinelibrary.wiley.com/journal/19328494,For-profit Society-run,John Wiley & Sons,American Association for Anatomy,Society,USA,Hybrid,2118,0.553,"Q2 (Anatomy; Biotechnology; Ecology, Evolution, Behavior and Systematics; Histology)",103,No
Generalist,Anatomy,Advances in Anatomic Pathology,https://journals.lww.com/anatomicpathology/pages/default.aspx,For-profit,Wolters Kluwer (Lippincott),,,Netherlands / USA,,,1.286,Q1 (Anatomy; Pathology and Forensic Medicine),94,No
Generalist,Bioethics,Bioethics,https://onlinelibrary.wiley.com/journal/14678519,For-profit,John Wiley & Sons,,,USA,Hybrid,2266,0.769,Q1 (Philosophy),70,No
Generalist,Bioethics,The American Journal of Bioethics,https://www.tandfonline.com/journals/uajb20,For-profit,Taylor & Francis Group,,,UK,Hybrid,3445,1.284,"Q1 (Health Policy; Issues, Ethics and Legal Aspects)",76,No
Generalist,Bioethics,Advances in Bioethics,https://bookstore.emerald.com/advances-in-bioethics/,For-profit,Emerald Publishing,,,,,,,,8,No
Generalist,Computational Biology,Plos Computational Biology,https://journals.plos.org/ploscompbiol/,Non-profit,Public Library of Science (PLoS),,,USA,OA,2418,1.503,"Q1 (Cellular and Molecular Neuroscience; Computational Theory and Mathematics; Ecology; Ecology, Evolution, Behavior and Systematics; Genetics; Modeling and Simulation; Molecular Biology)",227,No
Generalist,Computational Biology,PeerJ Computer Science,https://peerj.com/computer-science/,For-profit,PeerJ,,,UK,OA,1303,0.719,Q1 (Computer Science),59,PCI friendly
Generalist,Computational Biology,Bioinformatics,https://academic.oup.com/bioinformatics,University Press,Oxford University Press (OUP),,,UK,OA,3233,2.451,Q1 (Biochemistry; Computational Mathematics; Computational Theory and Mathematics; Computer Science Applications; Molecular Biology; Statistics and Probability),486,No
Generalist,Computational Biology,Briefings in Bioinformatics,https://academic.oup.com/bib/,University Press,Oxford University Press (OUP),,,UK,OA,3259,2.39,Q1 (Information Systems; Molecular Biology),159,No
Generalist,Computational Biology,Bioinformatics Advances,https://academic.oup.com/bioinformaticsadvances,University Press Society-Run,Oxford University Press (OUP),International Society for Computational Biology,Society,UK,OA,2347,1.41,Q1 (Computer Science Applications; Genetics; Structural Biology),17,No
Generalist,Computational Biology,Nature Computational Science,https://www.nature.com/natcomputsci,For-profit,Springer Nature,,,Germany/UK,Hybrid,9310,3.472,Q1 (Computer Networks and Communications; Computer Science Applications; Computer Science),40,No
Generalist,Computational Biology,Journal of Computational Biology,https://liebertpub.com/loi/cmb,For-profit,Sage Publishing (Mary Ann Liebert),,,USA,Hybrid,4004,0.627,Q2 (Computational Mathematics; Computational Theory and Mathematics; Modeling and Simulation),106,No
Generalist,Computational Biology,Journal of Bioinformatics and Computational Biology,https://www.worldscientific.com/worldscinet/jbcb,For-profit,World Scientific Publishing,,,Singapore,,,0.234,Q4 (Biochemistry; Computer Science Applications; Molecular Biology),49,No
Generalist,Computational Biology,Computational Biology and Chemistry.,https://www.sciencedirect.com/journal/computational-biology-and-chemistry,For-profit,Elsevier,,,Netherlands,,,0.522,Q2 (Computational Mathematics; Organic Chemistry),73,No
Generalist,Computational Biology,BMC Bioinformatics,https://bmcbioinformatics.biomedcentral.com/,For-profit,Springer Nature (BioMed Central),,,UK,OA,1912,1.19,Q1 (Applied Mathematics; Biochemistry; Computer Science Applications),251,No
Generalist,Computational Biology,Biomedical Engineering and Computational Biology,https://journals.sagepub.com/home/bec,For-profit,Sage Publishing,,,UK,,,,,,No
Generalist,Endocrinology,Journal of the Endocrine Society,https://academic.oup.com/jes,University Press Society-run,Oxford University Press (OUP),Endocrine Society,Society,USA,OA,2206,0.979,"Q2 (Endocrinology, Diabetes and Metabolism)",50,No
Generalist,Endocrinology,Journal of Endocrinology,https://joe.bioscientifica.com/,Non-profit,Society for Endocrinology,,,,Hybrid,1984,1.194,"Q1 (Endocrinology, Diabetes and Metabolism)",172,No
Generalist,Endocrinology,International Journal of Endocrinology,https://onlinelibrary.wiley.com/journal/1573,For-profit,John Wiley & Sons,,,UK,OA,1751,0.667,"Q3 (Endocrine and Autonomic Systems; Endocrinology; Endocrinology, Diabetes and Metabolism)",84,No
Generalist,Endocrinology,Hormones and Behavior,https://www.sciencedirect.com/journal/hormones-and-behavior,For-profit Society-run,Elsevier,Society for Behavioral Neuroendocrinology,Society,Netherlands,Hybrid,2654,0.822,Q2 (Endocrinology),166,No
Generalist,Endocrinology,Hormones,https://link.springer.com/journal/42000,For-profit Society-run,Springer Nature,Hellenic Endocrine Society,Society,Germany / UK,Hybrid,,0.78,"Q2 (Endocrinology, Diabetes and Metabolism; Medicine)",59,No
Generalist,Endocrinology,Hormone Research in Paediatrics,https://karger.com/HRP,For-profit Society-run,Karger Publishers,European Society for Paediatric Endocrinology; Pediatric Endocrine Society; Sociedade Latino-Americana de Endocrinologia Pediátrica,Society,Switzerland,Hybrid,2649,0.884,"Q1 (Pediatrics, Perinatology and Child Health)",103,No
Generalist,Endocrinology,Hormone and Metabolic Research,https://lp.thieme.de/journals/hormone-and-metabolic-research/0018-5043,For-profit,Thieme Group,,,Germany,Hybrid,3233,0.538,Q2 (Biochemistry; Medicine),104,No
Generalist,Endocrinology,Gynecological Endocrinology,https://www.isgesociety.com/publications/gynecological-endocrinology/,Non-profit,International Society of Gynecological Endocrinology,International Society of Gynecological Endocrinology,Society,UK,OA,3057,0.67,Q2 (Obstetrics and Gynecology),79,No
Generalist,Endocrinology,Growth Hormone & IGF Research,https://www.sciencedirect.com/journal/growth-hormone-and-igf-research,For-profit,Elsevier,,,Netherlands,Hybrid,2193,0.551,"Q3 (Endocrinology; Endocrinology, Diabetes and Metabolism)",70,No
Generalist,Endocrinology,Growth Factors,https://www.tandfonline.com/journals/igrf20,For-profit,Taylor & Francis Group,,,UK,,,0.459,Q3 (Clinical Biochemistry),66,No
Generalist,Endocrinology,General and Comparative Endocrinology,https://www.sciencedirect.com/journal/general-and-comparative-endocrinology,For-profit,Elsevier,,,Netherlands,Hybrid,3011,0.569,Q1 (Animal Science and Zoology),138,No
Generalist,Endocrinology,Frontiers of Hormone Research,https://karger.com/collection/30216/Frontiers-of-Hormone-Research,For-profit,Karger Publishers,,,Switzerland,OA,,0.54,"Q3 (Endocrinology; Endocrinology, Diabetes and Metabolism)",47,No
Generalist,Endocrinology,European Journal of Endocrinology,https://academic.oup.com/ejendo/?login=false,University Press Society-run,Oxford University Press (OUP),European Society of Endocrinology (ESE),Society,UK,Hybrid,2606,1.81,"Q1 (Endocrinology; Endocrinology, Diabetes and Metabolism; Medicine)",179,No
Generalist,Endocrinology,Endocrinology and Metabolism Clinics of North America,https://www.sciencedirect.com/journal/endocrinology-and-metabolism-clinics-of-north-america,For-profit,Elsevier,,,Netherlands,,,1.739,"Q1 (Endocrinology; Endocrinology, Diabetes and Metabolism)",126,No
Generalist,Endocrinology,Endocrinology,https://academic.oup.com/endo?login=false,University Press,Oxford University Press (OUP),,,UK,Hybrid,2654,1.308,Q1 (Endocrinology),289,No
Generalist,Endocrinology,Endocrine Related Cancer,https://erc.bioscientifica.com/,Non-profit,Bioscientifica Ltd,Society for Endocrinology,Society,,Hybrid,3620,1.674,"Q1 (Endocrinology; Endocrinology, Diabetes and Metabolism; Oncology)",149,No
Generalist,Endocrinology,Endocrine Research,https://www.tandfonline.com/journals/ierc20,For-profit,Taylor & Francis Group,,,UK,,,0.487,Q3 (Endocrinology; Medicine),49,No
Generalist,Endocrinology,Endocrine Reviews,https://academic.oup.com/edrv/?login=false,University Press,Oxford University Press (OUP),,,UK,Hybrid,3113,9.175,"Q1 (Endocrinology; Endocrinology, Diabetes and Metabolism)",317,No
Generalist,Endocrinology,Endocrine,https://link.springer.com/journal/12020,For-profit,Springer Nature,,,Germany / UK,Hybrid,,0.971,"Q2 (Endocrinology; Endocrinology, Diabetes and Metabolism)",107,No
Generalist,Endocrinology,Endocrine Connections,https://ec.bioscientifica.com/,Non-profit,Bioscientifica Ltd,Society for Endocrinology,Society,UK,OA,1951,0.905,"Q2 (Endocrinology; Endocrinology, Diabetes and Metabolism; Internal Medicine)",50,No
Generalist,Endocrinology,Endocrine Journal,https://endocrine-j.jp/,Non-profit,The Japan Endocrine Society,,,Japan,OA,,0.747,"Q2 (Endocrinology, Diabetes and Metabolism)",87,No
Generalist,Endocrinology,Endocrine Pathology,https://link.springer.com/journal/12022,For-profit Society-run,Springer Nature,Endocrine Pathology Society,Society,Germany / UK,Hybrid,,3.832,"Q1 (Endocrinology; Endocrinology, Diabetes and Metabolism; Medicine; Pathology and Forensic Medicine)",61,No
Generalist,Endocrinology,Current Opinion in Endocrinology Diabetes and Obesity,https://journals.lww.com/co-endocrinology/pages/default.aspx,For-profit,Wolters Kluwer (Lippincott),,,Netherlands / USA,Hybrid,3390,0.825,"Q2 (Endocrinology; Endocrinology, Diabetes and Metabolism; Internal Medicine; Medicine; Nutrition and Dietetics)",87,No
Generalist,Endocrinology,BMC Endocrine Disorders,https://bmcendocrdisord.biomedcentral.com/,For-profit,Springer Nature (BioMed Central),,,UK,OA,1919,0.925,Q1 (Medicine),63,No
Generalist,Endocrinology,Asian Journal of Andrology,https://www.asiaandro.com/,University Press,"Shanghai Materia Medica, Chinese Academy of Sciences; Shanghai Jiao Tong University","Shanghai Institute of Materia Medica, Chinese Academy of Sciences and Shanghai Jiao Tong University",,India,OA,1468,0.827,Q1 (Urology),94,No
Generalist,Endocrinology,Archives of Endocrinology and Metabolism,https://www.aem-sbem.com/,Non-profit,Brazilian Society of Endocrinology and Metabolism,,,Brazil,OA diamond,0,0.613,"Q3 (Endocrinology, Diabetes and Metabolism)",64,No
Generalist,Endocrinology,Annales d'Endocrinologie,https://www.sciencedirect.com/journal/annales-dendocrinologie,For-profit Society-run,Elsevier,French Society of Endocrinology (SFE),Society,Netherlands,Hybrid,1834,0.761,"Q2 (Endocrinology; Endocrinology, Diabetes and Metabolism; Medicine)",49,No
Generalist,Endocrinology,Andrology,https://onlinelibrary.wiley.com/journal/20472927,For-profit Society-run,John Wiley & Sons,American Society of Andrology; European Academy of Andrology,Society,USA,Hybrid,2907,1.079,Q1 (Reproductive Medicine; Urology),76,No
Generalist,Endocrinology,Andrologia,https://onlinelibrary.wiley.com/journal/and,For-profit,John Wiley & Sons,,,USA,Hybrid,2475,0.693,Q2 (Medicine; Urology),79,No
Generalist,Generalist,Proceedings of the National Academy of Sciences of the USA (PNAS),https://www.pnas.org/,Non-profit,USA National Academy of Sciences,USA National Academy of Sciences,,USA,Hybrid,6443,3.414,Q1,896,No
Generalist,Generalist,Proceedings of the National Academy of Sciences of the USA (PNAS) Nexus,https://academic.oup.com/pnasnexus,University Press Society-run,Oxford University Press (OUP),USA National Academy of Sciences,,UK,OA,5152,1.198,,,No
Generalist,Generalist,Philosophical Transactions of the Royal Society B: Biological Sciences,https://royalsocietypublishing.org/journal/rspb,Non-profit,The Royal Society,The Royal Society of London for the Improvement of Natural Knowledge,Society,UK,Hybrid,2004,1.732,"Q1 (Agricultural and Biological Sciences; Biochemistry, Genetics and Molecular Biology)",334,No
Generalist,Generalist,eLife,https://elifesciences.org/,Non-profit,eLife Sciences Publications,,,UK,OA,2460,3.379,"Q1 (Biochemistry, Genetics and Molecular Biology; Immunology and Microbiology; Medicine; Neuroscience)",225,No
Generalist,Generalist,Science,https://www.science.org/journal/science,Non-profit,American Association for the Advancement of Science (AAAS),American Association for the Advancement of Science,Society,USA,Hybrid,2131,10.416,Q1 (History and Philosophy of Science; Multidisciplinary),1382,No
Generalist,Generalist,Science Advances,https://www.science.org/journal/sciadv,Non-profit,American Association for the Advancement of Science (AAAS),American Association for the Advancement of Science,Society,USA,OA,3801,4.324,Q1 (Multidisciplinary),288,No
Generalist,Generalist,Plos Biology,https://journals.plos.org/plosbiology/,Non-profit,Public Library of Science (PLoS),,,USA,OA,3973,2.691,"Q1 (Agricultural and Biological Sciences; Biochemistry, Genetics and Molecular Biology; Immunology and Microbiology; Neuroscience)",316,PCI friendly
Generalist,Generalist,Plos One,https://journals.plos.org/plosone/,Non-profit,Public Library of Science (PLoS),,,USA,OA,1741,0.803,Q1 (Multidisciplinary),467,PCI friendly
Generalist,Generalist,ReScience C,https://rescience.github.io/,Non-profit,GitHub,,,,OA,0,,,,No
Generalist,Generalist,Nature,https://www.nature.com/,For-profit,Springer Nature,,,Germany,Hybrid,8431,18.288,Q1 (Multidisciplinary),1442,No
Generalist,Generalist,Nature Communications,https://www.nature.com/ncomms/,For-profit,Springer Nature,,,Germany,OA,5143,4.761,"Q1 (Biochemistry, Genetics and Molecular Biology; Chemistry; Physics and Astronomy)",577,No
Generalist,Generalist,Scientific Reports,https://www.nature.com/srep/,For-profit,Springer Nature,,,Germany,OA,2001,0.874,Q1 (Multidisciplinary),347,No
Generalist,Generalist,Current biology,https://www.cell.com/current-biology/home,For-profit,Elsevier,,,USA,Hybrid,5065,2.707,"Q1 (Agricultural and Biological Sciences; Biochemistry, Genetics and Molecular Biology; Neuroscience)",376,No
Generalist,Generalist,Frontiers in Systems Biology,https://www.frontiersin.org/journals/systems-biology,For-profit,Frontiers Media SA,,,Switzerland,OA,1982,0.719,Q1 (Modeling and Simulation),8,No
Generalist,Generalist,PeerJ Life & Environment,https://peerj.com/life-environment/,For-profit,PeerJ,,,UK,OA,2361,0.625,,,PCI friendly
Generalist,Generalist,FEBS Open Bio,https://febs.onlinelibrary.wiley.com/journal/22115463,For-profit Society-run,John Wiley & Sons,Federation of European Biochemical Societies,,UK,OA,1366,0.857,"Q2 (Biochemistry, Genetics and Molecular Biology)",51,No
Generalist,Generalist,Communications Biology,https://www.nature.com/commsbio/,For-profit,Springer Nature,,,Germany/UK,OA,3134,2.071,"Q1 (Agricultural and Biological Sciences; Biochemistry, Genetics and Molecular Biology; Medicine)",91,No
Generalist,Generalist,GigaScience,https://academic.oup.com/gigascience,University Press,Oxford University Press (OUP),Beijing Genomics Institute,,UK,OA,2051,5.314,Q1 (Computer Science Applications; Health Informatics),98,PCI friendly
Generalist,Generalist,GigaByte,https://gigabytejournal.com/,For-profit/University Press,Oxford University Press (OUP),Beijing Genomics Institute (BGI) Group,Company,Hong Kong,OA,411,0.871,"Q2 (Biochemistry, Genetics and Molecular Biology; Biotechnology; Genetics; Molecular Medicine)",11,PCI friendly
Generalist,Generalist,npj Systems Biology and Applications,https://www.nature.com/npjsba/,For-profit,Springer Nature,Systems Biology Institute,,Germany/UK,OA,2482,1.236,"Q1 (Applied Mathematics; Biochemistry, Genetics and Molecular Biology; Computer Science Applications; Drug Discovery; Modeling and Simulation)",38,No
Generalist,Generalist,OMICS: A Journal of Integrative Biology,https://home.liebertpub.com/publications/omics-a-journal-of-integrative-biology/43,For-profit,Sage Publishing (Mary Ann Liebert),,,USA,Hybrid,3118,0.435,Q3 (Biochemistry; Biotechnology; Genetics; Medicine; Molecular Medicine),73,No
Generalist,Generalist,Life Science Alliance,https://www.life-science-alliance.org/,Non-profit,"Life Science Alliance LLC (commonly owned by EMBO press, Rockefeller University Press, CSH Laboratory Press)",,,USA,OA,3297,1.544,"Q1 (Biochemistry, Genetics and Molecular Biology; Ecology; Health, Toxicology and Mutagenesis; Plant Science)",42,No
Generalist,Generalist,Current Opinion in Systems Biology,https://www.sciencedirect.com/journal/current-opinion-in-systems-biology,For-profit,Elsevier,,,Netherlands,Hybrid,2923,1.702,"Q1 (Applied Mathematics; Biochemistry, Genetics and Molecular Biology; Computer Science Applications; Drug Discovery; Modeling and Simulation)",38,No
Generalist,Generalist,Annals of the New York Academy of Sciences,https://nyaspubs.onlinelibrary.wiley.com/journal/17496632,For-profit Society-run,John Wiley & Sons,The New York Academy of Sciences,,USA,Hybrid,3054,1.458,"Q1 (Biochemistry, Genetics and Molecular Biology; History and Philosophy of Science; Neuroscience)",301,No
Generalist,Generalist,Journal of Visualized Experiments,https://www.jove.com/research/journal,For-profit,Journal of Visualized Experiments (JoVE),,,USA,Hybrid,3074,0.431,Q2 (Chemical Engineering),141,No
Generalist,Generalist,Biology Direct,https://biologydirect.biomedcentral.com/,For-profit,Springer Nature (BioMed Central),,,UK,OA,1897,1.199,"Q1 (Agricultural and Biological Sciences; Applied Mathematics; Biochemistry, Genetics and Molecular Biology; Ecology, Evolution, Behavior and Systematics; Modeling and Simulation)",84,No
Generalist,Generalist,Biology Open,https://journals.biologists.com/bio,Non-profit,The Company of Biologists,,,UK,OA,1698,0.723,Q1 (Agricultural and Biological Sciences),61,No
Generalist,Generalist,The Journal of Experimental Biology,https://journals.biologists.com/jeb,Non-profit,The Company of Biologists,,,UK,Hybrid,3289,0.931,"Q1 (Animal Science and Zoology; Aquatic Science; Ecology, Evolution, Behavior and Systematics; Insect Science; Medicine)",221,No
Generalist,Generalist,iScience,https://www.cell.com/iscience/home,For-profit,Elsevier (Cell Press),,,USA,OA,2657,1.363,Q1 (Multidisciplinary),97,No
Generalist,Generalist,BMC Biology,https://bmcbiol.biomedcentral.com/,For-profit,Springer Nature (BioMed Central),,,UK,OA,2559,1.727,"Q1 (Agricultural and Biological Sciences; Biochemistry, Genetics and Molecular Biology; Biotechnology; Cell Biology; Developmental Biology; Ecology, Evolution, Behavior and Systematics; Physiology; Plant Science; Structural Biology)",137,No
Generalist,Generalist,Royal Society Open Science,https://royalsocietypublishing.org/journal/rsos,Non-profit,The Royal Society,The Royal Society of London for the Improvement of Natural Knowledge,Society,UK,OA,1393,0.795,Q1 (Multidisciplinary),92,No
Generalist,Generalist,Royal Society Biology Letters,https://royalsocietypublishing.org/journal/rsbl,Non-profit,The Royal Society,The Royal Society of London for the Improvement of Natural Knowledge,Society,UK,Hybrid,2431,1.071,,,No
Generalist,Generalist,Proceedings of the Royal Society B: Biological Sciences,https://royalsocietypublishing.org/journal/rspb,Non-profit,The Royal Society,The Royal Society of London for the Improvement of Natural Knowledge,Society,UK,Hybrid,1962,1.45,"Q1 (Agricultural and Biological Sciences; Biochemistry, Genetics and Molecular Biology; Environmental Science; Immunology and Microbiology; Medicine)",302,No
Generalist,Generalist,Cold Spring Harbor Perspectives in Biology,https://cshperspectives.cshlp.org/,Non-profit,Cold Spring Harbor Laboratory Press,,,USA,Hybrid,,3.699,"Q1 (Biochemistry, Genetics and Molecular Biology)",251,No
Generalist,Generalist,Annual Review of Animal Biosciences,https://www.annualreviews.org/content/journals/animal,Non-profit,Annual Reviews,Annual Reviews,,USA,,,3.307,Q1 (Animal Science and Zoology; Biotechnology; Genetics; Veterinary),68,No
Generalist,Generalist,Advanced Science,https://advanced.onlinelibrary.wiley.com/journal/21983844,For-profit,John Wiley & Sons,,,USA,OA,4375,3.775,"Q1 (Biochemistry, Genetics and Molecular Biology; Chemical Engineering; Engineering; Materials Science; Medicine; Physics and Astronomy)",220,No
Generalist,Generalist,Yale Journal of Biology and Medicine,https://medicine.yale.edu/yjbm/,Non-profit,PubMed Central,Yale Office of Medical Education,,USA,OA diamond,0,0.931,"Q1 (Biochemistry, Genetics and Molecular Biology; Medicine)",74,No
Generalist,Generalist,Comptes Rendus Biologies,https://comptes-rendus.academie-sciences.fr/biologies,Non-profit,Académie des Sciences,Académie des Sciences,University/Government,France,OA diamond,0,0.308,Q2 (Agricultural and Biological Sciences),98,No
Generalist,Generalist,Journal of Biological Research (Italy),https://www.pagepressjournals.org/index.php/jbr/index,For-profit Society-run,PAGEPress Publications,Società Italiana di Biologia Sperimentale,Society,Italy,OA,180,0.409,Q2 (Agricultural and Biological Sciences),28,No
Generalist,Generalist,Life Sciences,https://www.sciencedirect.com/journal/life-sciences,For-profit,Elsevier,,,Netherlands,OA,3169,1.315,"Q1 (Biochemistry, Genetics and Molecular Biology; Medicine; Pharmacology, Toxicology and Pharmaceutics)",200,No
Generalist,Generalist,The Lancet Global Health,https://www.thelancet.com/journals/langlo/home,For-profit,Elsevier,,,Netherlands,OA,4925,5.87,Q1 (Medicine),153,No
Generalist,Generalist,Journal of Theoretical Biology,https://www.sciencedirect.com/journal/journal-of-theoretical-biology,For-profit,Elsevier,,,Netherlands,Hybrid,2670,0.532,"Q2 (Agricultural and Biological Sciences; Applied Mathematics; Biochemistry, Genetics and Molecular Biology; Immunology and Microbiology; Medicine; Modeling and Simulation; Statistics and Probability)",178,No
Generalist,Generalist,Function,https://journals.physiology.org/journal/function,Non-profit,American Physiological Society,American Physiological Society,Society,USA,OA,3654,0.877,Q2 (Molecular Medicine; Physiology),19,No
Generalist,Generalist,Journal of Photochemistry and Photobiology B: Biology,https://www.sciencedirect.com/journal/journal-of-photochemistry-and-photobiology-b-biology,For-profit,Elsevier,,,Netherlands,Hybrid,2032,0.73,Q1 (Radiation),156,No
Generalist,Generalist,Quantitative Science Studies,https://direct.mit.edu/qss,University Press Society-Run,MIT press,International Society for Scientometrics and Informetrics (ISSI),Society,USA,OA,1018,1.486,Q1 (Analysis; Cultural Studies; Library and Information Sciences; Numerical Analysis),30,No
Generalist,Generalist,Journal of Biological Systems,https://www.worldscientific.com/worldscinet/jbs,For-profit,World Scientific Publishing,,,Singapore,,,0.487,Q2 (Agricultural and Biological Sciences; Applied Mathematics; Ecology),39,No
Generalist,Generalist,JCI insight,https://insight.jci.org/,Non-profit,American Society for Clinical Investigation (ASCI),,,USA,OA,4002,2.917,Q1 (Medicine),129,No
Generalist,Generalist,JAMA Network Open,https://jamanetwork.com/journals/jamanetworkopen,Non-profit,American Medical Association (AMA),American Medical Association,Society,USA,OA,2818,3.546,Q1 (Medicine),154,No
Generalist,Generalist,International Journal of Biological Sciences,https://www.ijbs.com/,For-profit,Ivyspring International Publisher,,,Australia,OA,2107,2.715,"Q1 (Applied Microbiology and Biotechnology; Cell Biology; Developmental Biology; Ecology, Evolution, Behavior and Systematics; Molecular Biology)",129,No
Generalist,Generalist,Interface Focus,https://royalsocietypublishing.org/journal/rsfs,Non-profit,The Royal Society Publishing,,,,Hybrid,2015,0.818,Q1 (Biophysics),78,No
Generalist,Generalist,The FASEB Journal,https://faseb.onlinelibrary.wiley.com/journal/15306860,For-profit Society-run,John Wiley & Sons,Federation of American Societies for Experimental Biology (FASEB),,USA,Hybrid,3153,1.319,Q1 (Biochemistry; Biotechnology; Genetics; Medicine),311,No
Generalist,Generalist,European Journal for Philosophy of Science,https://link.springer.com/journal/13194,For-profit Society-run,Springer Nature,European Philosophy of Science Association,Society,Germany / UK,Hybrid,,0.971,Q1 (History and Philosophy of Science; Philosophy),32,No
Generalist,Generalist,Clinical Science,https://portlandpress.com/clinsci,Non-profit,Portland Press,The Biochemical Society,Society,UK,Hybrid,2333,1.834,Q1 (Medicine),166,No
Generalist,Generalist,BMC Women's Health,https://bmcwomenshealth.biomedcentral.com/,For-profit,Springer Nature (BioMed Central),,,UK,OA,1948,0.925,Q1 (Medicine; Obstetrics and Gynecology; Reproductive Medicine),73,No
Generalist,Generalist,Bioscience,https://academic.oup.com/bioscience?login=false,University Press,Oxford University Press (OUP),,,UK,Hybrid,5289,2.365,Q1 (Agricultural and Biological Sciences),250,No
