Journal's MAIN field,Field,Journal,Website,Publisher type,Publisher,Institution,Institution type,Country,Business model,Scimago Journal Title,APC Euros,Scimago Rank,Scimago Quartile,H index,PCI partner
Genetics & Genomics,Generalist,Plos Genetics,https://journals.plos.org/plosgenetics/,Non-profit,Public Library of Science (PLoS),,,USA,OA,,2419,1.945,"Q1 (Cancer Research; Ecology, Evolution, Behavior and Systematics; Genetics; Molecular Biology)",282,No
Genetics & Genomics,Generalist,Nature Genetics,https://www.nature.com/ng/,For-profit,Springer Nature,,,Germany,Hybrid,,9249,16.586,Q1 (Genetics),660,No
Genetics & Genomics,Generalist,Nature Reviews Genetics,https://www.nature.com/nrg/,For-profit,Springer Nature,,,Germany/UK,,,,16.364,Q1 (Genetics; Molecular Biology),439,No
Genetics & Genomics,Genomics,Genome Biology,https://genomebiology.biomedcentral.com/,For-profit,Springer Nature (BioMed Central),,,UK,OA,,3778,5.71,"Q1 (Cell Biology; Ecology, Evolution, Behavior and Systematics; Genetics)",319,No
Genetics & Genomics,Medical Genetics,Genome Medicine,https://genomemedicine.biomedcentral.com/,For-profit,Springer Nature (BioMed Central),,,UK,OA,,3694,5.078,Q1 (Genetics; Molecular Biology; Molecular Medicine),133,No
Genetics & Genomics,Human Genetics,American Journal of Human Genetics,https://www.cell.com/ajhg/,For-profit,Elsevier (Cell Press),,,USA,Hybrid,,4686,4.531,Q1 (Genetics),339,No
Genetics & Genomics,Medical Genetics,Genetics in Medicine,https://www.nature.com/gim/,For-profit,Elsevier,,,Netherlands,OA,,2733,2.683,Q1 (Genetics; Medicine),167,No
Genetics & Genomics,Human Genetics,Human Molecular Genetics,https://academic.oup.com/hmg/,University Press,Oxford University Press (OUP),,,UK,Hybrid,,2762,1.56,Q1 (Genetics; Medicine; Molecular Biology),307,No
Genetics & Genomics,Generalist,Genome Research,https://genome.cshlp.org/,Non-profit,Cold Spring Harbor Laboratory Press,,,,Hybrid,,3869,3.909,Q1 (Genetics),338,No
Genetics & Genomics,Generalist,Trends in Genetics,https://www.cell.com/trends/genetics,For-profit,Elsevier (Cell Press),,,USA,Hybrid,,5969,3.928,Q1 (Genetics),253,No
Genetics & Genomics,Generalist,Genes & Development,https://genesdev.cshlp.org/,Non-profit,Cold Spring Harbor Laboratory Press,,,,Hybrid,,2425,4.005,Q1 (Developmental Biology; Genetics),489,No
Genetics & Genomics,Generalist,Molecular Biology and Evolution,https://academic.oup.com/mbe/,University Press Society-Run,Oxford University Press (OUP),Society for Molecular Biology and Evolution,Society,UK,OA,,2673,4.085,"Q1 (Ecology, Evolution, Behavior and Systematics; Genetics; Molecular Biology)",256,No
Genetics & Genomics,Human Genetics,Annual Review of Genomics and Human Genetics,https://www.annualreviews.org/content/journals/genom,Non-profit,Annual Reviews,,,USA,,,,4.28,Q1 (Genetics; Molecular Biology),134,No
Genetics & Genomics,Genomics,Cell Genomics,https://www.cell.com/cell-genomics,For-profit,Elsevier (Cell Press),,,USA,OA,,3717,6.238,"Q1 (Biochemistry, Genetics and Molecular Biology; Genetics)",31,No
Genetics & Genomics,Generalist,Nucleic Acids Research,https://academic.oup.com/nar/,University Press,Oxford University Press (OUP),,,UK,OA,,3336,7.776,Q1 (Genetics),675,No
Genetics & Genomics,Human Genetics,Human Genomics,https://humgenomics.biomedcentral.com/,For-profit,Springer Nature (BioMed Central),Human Genome Organisation (HUGO),,UK,OA,,2509,1.381,Q1 (Drug Discovery; Genetics; Molecular Medicine),73,No
Genetics & Genomics,Genomics,Genomics Proteomics & Bioinformatics,https://www.sciencedirect.com/journal/genomics-proteomics-and-bioinformatics,University Press Society-Run,Oxford University Press (OUP),"Beijing Institute of Genomics, Chinese Academy of Sciences; China National Center for Bioinformation; Genetics Society of China",Society,UK,OA,,2056,3.964,Q1 (Biochemistry; Computational Mathematics; Genetics; Medicine; Molecular Biology),80,No
Genetics & Genomics,Genetics,Frontiers in Genetics,https://www.frontiersin.org/journals/genetics,For-profit,Frontiers Media SA,,,Switzerland,OA,,2524,0.863,Q2 (Genetics; Molecular Medicine),135,No
Genetics & Genomics,Genomics,Genome Biology and Evolution,https://academic.oup.com/gbe/,University Press Society-Run,Oxford University Press (OUP),Society for Molecular Biology and Evolution,Society,UK,OA,,2275,1.173,"Q1 (Ecology, Evolution, Behavior and Systematics)",103,PCI friendly
Genetics & Genomics,Human Genetics,Human Mutation,https://onlinelibrary.wiley.com/journal/10981004,For-profit,John Wiley & Sons,,,USA,Hybrid,,3291,1.832,Q1 (Genetics),189,No
Genetics & Genomics,Genomics,Chromosome Research,https://link.springer.com/journal/10577,For-profit,Springer Nature,,,Germany/UK,Hybrid,,3060,1.063,Q2 (Genetics),91,No
Genetics & Genomics,Human Genetics,European Journal of Human Genetics,https://www.nature.com/ejhg/,For-profit,Springer Nature,,,Germany/UK,Hybrid,,2706,1.603,Q1 (Genetics),147,No
Genetics & Genomics,Medical Genetics,Journal of Medical Genetics,https://jmg.bmj.com/,Non-profit,BMJ Group,,,UK,Hybrid,,3113,1.62,Q1 (Genetics),194,No
Genetics & Genomics,Genetics,Genetics,https://academic.oup.com/genetics,University Press,Oxford University Press (OUP),,,UK,Hybrid,,3035,2.272,Q1 (Genetics),283,PCI friendly
Genetics & Genomics,Medical Genetics,Gene Therapy,https://www.nature.com/gt/,For-profit,Springer Nature,,,Germany/UK,Hybrid,,3105,1.784,Q1 (Genetics; Molecular Biology; Molecular Medicine),177,No
Genetics & Genomics,Medical Genetics,Mutation Research - Reviews in Mutation Research,https://www.sciencedirect.com/journal/mutation-research-reviews-in-mutation-research,For-profit,Elsevier,,,Netherlands,Hybrid,,3119,1.882,"Q1 (Genetics; Health, Toxicology and Mutagenesis)",143,No
Genetics & Genomics,Epigenetics,Epigenetics & Chromatin,https://epigeneticsandchromatin.biomedcentral.com/,For-profit,Springer Nature (BioMed Central),,,UK,OA,,2319,1.781,Q1 (Genetics; Molecular Biology),70,No
Genetics & Genomics,Medical Genetics,Molecular Therapy Advances,https://www.cell.com/molecular-therapy-family/methods,For-profit,Elsevier (Cell Press),,,USA,,,,,,,No
Genetics & Genomics,Human Genetics,Human Genetics and Genomics Advances,https://www.cell.com/molecular-therapy-family/methods,For-profit Society-run,Elsevier (Cell Press),American Society for Human Genetics,Society/Association,USA,OA,,2751,1.88,Q1 (Genetics; Molecular Medicine),18,No
Genetics & Genomics,Generalist,Annual Review of Genetics,https://www.annualreviews.org/journal/genet,Non-profit,Annual Reviews,,,,,,,6.455,Q1 (Genetics),208,No
Genetics & Genomics,Genomics,DNA Research,https://academic.oup.com/dnaresearch,University Press,Oxford University Press (OUP),Kazusa DNA Research Institute,,UK,OA,,555,1.216,Q1 (Medicine),116,No
Genetics & Genomics,Human Genetics,Journal of Human Genetics,https://www.nature.com/jhg/,For-profit,Springer Nature,,,Germany,Hybrid,,2491,1.012,Q2 (Genetics),96,No
Genetics & Genomics,Genetics,Genes to Cells,https://onlinelibrary.wiley.com/journal/13652443,For-profit,John Wiley & Sons,,,USA,Hybrid,,3167,0.694,Q2 (Medicine),125,No
Genetics & Genomics,Medical Genetics,Genetic Epidemiology,https://onlinelibrary.wiley.com/journal/10982272,For-profit,John Wiley & Sons,,,USA,OA,,2732,0.97,Q2 (Epidemiology; Genetics),108,No
Genetics & Genomics,Medical Genetics,Molecular Genetics & Genomic Medicine,https://onlinelibrary.wiley.com/journal/23249269,For-profit,John Wiley & Sons,,,USA,OA,,1869,0.611,Q3 (Genetics; Molecular Biology),46,No
Genetics & Genomics,Genomics,Frontiers in Genome Editing,https://www.frontiersin.org/journals/genome-editing,For-profit,Frontiers Media SA,,,Switzerland,OA,,1547,1.329,Q1 (Biotechnology; Genetics),25,No
Genetics & Genomics,Genomics,Human Genome Variation,https://www.nature.com/hgv/,For-profit Society-Run,Springer Nature,The Japan Society of Human Genetics,Society,Germany/UK,OA,,1149,0.483,Q3 (Biochemistry; Genetics; Molecular Biology),25,No
Genetics & Genomics,Generalist,Nature Microbiology,https://www.nature.com/nmicrobiol/,For-profit,Springer Nature,,,Germany/UK,Hybrid,,10742,6.893,Q1 (Applied Microbiology and Biotechnology; Cell Biology; Genetics; Immunology; Microbiology),157,No
Genetics & Genomics,Generalist,Systematic Biology,https://academic.oup.com/sysbio/,University Press,Oxford University Press (OUP),,,UK,Hybrid,,1497,2.945,"Q1 (Ecology, Evolution, Behavior and Systematics; Genetics)",208,No
Genetics & Genomics,Generalist,Molecular Ecology Resources,https://onlinelibrary.wiley.com/journal/17550998,For-profit,John Wiley & Sons,,,USA,Hybrid,,3184,2.281,"Q1 (Biotechnology; Ecology, Evolution, Behavior and Systematics; Genetics)",172,No
Genetics & Genomics,Generalist,Evolution Letters,https://academic.oup.com/evlett/,University Press Society-Run,Oxford University Press (OUP),Society for the Study of Evolution; European Society for Evolutionary Biology,Society,UK,OA,,1945,1.611,"Q1 (Ecology, Evolution, Behavior and Systematics; Genetics)",37,PCI friendly
Genetics & Genomics,Genomics,BMC Genomics,https://bmcgenomics.biomedcentral.com/,For-profit,Springer Nature (BioMed Central),,,UK,OA,,2226,1.003,Q1 (Biotechnology),208,No
Genetics & Genomics,Genomics,Genomics,https://www.sciencedirect.com/journal/genomics,For-profit,Elsevier,,,Netherlands,OA,,1860,0.847,Q2 (Genetics),160,No
Genetics & Genomics,Genomics,Functional & Integrative Genomics,https://link.springer.com/journal/10142,For-profit,Springer Nature,,,Germany/UK,Hybrid,,2624,0.721,Q2 (Genetics; Medicine),89,No
Genetics & Genomics,Genomics,BMC Genomic data,https://bmcgenet.biomedcentral.com/,For-profit,Springer Nature (BioMed Central),,,UK,OA,,1411,0.616,Q3 (Genetics; Health Informatics),96,No
Genetics & Genomics,Generalist,Computational and Structural Biotechnology Journal,https://www.journals.elsevier.com/computational-and-structural-biotechnology-journal,For-profit,Elsevier,Research Network of Computational and Structural Biotechnology,,Netherlands,OA,,2667,1.561,Q1 (Biochemistry; Biophysics; Biotechnology; Computer Science Applications; Genetics; Structural Biology),92,No
Genetics & Genomics,Generalist,Cell Systems,https://www.cell.com/cell-systems,For-profit,Elsevier (Cell Press),,,USA,Hybrid,,6098,4.943,Q1 (Cell Biology; Histology; Pathology and Forensic Medicine),98,No
Genetics & Genomics,Generalist,Molecular Systems Biology,https://www.embopress.org/journal/17444292,For-profit,Springer Nature,EMBO,,Germany/UK,OA,,4490,4.783,"Q1 (Agricultural and Biological Sciences; Applied Mathematics; Biochemistry, Genetics and Molecular Biology; Computational Theory and Mathematics; Immunology and Microbiology; Information Systems; Medicine)",178,No
Genetics & Genomics,Medical Genetics,BMC Medical Genomics,https://bmcmedgenomics.biomedcentral.com/,For-profit,Springer Nature (BioMed Central),,,UK,OA,,2620,0.701,Q3 (Genetics),99,No
Genetics & Genomics,Genetics,Genetics Selection Evolution,https://gsejournal.biomedcentral.com/,For-profit,Springer Nature (BioMed Central),French National Institute for Agricultural Research,,UK,OA,,1650,0.903,"Q1 (Animal Science and Zoology; Ecology, Evolution, Behavior and Systematics; Medicine)",91,PCI friendly
Genetics & Genomics,Plant Genetics,The Plant Genome,https://acsess.onlinelibrary.wiley.com/journal/19403372,For-profit Society-Run,John Wiley & Sons,Crop Science Society of America,Society,USA,OA,,1880,1.074,Q1 (Agronomy and Crop Science; Plant Science),73,No
Genetics & Genomics,Genomics,Evolutionary Applications,https://onlinelibrary.wiley.com/journal/17524571,For-profit,John Wiley & Sons,,,USA,OA,,2465,1.362,"Q1 (Agricultural and Biological Sciences; Ecology, Evolution, Behavior and Systematics; Genetics)",95,No
Genetics & Genomics,Generalist,Hereditas,https://hereditasjournal.biomedcentral.com/,For-profit Society-Run,Springer Nature (BioMed Central),The Mendelian Society of Lund,Society,UK,OA,,1831,0.596,Q2 (Medicine),57,No
Genetics & Genomics,Genetics,Heredity,https://www.nature.com/hdy/,For-profit,Springer Nature,,,Germany/UK,OA,,2803,1.073,Q2 (Genetics),140,No
Genetics & Genomics,Genetics,Animal Genetics,https://onlinelibrary.wiley.com/journal/13652052,For-profit,John Wiley & Sons,,,USA,Hybrid,,2970,0.591,Q1 (Animal Science and Zoology),95,No
Genetics & Genomics,Genomics,Cytogenetic and Genome Research,https://karger.com/CGR,For-profit,Karger Publishers,,,Switzerland,Hybrid,,2926,0.387,Q3 (Genetics),99,No
Genetics & Genomics,Epigenetics,Epigenomics,https://www.tandfonline.com/journals/iepi20,For-profit,Taylor & Francis Group,,,USA,Hybrid,,2828,0.69,Q3 (Cancer Research; Genetics),82,No
Genetics & Genomics,Epigenetics,Clinical Epigenetics,https://clinicalepigeneticsjournal.biomedcentral.com/,For-profit Society-Run,Springer Nature (BioMed Central),Clinical Epigenetics Society,Society,UK,OA,,2405,1.833,Q1 (Developmental Biology; Genetics; Molecular Biology),86,No
Genetics & Genomics,Epigenetics,Frontiers in Epigenetics and Epigenomics,https://www.frontiersin.org/journals/epigenetics-and-epigenomics,For-profit,Frontiers Media SA,,,Switzerland,OA,,1963,,,,No
Genetics & Genomics,Genetics,Genetics Research,https://onlinelibrary.wiley.com/journal/gr,For-profit,John Wiley & Sons,,,UK,OA,,,,-,75,No
Genetics & Genomics,Medical Genetics,npj Genomic Medicine,https://www.nature.com/npjgenmed/,For-profit,Springer Nature,"Center of Excellence in Genomic Medicine Research, King Abdulaziz University",,Germany/UK,OA,,3001,2.178,Q1 (Genetics; Molecular Biology),46,No
Genetics & Genomics,Genetics,Genes and Immunity,https://www.nature.com/gene/,For-profit,Springer Nature,,,UK,Hybrid,,2619,1.672,Q1 (Genetics; Immunology),111,No
Genetics & Genomics,Epigenetics,Epigenetics,https://www.tandfonline.com/journals/kepi20,For-profit,Taylor & Francis Group,,,USA,OA,,2914,1.071,Q1 (Medicine),117,No
Genetics & Genomics,Generalist,NAR Genomics & Bioinformatics,https://academic.oup.com/nargab,University Press,Oxford University Press (OUP),,,UK,OA,,2239,2.179,Q1 (Applied Mathematics; Computer Science Applications; Genetics; Molecular Biology; Structural Biology),31,No
Genetics & Genomics,Generalist,"G3: Genes, Genomes, Genetics",https://academic.oup.com/g3journal,University Press Society-Run,Oxford University Press (OUP),Genetics Society of America,Society,UK,OA,,2190,0.812,Q2 (Genetics; Medicine),91,PCI friendly
Genetics & Genomics,Genomics,Briefings in Functional Genomics,https://academic.oup.com/bfg,University Press,Oxford University Press (OUP),,,UK,Hybrid,,2590,0.86,Q2 (Biochemistry; Genetics; Medicine; Molecular Biology),87,No
Genetics & Genomics,Plant Genetics,Plant Gene,https://www.sciencedirect.com/journal/plant-gene,For-profit,Elsevier,,,Netherlands,Hybrid,,981,0.52,Q2 (Plant Science),36,No
Genetics & Genomics,Generalist,Current Opinion in Genetics & Development,https://www.sciencedirect.com/journal/current-opinion-in-genetics-and-development,For-profit,Elsevier,,,Netherlands,Hybrid,,3096,2.094,Q1 (Developmental Biology; Genetics),203,No
Genetics & Genomics,Generalist,BioEssays,https://onlinelibrary.wiley.com/journal/15211878,For-profit,John Wiley & Sons,,,USA,Hybrid,,2798,1.299,"Q1 (Biochemistry, Genetics and Molecular Biology)",208,No
Genetics & Genomics,Genetics,Genesis: The Journal of Genetics and Development,https://onlinelibrary.wiley.com/journal/1526968x,For-profit,John Wiley & Sons,,,USA,Hybrid,Genesis (United States),2437,0.747,Q2 (Endocrinology; Genetics; Medicine),126,No
Genetics & Genomics,Plant Genetics,Plant Genetic Resources,https://www.cambridge.org/core/journals/plant-genetic-resources,University Press,Cambridge University Press (CUP),,,UK,,Plant Genetic Resources: Characterisation and Utilisation,,0.275,Q3 (Agronomy and Crop Science; Plant Science),44,No
Genetics & Genomics,Human Genetics,Twin Research and Human Genetics,https://www.cambridge.org/core/journals/twin-research-and-human-genetics,University Press,Cambridge University Press (CUP),,,UK,Hybrid,,1283,0.372,"Q3 (Obstetrics and Gynecology; Pediatrics, Perinatology and Child Health)",95,No
Genetics & Genomics,Epigenetics,Epigenetics Insights,https://journals.sagepub.com/home/gaeb,For-profit,Sage Publishing,,,USA,OA,,1190,0.81,Q2 (Biochemistry; Genetics),15,No
Genetics & Genomics,Molecular and Cellular Genetics,The CRISPR Journal,https://journals.sagepub.com/home/tcja,For-profit,Sage Publishing,,,USA,Hybrid,,2818,1.744,Q1 (Biotechnology; Genetics),22,No
Genetics & Genomics,Molecular and Cellular Genetics,DNA and Cell Biology,https://journals.sagepub.com/home/dnaa,For-profit,Sage Publishing,,,USA,Hybrid,,3233,0.637,Q2 (Medicine),90,No
Genetics & Genomics,Genetics,Fungal Genetics and Biology,https://www.sciencedirect.com/journal/fungal-genetics-and-biology,For-profit,Elsevier,,,Netherlands,Hybrid,,1972,0.696,Q2 (Microbiology),129,No
Genetics & Genomics,Medical Genetics,Psychiatric Genetics,https://journals.lww.com/psychgenetics/pages/default.aspx,For-profit,Wolters Kluwer Medknow Publications,,,,Hybrid,,2092,0.468,Q3 (Genetics; Psychiatry and Mental Health),65,No
Genetics & Genomics,Genetics,Virus Genes,https://link.springer.com/journal/11262,For-profit,Springer Nature,,,Germany/UK,Hybrid,,2554,0.509,Q3 (Genetics; Medicine; Molecular Biology; Virology),67,No
Genetics & Genomics,Molecular and Cellular Genetics,Mutagenesis,https://academic.oup.com/mutage,University Press Society-run,Oxford University Press (OUP),UK Environmental Mutagen Society,Society/Association,UK,Hybrid,,3066,0.932,"Q2 (Genetics; Health, Toxicology and Mutagenesis; Toxicology)",103,No
Genetics & Genomics,Molecular and Cellular Genetics,Molecular Genetics and Metabolism Reports,https://www.sciencedirect.com/journal/molecular-genetics-and-metabolism-reports,For-profit,Elsevier,,,USA,OA,,1882,0.685,Q3 (Endocrinology; Genetics; Molecular Biology),34,No
Genetics & Genomics,Molecular and Cellular Genetics,Molecular Genetics and Metabolism,https://www.sciencedirect.com/journal/molecular-genetics-and-metabolism,For-profit Society-run,Elsevier,Society for Inherited Metabolic Disorders,Society/Association,Netherlands,Hybrid,,2971,0.915,"Q2 (Biochemistry; Endocrinology; Endocrinology, Diabetes and Metabolism; Genetics; Molecular Biology)",129,No
Genetics & Genomics,Molecular and Cellular Genetics,Molecular Cytogenetics,https://molecularcytogenetics.biomedcentral.com/,For-profit,Springer Nature (BioMed Central),,,UK,OA,,1928,0.408,Q3 (Biochemistry; Genetics),40,No
Genetics & Genomics,Genomics,Microbial Genomics,https://www.microbiologyresearch.org/content/journal/mgen,Non-profit,Microbiology Society,,,UK,OA,,2044,1.539,Q1 (Epidemiology; Genetics; Microbiology; Molecular Biology),57,No
Genetics & Genomics,Genomics,Physiological Genomics,https://journals.physiology.org/journal/physiolgenomics,Non-profit,American Physiological Society,American Physiological Society,Society/Association,USA,Hybrid,,1548,0.911,Q2 (Genetics; Physiology),129,No
Genetics & Genomics,Neurogenetics,Journal of Neurogenetics,https://www.tandfonline.com/journals/ineg20,For-profit,Taylor & Francis Group,,,UK,Hybrid,,2250,0.542,Q3 (Genetics),44,No
Genetics & Genomics,Medical Genetics,European Journal of Medical Genetics,https://www.sciencedirect.com/journal/european-journal-of-medical-genetics,For-profit,Elsevier,,,Netherlands,Hybrid,,2162,0.748,Q2 (Genetics; Medicine),67,No
Genetics & Genomics,Medical Genetics,Journal of Inherited Metabolic Disease,https://onlinelibrary.wiley.com/journal/15732665,For-profit Society-run,John Wiley & Sons,Society for the Study of Inborn Errors of Metabolism (SSIEM),Society/Association,USA,Hybrid,,2464,1.234,Q1 (Genetics),125,No
Genetics & Genomics,Generalist,Journal of Genetics and Genomics,https://www.sciencedirect.com/journal/journal-of-genetics-and-genomics,For-profit,Elsevier,,,Netherlands,Hybrid,,3433,1.882,Q1 (Genetics; Molecular Biology),82,No
Genetics & Genomics,Genetics,Journal of Experimental Zoology Part A: Ecological and Integrative Physiology,https://onlinelibrary.wiley.com/journal/24715646,For-profit,John Wiley & Sons,,,USA,Hybrid,Journal of Experimental Zoology Part A: Ecological and Integrative Physiology,3095,0.647,Q1 (Animal Science and Zoology),28,No
Genetics & Genomics,Human Genetics,Human Heredity,https://karger.com/HHE/,For-profit,Karger Publishers,,,Switzerland,Hybrid,,1380,0.484,Q3 (Genetics),66,No
Genetics & Genomics,Human Genetics,Human Genetics,https://link.springer.com/journal/439,For-profit,Springer Nature,,,Germany / UK,Hybrid,,3598,1.597,Q1 (Genetics),155,No
Genetics & Genomics,Medical Genetics,Human Gene Therapy,https://home.liebertpub.com/publications/human-gene-therapy/19/overview,For-profit,Sage Publishing (Mary Ann Liebert),,,USA,Hybrid,,2848,1.137,Q2 (Genetics; Molecular Biology; Molecular Medicine),163,No
Genetics & Genomics,Genetics,Gene,https://www.sciencedirect.com/journal/gene,For-profit,Elsevier,,,Netherlands,Hybrid,,3848,0.682,Q2 (Medicine),200,No
Genetics & Genomics,Epigenetics,Gene Expression Patterns,https://www.sciencedirect.com/journal/gene-expression-patterns,For-profit,Elsevier,,,Netherlands,Hybrid,,1550,0.342,Q4 (Developmental Biology; Genetics; Molecular Biology),70,No
Genetics & Genomics,Generalist,Genes and Development,https://genesdev.cshlp.org/,Non-profit,Cold Spring Harbor Laboratory Press,,,,Hybrid,,2425,4.005,Q1 (Developmental Biology; Genetics),489,No
Genetics & Genomics,Generalist,"Genes, Brain and Behavior",https://onlinelibrary.wiley.com/journal/1601183X,For-profit Society-run,John Wiley & Sons,International Behavioural and Neural Genetics Society,Society/Association,USA,Hybrid,,3267,0.861,Q2 (Behavioral Neuroscience; Genetics; Neurology),104,No
Genetics & Genomics,Medical Genetics,"Genes, Chromosomes and Cancer",https://onlinelibrary.wiley.com/journal/10982264,For-profit,John Wiley & Sons,,,USA,Hybrid,,2453,1.364,Q1 (Genetics),134,No
Genetics & Genomics,Genomics,Genomics and informatics,https://genomicsinform.biomedcentral.com/,For-profit Society-run,Springer Nature (BioMed Central),Korea Genome Organization,,UK,OA,,1990,0.439,"Q2 (Ecology, Evolution, Behavior and Systematics)",15,No
Genetics & Genomics,Medical Genetics,Familial Cancer,https://link.springer.com/journal/10689,For-profit Society-run,Springer Nature,International Society for Gastrointestinal Hereditary Tumours (InSIGHT); Breast Cancer Linkage Consortium (BCLC),Society/Association,Germany / UK,Hybrid,,2121,1.018,Q2 (Cancer Research; Genetics; Oncology),70,No
Genetics & Genomics,Generalist,Current Opinion in Genetics and Development,https://www.sciencedirect.com/journal/current-opinion-in-genetics-and-development,For-profit,Elsevier,,,Netherlands,Hybrid,,3096,2.094,Q1 (Developmental Biology; Genetics),203,No
Genetics & Genomics,Genomics,Comparative Biochemistry and Physiology Part D: Genomics Proteomics,https://www.sciencedirect.com/journal/comparative-biochemistry-and-physiology-part-d-genomics-and-proteomics,For-profit,Elsevier,,,Netherlands,Hybrid,,2803,0.598,Q1 (Animal Science and Zoology),52,No
Genetics & Genomics,Medical Genetics,Clinical Genetics,https://onlinelibrary.wiley.com/journal/13990004,For-profit,John Wiley & Sons,,,USA,Hybrid,,3239,1.093,Q2 (Genetics),121,No
Genetics & Genomics,Genetics,Behavior Genetics,https://link.springer.com/journal/10519,For-profit,Springer Nature,Behavior Genetics Association,Society/Association,Germany / UK,Hybrid,,2282,0.702,"Q1 (Ecology, Evolution, Behavior and Systematics)",106,No
Genetics & Genomics,Epigenetics,Biochimica et Biophysica Acta (BBA) - Gene Regulatory Mechanisms,https://www.sciencedirect.com/journal/biochimica-et-biophysica-acta-bba-gene-regulatory-mechanisms,For-profit,Elsevier,,,Netherlands,Hybrid,Biochimica et Biophysica Acta - Gene Regulatory Mechanisms,2733,1.229,Q1 (Biochemistry; Biophysics; Genetics),149,No
Genetics & Genomics,Generalist,Annals of Human Genetics,https://onlinelibrary.wiley.com/journal/14691809,For-profit,John Wiley & Sons,,,USA,Hybrid,,2007,0.513,Q3 (Genetics),80,No
Genetics & Genomics,Medical Genetics,American Journal of Medical Genetics Part C: Seminars in Medical Genetics,https://onlinelibrary.wiley.com/journal/15524876,For-profit,John Wiley & Sons,,,USA,Hybrid,,1695,0.799,Q2 (Genetics),119,No
Genetics & Genomics,Medical Genetics,American Journal of Medical Genetics Part B: Neuropsychiatric Genetics,https://onlinelibrary.wiley.com/journal/1552485X,For-profit,John Wiley & Sons,,,USA,Hybrid,,1849,0.658,Q2 (Psychiatry and Mental Health),140,No
Genetics & Genomics,Medical Genetics,American Journal of Medical Genetics Part A,https://onlinelibrary.wiley.com/journal/15524833,For-profit,John Wiley & Sons,,,USA,Hybrid,,2508,0.733,Q2 (Genetics),136,No
Genetics & Genomics,Genetics,Journal of Heredity,https://academic.oup.com/jhered,University Press,Oxford University Press (OUP),,,UK,Hybrid,,1196,1.021,Q1 (Biotechnology),105,No
Genetics & Genomics,Genomics,Mammalian Genome,https://link.springer.com/journal/335,For-profit Society-run,Springer Nature,International Mammalian Genome Society,Society/Association,Germany / UK,Hybrid,,2645,0.976,Q2 (Genetics),106,No
Genetics & Genomics,Genomics,Peer Community In Genomics,https://genomics.peercommunityin.org/,Non-profit,Peer Community In,Peer Community In,,France,,,,,,,No
