"Journal","Field","Publisher","Publisher type","Business model","Institution","Institution type","Website","APC Euros","Scimago Rank","PCI partner"
"ADLFI. Archeologie de la France - Informations","Archaeo Anthropo","OpenEdition","Non-profit","diamond_OA","French Ministry of Culture & CNRS","Uni/Gov","https://journals.openedition.org/adlfi/","0","","none"
"AOB Plants","Botany","Oxford University Press","University Press","OA","The Annals of Botany Company","Non-profit","https://academic.oup.com/aobpla/","1130","0.905","none"
"Acarologia","Zoology","Institut National de Recherche pour l'Agriculture l'Alimentation et l'Environnement","Non-profit","diamond_OA","Institut National de Recherche pour l'Agriculture l'Alimentation et l'Environnement","Uni/Gov","https://www1.montpellier.inra.fr/CBGP/acarologia/index.php","0","0.72","PCI friendly"
"Acta Amazonica","Basic Ecology","Instituto Nacional de Pesquisas da Amazonia","Non-profit","diamond_OA","Instituto Nacional de Pesquisas da Amazonia","Uni/Gov","https://acta.inpa.gov.br/","0","0.306","none"
"Acta Botanica Brasilica","Botany","Sociedade Botanica do Brasil","Non-profit","OA","Sociedade Botanica do Brasil","Society","https://acta.botanica.org.br/","148","0.484","none"
"Acta Chiropterologica","Zoology","Museum and Institute of Zoology / Polish Academy of Sciences","Non-profit","subscription","Museum and Institute of Zoology / Polish Academy of Sciences","Museum","https://bioone.org/journals/acta-chiropterologica/","","0.474","none"
"Acta Herpetologica","Zoology","Firenze University Press","University Press","diamond_OA","Societas Herpetologica Italica","Society","https://oaj.fupress.net/index.php/ah/index","0","0.456","none"
"Acta Ornithologica","Zoology","Museum and Institute of Zoology / Polish Academy of Sciences","Non-profit","subscription","Museum and Institute of Zoology / Polish Academy of Sciences","Museum","https://bioone.org/journals/acta-ornithologica/","","0.289","none"
"Acta Palaeobotanica","Paleo Geo","Acta Palaeobotanica","Non-profit","diamond_OA","Polish Academy of Sciences","Uni/Gov","https://acpa.botany.pl/","0","0.341","none"
"Acta Palaeontologica Polonica","Paleo Geo","Acta Palaeontologica Polonica","Non-profit","diamond_OA","Polish Academy of Sciences","Uni/Gov","https://www.app.pan.pl/home.html","0","0.694","none"
"Acta Parasitologica","Health","Springer","For-profit","hybrid","W. Stefanski Institute of Parasitology of the Polish Academy of Sciences","Society","https://www.springer.com/journal/11686","2390","0.439","none"
"Adansonia","Botany","Museum National d'Histoire Naturelle","Non-profit","diamond_OA","Museum National d'Histoire Naturelle","Museum","https://sciencepress.mnhn.fr/fr/periodiques/adansonia","0","0.239","PCI friendly"
"Advances in Archaeological Practice","Archaeo Anthropo","Cambridge University Press","University Press","hybrid","Society for American Archaeology","Society","https://www.cambridge.org/core/journals/advances-in-archaeological-practice","3064","","none"
"African Entomology","Zoology","Khulisa Journals","Non-profit","OA","Entomological Society of Southern Africa","Society","https://www.africanentomology.com/","490","0.434","none"
"African Invertebrates","Zoology","Pensoft","For-profit","OA","KwaZulu-Natal Museum","Museum","https://africaninvertebrates.pensoft.net/","300","0.253","none"
"African Journal of Ecology","Basic Ecology","Wiley","For-profit","hybrid","The East African Wildlife Society","Society","https://onlinelibrary.wiley.com/journal/13652028","2780","0.479","none"
"African Journal of Range & Forage Science","Applied Ecology","Taylor & Francis","For-profit","hybrid","Grassland Society of Southern Africa","Society","https://www.tandfonline.com/journals/tarf20","2895","0.381","none"
"African Journal of Wildlife Research","Applied Ecology","Southern African Wildlife Management Association","Non-profit","subscription","Southern African Wildlife Management Association","Society","https://sawma.co.za/scope-and-information/","400","0.31","none"
"African Zoology","Zoology","Taylor & Francis","For-profit","hybrid","Zoological Society of Southern Africa","Society","https://www.nisc.co.za/products/59/journals/african-zoology","955","0.335","none"
"Agriculture and Human Values","Archaeo Anthropo","Springer","For-profit","hybrid","Agriculture Food and Human Values Society","Society","https://link.springer.com/journal/10460","2890","1.035","none"
"Agronomy for Sustainable Development","Applied Ecology","Springer","For-profit","hybrid","Institut National de Recherche pour l'Agriculture l'Alimentation et l'Environnement","Uni/Gov","https://www.springer.com/journal/13593","2265","1.509","PCI friendly"
"Alcheringa","Paleo Geo","Taylor & Francis","For-profit","hybrid","Australasian Palaeontologists","Society","https://www.tandfonline.com/toc/talc20/current","3170","0.618","none"
"Alpine Botany","Botany","Springer","For-profit","hybrid","Swiss Botanical Society","Society","https://www.springer.com/journal/35","3060","0.732","none"
"Alpine Entomology","Zoology","Pensoft","For-profit","OA","Swiss Entomological Society","Society","https://alpineentomology.pensoft.net/","409","0.458","none"
"Alpine and Mediterranean Quaternary","Paleo Geo","Italian Association for Quaternary Research","Non-profit","diamond_OA","Italian Association for Quaternary Research","Society","http://amq.aiqua.it/","0","0.329","none"
"Ambio","Applied Ecology","Springer","For-profit","hybrid","Royal Swedish Academy of Sciences","Uni/Gov","https://www.springer.com/journal/13280","3190","1.77","none"
"Ameghiniana","Paleo Geo","Ameghiniana","Non-profit","hybrid","Argentinian Association of Paleontology","Society","https://ameghiniana.org.ar/index.php/ameghiniana","300","0.393","none"
"American Antiquity","Archaeo Anthropo","Cambridge University Press","University Press","hybrid","Society for American Archaeology","Society","https://www.cambridge.org/core/journals/american-antiquity","3064","1.278","none"
"American Fern Journal","Botany","American Fern Society","Non-profit","subscription","American Fern Society","Society","https://www.amerfernsoc.org/american-fern-journal","719","0.334","none"
"American Historical Review","Archaeo Anthropo","Oxford University Press","University Press","hybrid","American Historical Association","Society","https://academic.oup.com/ahr","4400","0.547","none"
"American Journal of Archaeology","Archaeo Anthropo","University of Chicago Press","University Press","subscription","Archaeological Institute of America","Society","https://www.ajaonline.org/","0","0.469","none"
"American Journal of Biological Anthropology","Archaeo Anthropo","Wiley","For-profit","hybrid","American Association of Biological Anthropologists","Society","https://onlinelibrary.wiley.com/journal/26927691","4020","1.084","none"
"American Journal of Botany","Botany","Wiley","For-profit","hybrid","Botanical Society of America","Society","https://bsapubs.onlinelibrary.wiley.com/journal/15372197","1800","1.213","none"
"American Journal of Human Biology","Archaeo Anthropo","Wiley","For-profit","hybrid","Human Biology Association","Society","https://onlinelibrary.wiley.com/journal/15206300","3450","","none"
"American Journal of Human Genetics","Genetics & Genomics","Cell Press","for-profit","","","","https://www.cell.com/ajhg/ ","","4.531",""
"American Journal of Primatology","Zoology","Wiley-Blackwell","For-profit","subscription","The American Society of Primatologists","Society","https://onlinelibrary.wiley.com/journal/10982345","","0.84","none"
"American Museum Novitates","Paleo Geo","American Museum of Natural History","Non-profit","diamond_OA","American Museum of Natural History","Museum","https://hdl.handle.net/2246/9","0","0.42","none"
"American Naturalist","Evolution","University of Chicago Press","University Press","hybrid","American Society of Naturalists","Society","https://www.journals.uchicago.edu/toc/an/current","2290","1.667","none"
"Amphibia-Reptilia","Zoology","Brill","For-profit","hybrid","Societas Europaea Herpetologica","Society","https://brill.com/view/journals/amre/amre-overview.xml","2295","0.628","none"
"Anais da Academia Brasileira de Ciencias","General","Academia Brasileira de Ciencias","Non-profit","subscription","The Brazilian Academy of Sciences (BAS)","non-profit","https://www.abc.org.br/en/publicacoes/anais-abc/","","0.378","none"
"Anatolian Studies","Archaeo Anthropo","Cambridge University Press","University Press","hybrid","British Institute at Ankara","Society","https://www.cambridge.org/core/journals/anatolian-studies","3000","","none"
"Anatolica","Archaeo Anthropo","Peeters Online Journals","For-profit","subscription","Netherlands Institute for the Near East","other","https://poj.peeters-leuven.be/content.php?url=journal&journal_code=ANA","0","","none"
"Anatomical Record","Zoology","Wiley","For-profit","hybrid","American Association of Anatomists","Society","https://anatomypubs.onlinelibrary.wiley.com/journal/19328494","3150","0.608","none"
"Ancient Society","Archaeo Anthropo","Peeters Online Journals","For-profit","subscription","Ancient History section of the Katholieke Universiteit Leuven","Uni/Gov","https://poj.peeters-leuven.be/content.php?url=journal&journal_code=AS","0","","none"
"Andean Geology","Paleo Geo","Servicio Nacional de Geologia y Mineria de Chile","Non-profit","diamond_OA","Sociedad Geologica de Chile","Society","http://www.andeangeology.cl/index.php/revista1/index","0","0.45","none"
"Animal","Zoology","Elsevier","For-profit","OA","British Society of Animal Science / European Association for Animal Production / Institut National de Recherche pour l'Agriculture l'Alimentation et l'Environnement","Society","https://bsas.org.uk/publications/animal","1400","0.834","PCI friendly"
"Animal Behaviour","Basic Ecology","Elsevier","For-profit","hybrid","Association for the Study of Animal Behaviour","Society","https://www.journals.elsevier.com/animal-behaviour","2740","1.068","none"
"Animal Biodiversity and Conservation","Evolution","Museu de Ciencies Naturals de Barcelona","Non-profit","diamond_OA","Museu de Ciencies Naturals de Barcelona","Museum","http://abc.museucienciesjournals.cat/about/?lang=en","0","0.356","none"
"Animal Cognition","Cognitive (Neuro)Science","Springer Nature","for-profit","gold_OA","Springer Nature","","https://link.springer.com/journal/10071","2690","0.795",""
"Animal Conservation","Applied Ecology","Wiley","For-profit","hybrid","Zoological Society of London","Society","https://zslpublications.onlinelibrary.wiley.com/journal/14691795","3550","1.213","none"
"Animal Genetics","Genetics & Genomics","Wiley-Blackwell Publishing Ltd","for-profit","","","","https://onlinelibrary.wiley.com/journal/13652052 ","","0.591",""
"Annales Botanici Fennici","Botany","BioOne","Non-profit","hybrid","Finnish Zoological and Botanical Publishing Board","Uni/Gov","http://www.sekj.org/AnnBot.html","600","0.307","none"
"Annales Zoologici","Zoology","BioOne","Non-profit","subscription","Museum and Institute of Zoology / Polish Academy of Sciences","Uni/Gov","https://miiz.waw.pl/en/26-wydawnictwa/annales-zoologici/173-azedt","","0.486","none"
"Annales Zoologici Fennici","Zoology","BioOne","Non-profit","hybrid","Finnish Zoological and Botanical Publishing Board","Uni/Gov","http://www.sekj.org/AnnZool.html","600","0.335","none"
"Annales de la Societe Entomologique de France","Zoology","Taylor & Francis","For-profit","hybrid","Societe Entomologique de France","Society","https://www.tandfonline.com/toc/tase20/current","3190","0.484","none"
"Annals of Anatomy - Anatomischer Anzeiger","Zoology","Elsevier","For-profit","hybrid","Anatomische Gesellschaft","Society","https://www.sciencedirect.com/journal/annals-of-anatomy-anatomischer-anzeiger","3850","","none"
"Annals of Botany","Botany","Oxford University Press","University Press","hybrid","The Annals of Botany Company","Non-profit","https://academic.oup.com/aob","2938","1.271","none"
"Annals of Forest Science","Basic Ecology","Springer Nature","For-profit","OA","Institut National de Recherche pour l'Agriculture l'Alimentation et l'Environnement","Uni/Gov","https://annforsci.biomedcentral.com/","1750","0.802","PCI friendly"
"Annals of Neurology","Neurology","John Wiley & Sons & Wiley-Blackwell","for-profit","hybrid","American Neurological Association and the Child Neurology Society","","","3890","3.736",""
"Annals of Oncology","Cancer Biology","Elsevier Ltd","for-profit","","","","https://academic.oup.com/annonc","","19.072",""
"Annals of the Entomological Society of America","Zoology","Oxford University Press","University Press","hybrid","Entomological Society of America","Society","https://academic.oup.com/aesa","1184","0.492","none"
"Annals of the New York Academy of Sciences","General","Wiley","For-profit","hybrid","The New York Academy of Science","Society","https://nyaspubs.onlinelibrary.wiley.com/journal/17496632","4170","","none"
"Annual Review of Animal Biosciences","Zoology","Annual Reviews","Non-profit","subscription","Annual Reviews","Non-profit","https://www.annualreviews.org/journal/animal","","2.62","none"
"Annual Review of Cell and Developmental Biology","Development","Annual Reviews","non-profit","","","","https://www.annualreviews.org/journal/cellbio","","6.788",""
"Annual Review of Ecology Evolution and Systematics","Evolution","Annual Reviews","Non-profit","subscription","Annual Reviews","Non-profit","https://www.annualreviews.org/journal/ecolsys","","6.234","none"
"Annual Review of Entomology","Zoology","Annual Reviews","Non-profit","diamond_OA","Annual Reviews","Non-profit","https://www.annualreviews.org/journal/ento","","6.09","none"
"Annual Review of Genetics","Genetics","Annual Reviews","Non-profit","subscription","Annual Reviews","Non-profit","https://www.annualreviews.org/journal/genet","","7.34","none"
"Annual Review of Genomics and Human Genetics","Genetics","Annual Reviews","Non-profit","subscription","Annual Reviews","Non-profit","https://www.annualreviews.org/journal/genom","","5.196","none"
"Annual Review of Immunology","Immunology","Annual Reviews","non-profit","","–","","https://www.annualreviews.org/journal/immunol","","16.428",""
"Annual Review of Plant Biology","Plant Biology","","","","","","https://www.annualreviews.org/content/journals/arplant","","",""
"Annual of the British School at Athens","Archaeo Anthropo","Cambridge University Press","University Press","hybrid","British School at Athens","Uni/Gov","https://www.cambridge.org/core/journals/annual-of-the-british-school-at-athens","3000","","none"
"Anthropologica et Praehistorica","Archaeo Anthropo","Societe Royale Belge d'Anthropologie et de Prehistoire","Non-profit","diamond_OA","Societe Royale Belge d'Anthropologie et de PRehistoire","Society","https://biblio.naturalsciences.be/associated_publications/anthropologica-prehistorica","","",""
"Anthropozoologica","Archaeo Anthropo","Museum National d'Histoire Naturelle","Non-profit","diamond_OA","Museum National d'Histoire Naturelle","Museum","https://sciencepress.mnhn.fr/fr/periodiques/anthropozoologica","0","","PCI friendly"
"Antipoda. Revista de Antropologia y Arqueologia","Archaeo Anthropo","Universidad de los Andes","Non-profit","diamond_OA","School of Social Sciences of the Universidad de los Andes","Uni/Gov","https://revistas.uniandes.edu.co/index.php/antipoda","0","","none"
"Antiquity","Archaeo Anthropo","Cambridge University Press","University Press","hybrid","Antiquity Trust","Non-profit","https://antiquity.ac.uk/","3255","1.035","none"
"Apidologie","Zoology","Springer","For-profit","hybrid","Institut National de Recherche pour l'Agriculture l'Alimentation et l'Environnement / Deutscher Imkerbund","Uni/Gov","https://link.springer.com/journal/13592","2345","0.727","none"
"Applications in Plant Sciences","Botany","Wiley","For-profit","OA","Botanical Society of America","Society","https://bsapubs.onlinelibrary.wiley.com/journal/21680450","1680","0.68","none"
"Applied Vegetation Science","Applied Ecology","Wiley","For-profit","hybrid","International Association for Vegetation Science","Society","https://onlinelibrary.wiley.com/journal/1654109x","3260","0.74","none"
"Aquatic Ecosystem Health & Management","Applied Ecology","Michigan State University Press","University Press","subscription","Aquatic Ecosystem Health and Management Society","Society","https://msupress.org/journals/aquatic-ecosystem-health-and-management/","100","0.336","none"
"Aquatic Living Resources","Applied Ecology","EDP Science","For-profit","diamond_OA","Institut de Recherche pour le Developpement / Institut Fran√ßais de Recherche pour l'Exploitation de la Mer","Uni/Gov","https://www.alr-journal.org/","0","0.389","none"
"Arachnology","Zoology","British Arachnological Society","Non-profit","subscription","British Arachnological Society","Society","https://www.britishspiders.org.uk/arachnology","","0.45","none"
"Archaeofauna","Archaeo Anthropo","Universidad Autonoma de Madrid Editions","University Press","diamond_OA","Asociacion Espanola de Arqueozoologia","Society","https://revistas.uam.es/archaeofauna","0","","none"
"Archaeology Ethnology and Anthropology of Eurasia","Archaeo Anthropo","Russian Academy of Sciences","Non-profit","subscription","Russian Academy of Sciences","Uni/Gov","https://journal.archaeology.nsc.ru/jour","0","","none"
"Archaeometry","Archaeo Anthropo","Wiley","For-profit","hybrid","University of Oxford","Uni/Gov","https://onlinelibrary.wiley.com/journal/14754754","2620","","none"
"Archaologische Informationen","Archaeo Anthropo","Heidelberg University","Non-profit","diamond_OA","Heidelberg University","Uni/Gov","https://journals.ub.uni-heidelberg.de/index.php/arch-inf/index","0","","PCI friendly"
"Archaologisches Korrespondenzblatt","Archaeo Anthropo","Leibniz-Zentrum fur Archaologie","Non-profit","diamond_OA","Leibniz-Zentrum fur Archaologie","Museum","https://journals.ub.uni-heidelberg.de/index.php/ak","0","0.233","none"
"ArcheoScience - Revue d'archeometrie","Archaeo Anthropo","Presses universitaires de Rennes","University Press","diamond_OA","Groupe des Methodes Pluridisciplinaires Contribuant √† l'Archeologie","Society","https://journals.openedition.org/archeosciences/","0","","none"
"Archeologia e Calcolatori","Archaeo Anthropo","Edizioni All'Insegna del Giglio","Non-profit","diamond_OA","Italian National Research Council + Dipartimento di Archeologia e Storia delle Arti of the University of Siena","Uni/Gov","http://www.archcalc.cnr.it/","0","","none"
"Archeological Journal","Archaeo Anthropo","Routledge","For-profit","hybrid","Royal Archaeological Institute","Society","https://www.tandfonline.com/RAIJ","2895","","none"
"Archeologicke Rozhledy","Archaeo Anthropo","Institute of Archaeology of the Czech Academy of Sciences","Non-profit","diamond_OA","Institute of Archaeology of the Czech Academy of Sciences","Uni/Gov","https://archeologickerozhledy.cz/","0","","none"
"Architectural Histories","Archaeo Anthropo","Open Library of Humanities","Non-profit","diamond_OA","European Architectural History Network","Society","https://journal.eahn.org/","0","","none"
"Archives of Sexual Behavior","Basic Ecology","Springer","For-profit","hybrid","International Academy of Sex Research","Society","https://www.springer.com/journal/10508","2290","1.149","none"
"Archivo Espanol de Arqueologia","Archaeo Anthropo","CSIC","Non-profit","diamond_OA","Instituto de Historia¬†del¬†CCHS","Uni/Gov","https://aespa.revistas.csic.es/","0","","none"
"Ardea","Zoology","Netherland Ornithologist Union","Non-profit","hybrid","Netherland Ornithologist Union","Society","http://ardea.nou.nu/","600","0.42","none"
"Ardeola","Zoology","SEO/BirdLife","Non-profit","subscription","SEO/BirdLife","Non-profit","https://www.ardeola.org/en/","","0.516","none"
"Arqueologia","Archaeo Anthropo","Instituto de Arqueologia / Facultad de Filosofia y Letras / Universidad de Buenos Aires","Non-profit","diamond_OA","Universidad de Buenos Aires. Facultad de Filosofia y Letras. Instituto de Arqueologia","Uni/Gov","http://revistascientificas.filo.uba.ar/index.php/Arqueologia","0","","PCI friendly"
"Arthropod Systematics and Phylogeny","Zoology","Senckenberg","Non-profit","diamond_OA","Senckenberg Gesellschaft fur Naturforschung Dresden","Museum","https://arthropod-systematics.arphahub.com/","0","1.034","none"
"Arxius de Miscel-Lania Zoologica","Zoology","Museu de Ciencies Naturals de Barcelona","Non-profit","diamond_OA","Museu de Ciencies Naturals de Barcelona","Museum","https://museucienciesjournals.cat/en/amz/info/que-es","0","","none"
"Asian Perspectives","Archaeo Anthropo","University of Hawai'i Press","University Press","subscription","University of Hawaii","Uni/Gov","https://uhpress.hawaii.edu/title/ap/","0","","none"
"Austral Ecology","Basic Ecology","Wiley","For-profit","hybrid","Ecological Society of Australia","Society","https://onlinelibrary.wiley.com/journal/14429993","2650","0.643","none"
"Australian Archaeology","Archaeo Anthropo","Routledge","For-profit","hybrid","Australian Archaeological Association","Society","https://www.tandfonline.com/RAAA","2895","","none"
"Australian Journal of Zoology","Zoology","CSIRO publishing","Non-profit","hybrid","Commonwealth Scientific and Industrial Research Organisation","Uni/Gov","https://www.publish.csiro.au/zo","2500","0.335","none"
"Australian Systematic Botany","Botany","CSIRO publishing","Non-profit","hybrid","Commonwealth Scientific and Industrial Research Organisation","Uni/Gov","https://www.publish.csiro.au/SB","2500","0.551","none"
"Autoimmunity","Immunology","Taylor & Francis","For-profit","hybrid","","","https://www.tandfonline.com/journals/iaut20","2875","0.842",""
"Autoimmunity Reviews","Immunology","Elsevier","For-profit","hybrid","","","https://www.journals.elsevier.com/autoimmunity-reviews","","2.844",""
"Autophagy","Molecular & Cellular Biology","Taylor and Francis Ltd.","for-profit","","","","https://www.tandfonline.com/journals/kaup20","","4.447",""
"Avocetta","Zoology","Centro Italiano Studi Ornitologici","Non-profit","diamond_OA","Centro Italiano Studi Ornitologici","Non-profit","https://www.avocetta.org/","0","0.214","none"
"BEADS: Journal of the Society of Bead Researchers","Archaeo Anthropo","The Society of Bead Researchers","Non-profit","subscription","The Society of Bead Researchers","Society","http://beadresearchjournal.org/","0","","none"
"BMC Developmental Biology (intégré à Frontiers in Cell & Developmental Biology)","Development","BioMed Central Ltd","","","","","https://bmcdevbiol.biomedcentral.com/","","0.706",""
"BMC Genomic data","Genetics & Genomics","BMC","","oa","","","https://bmcgenet.biomedcentral.com/ ","1790","0.616",""
"BMC Genomics","Genetics & Genomics","BMC","","oa","","","https://bmcgenomics.biomedcentral.com/ ","2590","1.003",""
"BMC Immunology","Immunology","BioMed Central / Springer Nature","For-profit","OA","–","","https://bmcimmunol.biomedcentral.com/","2590","0.818",""
"BMC Medical Genomics","Genetics & Genomics","BMC","","oa","","","https://bmcmedgenomics.biomedcentral.com/ ","2790","0.701",""
"BMC Molecular and Cell Biology","Molecular & Cellular Biology","BMC","","oa","","","https://bmcmolcellbiol.biomedcentral.com/","1890","0.787",""
"BMC Plant Biology","Plant Biology","","","","","","https://bmcplantbiol.biomedcentral.com/","","",""
"Bangladesh Journal of Zoology","Zoology","Bangladesh Journals Online","Non-profit","diamond_OA","Zoological Society of Bangladesh","Society","https://www.banglajol.info/index.php/BJZ","0","","none"
"Basic and Applied Ecology","Basic Ecology","Elsevier","For-profit","OA","Ecological Society of Germany / Austria and Switzerland","Society","https://www.journals.elsevier.com/basic-and-applied-ecology","1676","0.933","none"
"Basin Research","Paleo Geo","Wiley","For-profit","hybrid","International Association of Sedimentologists / European Association of Geoscientists and Engineers.","Society","https://onlinelibrary.wiley.com/journal/13652117","3250","1.335","none"
"Bee World","Zoology","Taylor & Francis","For-profit","hybrid","International Bee Research Association","Non-profit","https://www.tandfonline.com/journals/tbee20","2895","","none"
"Behavior Genetics","Basic Ecology","Springer","For-profit","hybrid","Behavior Genetics Association","Society","https://www.springer.com/journal/10519","2390","0.866","none"
"Behavioral Ecology","Basic Ecology","Oxford University Press","University Press","hybrid","International Society for Behavioral Ecology","Society","https://academic.oup.com/beheco","3630","1.08","none"
"Behavioral Neuroscience","Neuroscience, Behavior","American Psychological Association","non-profit","hybrid","American Psychological Association","","https://www.apa.org/pubs/journals/bne","","0.867",""
"Belgian Journal of Zoology","Zoology","Royal Belgian Zoological Society","Non-profit","diamond_OA","Royal Belgian Zoological Society","Society","https://www.belgianjournalofzoology.eu/BJZ","0","0.328","PCI friendly"
"BioEssays","Development","Wiley","for-profit","hybrid","","","https://onlinelibrary.wiley.com/journal/15211878","4430","1.299",""
"Biochemical Journal","Molecular & Cellular Biology","Portland Press Ltd","","","","","https://portlandpress.com/biochemj","","2.064",""
"Biochimica et Biophysica Acta (BBA) – Molecular Cell Research","Molecular & Cellular Biology","","","","","","https://www.sciencedirect.com/journal/biochimica-et-biophysica-acta-bba-molecular-cell-research","","",""
"Biodiversity Information Science and Standards","Theory","Pensoft","For-profit","OA","Biodiversity Information Standards","Society","https://biss.pensoft.net/","560","","none"
"Bioengineering & Translational Medicine (stem & regen focus)","Development","Wiley","for-profit","oa","","","https://aiche.onlinelibrary.wiley.com/journal/23804793","2260","",""
"Biogeographia","Applied Ecology","eScholarship","Non-profit","diamond_OA","Italian Biogeography Society","Society","https://escholarship.org/uc/biogeographia","0","0.28","none"
