"Journal","Field","Publisher","Publisher type","Business model","Institution","Institution type","Country","Website","APC Euros","Scimago Rank","Scimago Quartile","H index","PCI partner"
"Journal of Biological Rhythms","Physiology","Sage Publishing","For-profit on behalf of a society","","Society for Research on Biological Rhythms","Society","USA","https://journals.sagepub.com/home/jbr","","","","",""
"Journal of Biological Systems","Generalist","World Scientific Publishing","For-profit","","","","Singapore","https://www.worldscientific.com/worldscinet/jbs","","","","",""
"Journal of Biomolecular NMR","Methods","Springer Nature","For-profit","Hybrid","","","Germany/UK","https://link.springer.com/journal/10858","","","","",""
"Journal of Biopharmaceutical Statistics","Methods","Taylor & Francis Group","For-profit","","","","USA","https://www.tandfonline.com/journals/lbps20","","","","",""
"Journal of Biophotonics","Methods","John Wiley & Sons","For-profit","","","","USA","https://onlinelibrary.wiley.com/journal/18640648","","","","",""
"Journal of Bone Oncology","Bone And Muscle Sarcoma","Elsevier","For-profit on behalf of a society","","Cancer and Bone Society","Society","Netherlands","https://www.sciencedirect.com/journal/journal-of-bone-oncology","","","","",""
"Journal of Breath Research","Physiology","Institute of Physics (IOP) Publishing","Non-profit","","International Association for Breath Research (IABR)","Society","UK","https://iopscience.iop.org/journal/1752-7163","","","","",""
"Journal of Bryology","Botany","Taylor & Francis Group","For-profit on behalf of a society","Hybrid","British Bryological Society","Society","USA","https://www.tandfonline.com/toc/yjbr20/current","3190","0.472","","",""
"Journal of Cachexia Sarcopenia Muscle","Clinical/Medicine","John Wiley & Sons","For-profit","","","","USA","https://onlinelibrary.wiley.com/journal/1353921906009","","","","",""
"Journal of Cancer Research & Therapeutics","Generalist","Wolters Kluwer Medknow","For-profit on behalf of a society","","the Association of Radiation Oncologists of India","Society","","https://journals.lww.com/cancerjournal/","","0.468","","",""
"Journal of Carcinogenesis","Cancer Biology","Wolters Kluwer Medknow","For-profit","","","","","https://carcinogenesis.com","","0.445","","",""
"Journal of Caribbean Ornithology","Zoology","BirdsCaribbean","Non-profit","OA","BirdsCaribbean","Society","","https://jco.birdscaribbean.org/index.php/jco/","120","","","",""
"Journal of Causal Inference","Methods","De Gruyter Brill","For-profit","","","","","https://www.degruyterbrill.com/journal/key/jci/html","","","","",""
"Journal of Cave and Karst Studies","Paleo Geo","National Speleological Society","Non-profit","OA diamond","National Speleological Society","Society","","https://caves.org/journal-of-cave-and-karst-studies/","0","","","",""
"Journal of Cell Biology","Cellular Biology","Rockefeller University Press","University Press","","","","","https://rupress.org/jcb","","3.359","","",""
"Journal of Cell Communication and Signalling","Generalist","John Wiley & Sons","For-profit on behalf of a society","","International CCN Society","Society","USA","https://onlinelibrary.wiley.com/journal/1873961X","","","","",""
"Journal of Cell Science","Cellular Biology","The Company of Biologists","Non-profit","Hybrid","","","UK","https://journals.biologists.com/jcs","4797","1.479","","",""
"Journal of Cellular Biochemistry","Cellular Biology","John Wiley & Sons","For-profit","","","","USA","https://onlinelibrary.wiley.com/journal/10974644","","0.782","","",""
"Journal of Cellular Physiology","Cellular Biology","John Wiley & Sons","For-profit","","","","USA","https://onlinelibrary.wiley.com/journal/10974652","","1.377","","",""
"Journal of Cellular and Molecular Medicine","Generalist","John Wiley & Sons","For-profit","OA","","","USA","https://onlinelibrary.wiley.com/journal/15824934","4390","1.264","","",""
"Journal of Central Nervous System Disease","Clinical Neuroscience","Sage Publishing","For-profit","OA","","","USA","https://journals.sagepub.com/home/cnsa","2294","1.016","","",""
"Journal of Chemical Ecology","Basic Ecology","Springer Nature","For-profit on behalf of a society","Hybrid","International Society of Chemical Ecology / Asia-Pacific Association of Chemical Ecologists / Latin American Association of Chemical Ecology","Society","Germany/UK","https://www.springer.com/journal/10886","2690","0.747","","",""
"Journal of Child Neurology","Developmental Neuroscience","Sage Publishing","For-profit","","-","","USA","https://journals.sagepub.com/home/jcna","","0.586","","",""
"Journal of Chromatography A","Methods","Elsevier","For-profit","","","","Netherlands","https://www.sciencedirect.com/journal/journal-of-chromatography-a","","","","",""
"Journal of Chromatography B Analytical Technologies in the Biomedical and Life Sciences","Methods","Elsevier","For-profit","","","","Netherlands","https://www.sciencedirect.com/journal/journal-of-chromatography-b","","","","",""
"Journal of Clinical Immunology","Clinical Immunology","Springer Nature","For-profit","","","","USA","https://link.springer.com/journal/10875","","1.928","","",""
"Journal of Clinical Microbiology","Molecular & Cellular Biology","American Society for Microbiology (ASM)","Non-profit","","American Society for Microbiology (ASM)","Society","USA","https://journals.asm.org/journal/jcm","","","","",""
"Journal of Clinical Oncology","Cancer Biology","American Society of Clinical Oncology","Non-profit","","American Society of Clinical Oncology","Society","USA","https://ascopubs.org/journal/jco","","11.205","","",""
"Journal of Clinical Virology","Virology","Elsevier","For-profit on behalf of a society","","Pan American Society for Clinical Virology; European Society for Clinical Virology","Society","Netherlands","https://www.sciencedirect.com/journal/journal-of-clinical-virology","","","","",""
"Journal of Coastal Conservation","Applied Ecology","Springer Nature","For-profit on behalf of a non-profit","Hybrid","Coastal & Marine Union","Non-profit","Germany/UK","https://www.springer.com/journal/11852","2290","0.522","","",""
"Journal of Coastal Research","Basic Ecology","Coastal Education and Research Foundation","Non-profit","Subscription","Coastal Education and Research Foundation","Society","","https://meridian.allenpress.com/jcr","","0.237","","",""
"Journal of Cognition","Cognitive Neuroscience","Ubiquity Press Ltd","Non-profit","OA","The European Society for Cognitive Psychology","Society","UK","https://journalofcognition.org/","1150","0.978","","",""
"Journal of Cognitive Neuroscience","Cognitive Neuroscience","MIT press direct","University Press","Hybrid","","","USA","https://direct.mit.edu/jocn","","1.276","","",""
"Journal of Cognitive Psychology","Cognitive Neuroscience","Taylor & Francis Group","For-profit","Hybrid","","","UK","https://www.tandfonline.com/journals/pcgn20","3249","0.598","","",""
"Journal of Comparative Neurology","Generalist","John Wiley & Sons","For-profit","","","","USA","https://onlinelibrary.wiley.com/journal/10969861","","","","",""
"Journal of Comparative Physiology A Neuroethology Sensory Neural and Behavioral Physiology","Physiology","Springer Nature","For-profit","Hybrid","","","Germany/UK","https://link.springer.com/journal/359","","","","",""
"Journal of Comparative Physiology B Biochemical Systemic and Environmental Physiology","Physiology","Springer Nature","For-profit","Hybrid","","","Germany/UK","https://link.springer.com/journal/360","","","","",""
"Journal of Comparative Psychology","Cognitive Neuroscience","American Psychological Association (APA)","Non-profit","Hybrid","American Psychological Association","Society","USA","https://www.apa.org/pubs/journals/com","","0.581","","",""
"Journal of Computational Biology","Generalist","Sage Publishing (Mary Ann Liebert)","For-profit","","","","","https://liebertpub.com/loi/cmb","","","","",""
"Journal of Computational Neuroscience","Methods","Springer Nature (BioMed Central)","For-profit","Hybrid","","","","https://link.springer.com/journal/10827","","","","",""
"Journal of Computational and Graphical Statistics","Theory","Taylor & Francis Group","For-profit on behalf of a society","Hybrid","American Statistical Association","Society","USA","https://www.tandfonline.com/toc/ucgs20/current","3190","1.72","","",""
"Journal of Computer Applications in Archaeology","Theory","Ubiquity Press","For-profit on behalf of a society","OA","Computer Applications in Archaeology","Society","","https://journal.caa-international.org/","500","","","","PCI friendly"
"Journal of Crohn's and Colitis","Clinical Immunology","Oxford University Press (OUP)","University Press","","","","","https://academic.oup.com/ecco-jcc?login=false","","","","",""
"Journal of Crustacean Biology","Zoology","Oxford University Press (OUP)","University Press on behalf of a society","Hybrid","The Crustacean Society","Society","","https://academic.oup.com/jcb","3569","0.432","","",""
"Journal of Developmental Origin of Health and Disease","Development","Cambridge University Press (CUP)","University Press","","-","","UK","https://www.cambridge.org/core/journals/journal-of-developmental-origins-of-health-and-disease","","0.627","","",""
"Journal of Developmental and Behavioral Pediatrics","Generalist","Wolters Kluwer (Lippincott)","For-profit on behalf of a society","","Society for Developmental and Behavioral Pediatrics","Society","","https://journals.lww.com/jrnldbp/pages/default.aspx","","","","",""
"Journal of ECT","Neuromodulation","Wolters Kluwer (Lippincott)","For-profit on behalf of a society","","International Society for ECT and Neurostimulation","Society","","https://journals.lww.com/ectjournal/pages/default.aspx","","","","",""
"Journal of Eastern Mediterranean Archaeology and Heritage Studies","Archaeo Anthropo","Penn State University Press","University Press on behalf of a university or government institution","Subscription","Penn State University","Uni/Gov","","https://www.psupress.org/journals/jnls_jemahs.html","0","","","",""
"Journal of Eating Disorders","Clinical Neuroscience","Springer Nature (BioMed Central)","For-profit","","","","","https://jeatdisord.biomedcentral.com/","","","","",""
"Journal of Ecohydraulics","Basic Ecology","Taylor & Francis Group","For-profit on behalf of a society","Hybrid","International Association for Hydro-Environment Engineering and Research","Society","USA","https://www.tandfonline.com/journals/tjoe20","3170","0.676","","",""
"Journal of Ecology","Basic Ecology","John Wiley & Sons","For-profit on behalf of a society","Hybrid","British Ecological Society","Society","USA","https://besjournals.onlinelibrary.wiley.com/journal/13652745","2830","2.193","","",""
"Journal of Economic Entomology","Applied Ecology","Oxford University Press (OUP)","University Press on behalf of a society","Hybrid","Entomological Society of America","Society","","https://academic.oup.com/jee/pages/About","3784","0.698","","",""
"Journal of Endocrinology","Generalist","Society for Endocrinology","Non-profit","","","","","https://joe.bioscientifica.com/","","","","",""
"Journal of Epidemiology","Epidemiology","Immunology","Non-profit","","Japan Epidemiological Association","Society","Japan","https://www.jstage.jst.go.jp/browse/jea/","","","","",""
"Journal of Epidemiology and Community Health","Epidemiology","BMJ Group","Non-profit","","","","UK","https://jech.bmj.com/","","","","",""
"Journal of Epidemiology and Global Health","Epidemiology","Springer Nature","For-profit","OA","","","Germany/UK","https://link.springer.com/journal/44197","","","","",""
"Journal of Epidemiology and Population Health","Epidemiology","Elsevier","For-profit","","","","Netherlands","https://www.sciencedirect.com/journal/journal-of-epidemiology-and-population-health","","","","",""
"Journal of Ethnicity in Substance Abuse","Addiction","Taylor & Francis Group","For-profit","","","","USA","https://www.tandfonline.com/journals/wesa20","","","","",""
"Journal of Ethnobiology","Archaeo Anthropo","Sage journals","For-profit on behalf of a society","Hybrid","Society of Ethnobiology","Society","","https://journals.sagepub.com/home/ebia","","0.557","","",""
"Journal of Eukaryotic Microbiology","Microbiology","John Wiley & Sons","For-profit on behalf of a society","Hybrid","The International Society of Protistologists","Society","USA","https://onlinelibrary.wiley.com/journal/15507408","2500","0.798","","",""
"Journal of Evolutionary Biology","Evolution","Oxford University Press (OUP)","University Press on behalf of a society","Hybrid","European Society for Evolutionary Biology","Society","","https://academic.oup.com/jeb","2810","0.934","","","PCI friendly"
"Journal of Experimental & Clinical Cancer Research","Generalist","Springer Nature (BioMed Central)","For-profit","OA","","","","https://jeccr.biomedcentral.com/","3390","3.328","","",""
"Journal of Experimental Botany","Botany","Oxford University Press (OUP)","University Press on behalf of a society","Hybrid","Society for Experimental Biology","Society","UK","https://academic.oup.com/jxb","3351","1.913","","",""
"Journal of Experimental Psychology : Learning, Memory, and Cognition","Behavioral Neuroscience","American Psychological Association (APA)","Non-profit","Hybrid","American Psychological Association","Society","USA","https://www.apa.org/pubs/journals/xlm/","2663","1.227","","",""
"Journal of Experimental Psychology: General","Behavioral Neuroscience","American Psychological Association (APA)","Non-profit","Hybrid","American Psychological Association","Society","USA","https://www.apa.org/pubs/journals/xge","","2.076","","",""
"Journal of Experimental Zoology A Ecological Genetics and Physiology","Ecology & Evolution","John Wiley & Sons","For-profit","","","","USA","https://onlinelibrary.wiley.com/journal/24715646","","","","",""
"Journal of Experimental Zoology B Molecular and Developmental Evolution","Molecular & Cellular Biology","John Wiley & Sons","For-profit","","","","USA","https://onlinelibrary.wiley.com/journal/15525015","","","","",""
"Journal of Extracellular Vesicles","Molecular & Cellular Biology","John Wiley & Sons","For-profit on behalf of a society","","The International Society for Extracellular Vesicles","Society","USA","https://isevjournals.onlinelibrary.wiley.com/journal/20013078","","","","",""
"Journal of Field Archaeology","Archaeo Anthropo","Routledge","For-profit on behalf of a university or government institution","Hybrid","Trustees of Boston University","Uni/Gov","","https://www.tandfonline.com/journals/yjfa20","2710","","","",""
"Journal of Field Ornithology","Zoology","John Wiley & Sons","For-profit on behalf of a society","Hybrid","Association of Field Ornithologists","Society","USA","https://onlinelibrary.wiley.com/journal/15579263","2500","0.488","","",""
"Journal of Fish Biology","Zoology","John Wiley & Sons","For-profit","Hybrid","Fisheries Society of the British Isles","other","USA","https://onlinelibrary.wiley.com/journal/10958649","2750","0.609","","",""
"Journal of Fluency Disorders","Cognitive Neuroscience","Elsevier","For-profit on behalf of a society","","World Stuttering & Cluttering Organization (WSCO)","","Netherlands","https://www.sciencedirect.com/journal/journal-of-fluency-disorders","","","","",""
"Journal of Fluorescence","Methods","Springer Nature","For-profit","Hybrid","","","Germany/UK","https://link.springer.com/journal/10895","","","","",""
"Journal of Gastric Cancer","Gastrointestinal Cancer","Korean Gastric Cancer Association","Non-profit","","","","","https://www.jgc-online.org/","","","","",""
"Journal of Gastrointestinal Oncology","Gastrointestinal Cancer","Wolters Kluwer","For-profit on behalf of a society","","Society for Gastrointestinal Oncology (SGO)","Society","","https://journals.lww.com/jgo/pages/default.aspx","","","","",""
"Journal of General Physiology","Physiology","Rockefeller University Press","University Press on behalf of a society","","Society of General Physiologists","Society","","https://rupress.org/jgp","","","","",""
"Journal of General Virology","Microbiology","Microbiology Society","Non-profit","Hybrid","Microbiology Society","Society","","https://www.microbiologyresearch.org/content/journal/jgv","3116","1.317","","",""
"Journal of Genetics and Genomics","Generalist","Elsevier","For-profit","","","","Netherlands","https://www.sciencedirect.com/journal/journal-of-genetics-and-genomics","","","","",""
"Journal of Geophysical Research: Biogeosciences","Paleo Geo","John Wiley & Sons","For-profit on behalf of a society","OA","American Geophysical Union","Society","USA","https://agupubs.onlinelibrary.wiley.com/journal/21698961","2687","1.29","","",""
"Journal of Geriatric Oncology","Cancer Biology","Elsevier","For-profit on behalf of a society","","International Society of Geriatric Oncology (SIOG)","Society","Netherlands","https://www.sciencedirect.com/journal/journal-of-geriatric-oncology","","","","",""
"Journal of Geriatric Psychiatry and Neurology (JGP)","Clinical Neuroscience","Sage Publishing","For-profit","","","","USA","https://journals.sagepub.com/home/jgpb","","1.05","","",""
"Journal of Gerontology A Biological Sciences & Medical Sciences","Health","Oxford University Press (OUP)","University Press on behalf of a society","Hybrid","The Gerontological Society of America","Society","","https://academic.oup.com/biomedgerontology?login=false","3859","1.703","","",""
"Journal of Gerontology B Psychological Sciences & Social Science","Developmental Neuroscience","Oxford University Press (OUP)","University Press","","","","","https://academic.oup.com/psychsocgerontology?login=false","","","","",""
"Journal of Ginseng Research","Agriculture","Elsevier","For-profit","OA","","","Netherlands","https://www.journals.elsevier.com/journal-of-ginseng-research","865","1.419","","",""
"Journal of Global Antimicrobial Resistance","Immunopathology","Elsevier","For-profit on behalf of a society","","International Society of Antimicrobial Chemotherapy (ISAC); the Global Chinese Association of Clinical Microbiology and Infectious Diseases (GCACMID); Asia-Pacific Society of Clinical Microbiology and Infection (APSCMI)","Society","Netherlands","https://www.sciencedirect.com/journal/journal-of-global-antimicrobial-resistance","","","","",""
"Journal of Global Health","Health","Edinburgh University Global Health Society","Non-profit","OA","Edinburgh University Global Health Society","Society","","https://www.jogh.org/","1100","1.286","","",""
"Journal of Graph Algorithms and Applications","Theory","Journal of Graph Algorithms and Applications","Non-profit","OA diamond","Journal of Graph Algorithms and Applications","Non-profit","","https://jgaa.info/","0","0.337","","",""
"Journal of Hematology and Oncology","Hematopoietic Cancer","Springer Nature (BioMed Central)","For-profit","OA","","","","https://jhoonline.biomedcentral.com/","3990","10.192","","",""
"Journal of Heredity","Genetics","Oxford University Press (OUP)","University Press on behalf of a society","Hybrid","American Genetic Association","Society","","https://academic.oup.com/jhered","3006","0.869","","",""
"Journal of Herpetology","Zoology","Society for the Study of Amphibians and Reptiles","Non-profit","Hybrid","Society for the Study of Amphibians and Reptiles","Society","","https://meridian.allenpress.com/journal-of-herpetology","969","0.531","","",""
"Journal of Human Genetics","Genetics & Genomics","Springer Nature","For-profit","Hybrid","","","Germany","https://www.nature.com/jhg/","4190","1.012","","",""
"Journal of Human Lactation","Development","Sage Publishing","For-profit on behalf of a society","","International Lactation Consultant Association","Society","USA","https://journals.sagepub.com/home/jhl","","","","",""
"Journal of Hymenoptera Research","Zoology","PenSoft","For-profit on behalf of a society","OA","The International Society of Hymenopterists","Society","","https://jhr.pensoft.net/","700","0.45","","",""
"Journal of Iberian Geology","Paleo Geo","Springer Nature","For-profit on behalf of a university or government institution","Hybrid","Universidad Complutense de Madrid","Uni/Gov","Germany/UK","https://www.springer.com/journal/41513","2290","0.48","","",""
"Journal of Immunoassay & Immunochemistry","Immunogenetics And Molecular Immunology","Taylor & Francis Group","For-profit","","","","USA","https://www.tandfonline.com/journals/ljii20","","","","",""
"Journal of Immunological Methods","Immunology","Elsevier","For-profit","Hybrid","","","Netherlands","https://www.journals.elsevier.com/journal-of-immunological-methods","","0.53","","",""
"Journal of Immunology Research","Generalist/Classical Immunology","John Wiley & Sons","For-profit","","","","USA","https://onlinelibrary.wiley.com/journal/1607","","","","",""
"Journal of Immunotherapy","Treatment","Wolters Kluwer (Lippincott)","For-profit","","","","","https://journals.lww.com/immunotherapy-journal/pages/default.aspx","","","","",""
"Journal of Infection","Immunopathology","Elsevier","For-profit on behalf of a society","","British Infection Association","Society","Netherlands","https://www.sciencedirect.com/journal/journal-of-infection","","","","",""
"Journal of Infection Prevention","Immunology","Sage Publishing","For-profit on behalf of a society","","Infection Prevention Society","Society","USA","https://journals.sagepub.com/home/bjib","","0.365","","",""
"Journal of Infection and Chemotherapy","Immunooncology","Elsevier","For-profit on behalf of a society","","The Japanese Society of Chemotherapy; The Japanese Association for Infectious Diseases; The Japanese Society for Infection Prevention and Control","Society","Netherlands","https://www.sciencedirect.com/journal/journal-of-infection-and-chemotherapy","","","","",""
"Journal of Inflammation","Inflammation","Springer Nature (BioMed Central)","For-profit","","","","","https://journal-inflammation.biomedcentral.com/","","","","",""
"Journal of Inflammation Research","Inflammation","Taylor & Francis Group","For-profit","","","","USA","https://www.dovepress.com/journal-of-inflammation-research-journal","","","","",""
"Journal of Inherited Metabolic Disorders","Medical Genetics","John Wiley & Sons","For-profit on behalf of a society","","Society for the Study of Inborn Errors of Metabolism (SSIEM)","Society","USA","https://onlinelibrary.wiley.com/journal/15732665","","","","",""
"Journal of Innate Immuninty","Generalist/Classical Immunology","Karger","For-profit","","","","Switzerland","https://karger.com/jin","","","","",""
"Journal of Inorganic Biochemistry","Molecular Biology","Elsevier","For-profit","","","","Netherlands","https://www.sciencedirect.com/journal/journal-of-inorganic-biochemistry","","","","",""
"Journal of Insect Science","Zoology","Oxford University Press (OUP)","University Press on behalf of a society","OA","Entomological Society of America","Society","","https://academic.oup.com/jinsectscience","1814","0.502","","",""
"Journal of Integrative Neuroscience","Generalist","IMR","For-profit","OA","","","Singapore","https://www.imrpress.com/journal/JIN","1660","0.764","","",""
"Journal of Integrative Plant Biology","Generalist","John Wiley & Sons","For-profit","","","","USA","https://onlinelibrary.wiley.com/journal/17447909","","3.455","","",""
"Journal of Interferon and Cytokine Research","Immunogenetics And Molecular Immunology","Sage Publishing (Mary-Ann Liebert)","For-profit on behalf of a society","","International Cytokine and Interferon Society","Society","","https://journals.sagepub.com/home/ifc","","","","",""
"Journal of Investigational Allergology and Clinical Immunology","Allergy And Hypersensitivity","Spanish Society of Allergology and Clinical Immunology","Non-profit","","","","","https://www.jiaci.org/","","","","",""
"Journal of Iran National Museum","Archaeo Anthropo","Iran National Museum","Non-profit","OA diamond","Iran National Museum","Museum","","https://jinm.irannationalmuseum.ir/?lang=en","0","","","","PCI friendly"
"Journal of Leukocyte Biology","Cellular Biology","Oxford University Press (OUP)","University Press","","","","","https://academic.oup.com/jleukbio","","","","",""
"Journal of Limnology","Basic Ecology","PagePress","For-profit on behalf of a university or government institution","OA","Water Research Institute","Uni/Gov","","https://www.jlimnol.it/index.php/jlimnol","600","0.468","","",""
"Journal of Lipid Research","Molecular Biology","American Society for Biochemistry and Molecular Biology (ASBMB)","Non-profit","","","","USA","https://www.jlr.org/","","","","",""
"Journal of Liposome Research","Molecular Biology","Taylor & Francis Group","For-profit on behalf of a society","","International Liposome Society","Society","USA","https://www.tandfonline.com/journals/ilpr20","","","","",""
"Journal of Lithic Studies","Archaeo Anthropo","University of Edinburgh","Non-profit","OA diamond","University of Edinburgh","Uni/Gov","","https://journals.ed.ac.uk/lithicstudies","0","","","","PCI friendly"
"Journal of Liver Transplantation","Transplant Immunology","Elsevier","For-profit","","","","Netherlands","https://www.sciencedirect.com/journal/journal-of-liver-transplantation","","","","",""
"Journal of Magnetic Resonance","Methods","Elsevier","For-profit on behalf of a society","","International Society of Magnetic Resonance (ISMAR)","Society","Netherlands","https://www.sciencedirect.com/journal/journal-of-magnetic-resonance","","","","",""
"Journal of Magnetic Resonance Imaging","Methods","John Wiley & Sons","For-profit on behalf of a society","","International Society for Magnetic Resonance in Medicine","Society","USA","https://onlinelibrary.wiley.com/journal/15222586","","","","",""
