"Journal","Field","Publisher","Publisher type","Business model","Institution","Institution type","Country","Website","APC Euros","Scimago Rank","Scimago Quartile","H index","PCI partner"
"Current Opinion in Systems Biology","Generalist","Elsevier","For-profit","","","","Netherlands","https://www.sciencedirect.com/journal/current-opinion-in-systems-biology","","1.702","","",""
"Current Plant Biology","Generalist","Elsevier","For-profit","OA","","","Netherlands","https://www.sciencedirect.com/journal/current-plant-biology","2580","1.028","","",""
"Current Research in Neurobiology","Generalist","Elsevier","For-profit","OA","","","Netherlands","https://www.sciencedirect.com/journal/current-research-in-neurobiology","2164","1.184","","",""
"Current Swedish Archaeology","Archaeo Anthropo","Swedish Archaeological Society","Non-profit","OA diamond","Swedish Archaeological Society","Society","","https://publicera.kb.se/csa/index","0","","","",""
"Current Zoology","Zoology","Oxford University Press (OUP)","University Press on behalf of a society","OA diamond","China Zoological Society","Society","","https://academic.oup.com/cz","0","0.937","","",""
"Current biology","Generalist","Elsevier","For-profit","Hybrid","","","USA","https://www.cell.com/current-biology/home","6290","2.707","","",""
"Cybium","Zoology","Societe Francaise d'Ichtyologie","Non-profit","Subscription","Societe Francaise d'Ichtyologie","Society","","https://sfi-cybium.fr/fr/cybium-revue-internationale-dichtyologie","","0.305","","",""
"Cytogenetic and Genome Research","Genetics & Genomics","Karger Publishers","For-profit","","","","Switzerland","https://karger.com/CGR","","0.387","","",""
"Cytokine","Immunogenetics And Molecular Immunology","Elsevier","For-profit","Hybrid","","","Netherlands","https://www.journals.elsevier.com/cytokine","","1.108","","",""
"Cytokine & Growth Factor Reviews","Immunogenetics And Molecular Immunology","Elsevier","For-profit","Hybrid","","","Netherlands","https://www.journals.elsevier.com/cytokine-and-growth-factor-reviews","","2.877","","",""
"Cytoskeleton","Molecular & Cellular Biology","John Wiley & Sons","For-profit","","","","USA","https://onlinelibrary.wiley.com/journal/19493592","","0.844","","",""
"DNA Research","Genetics & Genomics","Oxford University Press (OUP)","University Press","OA","","","UK","https://academic.oup.com/dnaresearch","1125","1.216","","",""
"DNA and Cell Biology","Genetics & Genomics","Sage Publishing","For-profit","","","","USA","https://journals.sagepub.com/home/dnaa","","0.637","","",""
"Decision","Cognitive Neuroscience","American Psychological Association (APA)","Non-profit","Hybrid","American Psychological Association","Society","USA","https://www.apa.org/pubs/journals/dec/","","0.687","","",""
"Deep Brain Stimulation","Neuromodulation","Elsevier","For-profit","OA","","","Netherlands","https://www.sciencedirect.com/journal/deep-brain-stimulation","","","","",""
"Dementia","Clinical Neuroscience","Sage Publishing","For-profit","","","","USA","https://journals.sagepub.com/home/dema","","1.113","","",""
"Dementia and Geriatric Cognitive Disorders","Clinical Neuroscience","Karger Publishers","For-profit","","","","Switzerland","https://karger.com/dem","","","","",""
"Development","Generalist","The Company of Biologists","Non-profit","Hybrid","","","UK","https://journals.biologists.com/dev","5931","1.715","","",""
"Development Growth & Differentiation","Development","John Wiley & Sons","For-profit on behalf of a society","Hybrid","Japanese Society for Developmental Biologists","Society","USA","https://onlinelibrary.wiley.com/journal/1440169X","3300","0.633","","",""
"Development and Psychopathology","Developmental Neuroscience","Cambridge University Press (CUP)","University Press","","-","","UK","https://www.cambridge.org/core/journals/development-and-psychopathology","","1.573","","",""
"Developmental & Comparative Immunology","Molecular And Cellular Development","Elsevier","For-profit on behalf of a society","","International Society of Developmental and Comparative Immunology","Society","Netherlands","https://www.sciencedirect.com/journal/developmental-and-comparative-immunology","","","","",""
"Developmental Biology","Generalist","Elsevier","For-profit on behalf of a society","Hybrid","Society for Developmental Biology","Society","Netherlands","https://www.sciencedirect.com/journal/developmental-biology","3363","1.164","","",""
"Developmental Cell","Molecular And Cellular Development","Elsevier (Cell Press)","For-profit","","","","USA","https://www.cell.com/developmental-cell","","5.18","","",""
"Developmental Cognitive Neuroscience","Developmental Neuroscience","Elsevier","For-profit","OA","-","","Netherlands","https://www.journals.elsevier.com/developmental-cognitive-neuroscience","2978","2.094","","",""
"Developmental Dynamics","Development","John Wiley & Sons","For-profit on behalf of a society","","American Association for Anatomy","Society","USA","https://onlinelibrary.wiley.com/journal/10970177","","0.857","","",""
"Developmental Dynamics: An Official Publication of the American Association of Anatomists","Zoology","John Wiley & Sons","For-profit on behalf of a society","Hybrid","American Association for Anatomy","Society","USA","https://anatomypubs.onlinelibrary.wiley.com/journal/10970177","3610","","","",""
"Developmental Medicine & Child Neurology","Developmental Neuroscience","John Wiley & Sons","For-profit","","-","","USA","https://onlinelibrary.wiley.com/journal/14698749","","1.6","","",""
"Developmental Neurobiology","Developmental Neuroscience","John Wiley & Sons","For-profit","Hybrid","-","","USA","https://onlinelibrary.wiley.com/journal/1932846X","3810","1.437","","",""
"Developmental Neuroscience","Developmental Neuroscience","Karger Publishers","For-profit","","","","Switzerland","https://karger.com/dne","","","","",""
"Developmental Psychobiology","Developmental Neuroscience","John Wiley & Sons","For-profit","","-","","USA","https://onlinelibrary.wiley.com/journal/10982302","","0.87","","",""
"Developmental Psychology","Developmental Neuroscience","American Psychological Association (APA)","Non-profit","Hybrid","American Psychological Association","Society","USA","https://www.apa.org/pubs/journals/dev","","1.567","","",""
"Diagnostic Microbiology and Infectious Disease","Immunology","Elsevier","For-profit","","","","Netherlands","https://www.sciencedirect.com/journal/diagnostic-microbiology-and-infectious-disease","","0.633","","",""
"Differentiation","Molecular And Cellular Development","Elsevier","For-profit","Hybrid","-","","Netherlands","https://www.sciencedirect.com/journal/differentiation","","0.814","","",""
"Discover Developmental Biology","Development","Springer Nature","For-profit","","-","","Germany/UK","https://link.springer.com/journal/427","","","","",""
"Discover Neuroscience","Generalist","Springer Nature","For-profit","","","","Germany/UK","https://link.springer.com/journal/13064","","","","",""
"Disease Models and Mechanisms","Immunology","The Company of Biologists","Non-profit","OA","","","UK","https://journals.biologists.com/dmm","4097","1.318","","",""
"Documenta Praehistorica","Archaeo Anthropo","University of Ljubljana Press","University Press on behalf of a university or government institution","OA diamond","Scientific Research Institute of the Faculty Of Arts","Uni/Gov","","https://journals.uni-lj.si/DocumentaPraehistorica/index","0","","","",""
"Drug Resistance Updates","Cancer Biology","Elsevier","For-profit","","","","Netherlands","https://www.journals.elsevier.com/drug-resistance-updates","","5.282","","",""
"EMBO Journal","Molecular & Cellular Biology","Springer Nature","For-profit on behalf of a society","","European Molecular Biology Organization (EMBO) Press","","Germany/UK","https://www.embopress.org/journal/14602075","6490","4.821","","",""
"EMBO Molecular Medicine","Molecular Biology","Springer Nature","For-profit on behalf of a society","OA","European Molecular Biology Organization (EMBO) Press","","Germany/UK","https://www.embopress.org/journal/17574684","6490","3.571","","",""
"EMBO Reports","Molecular & Cellular Biology","Springer Nature","For-profit on behalf of a society","Hybrid","European Molecular Biology Organization (EMBO) Press","Non-profit","Germany/UK","https://www.embopress.org/journal/14693178","6490","3.273","","",""
"EOS","Paleo Geo","American Geophysical Union","Non-profit","Subscription","American Geophysical Union","Society","","https://eos.org/","","0.15","","",""
"ESMO Open","Cancer Biology","Elsevier","For-profit","OA","","","Netherlands","https://esmoopen.bmj.com/","3400","3.582","","",""
"EXARC Journal","Archaeo Anthropo","EXARC","Non-profit","OA diamond","EXARC","Society","","https://exarc.net/journal","0","","","","PCI friendly"
"Earth's Future","Archaeo Anthropo","John Wiley & Sons","For-profit on behalf of a society","OA","American Geophysical Union","Society","USA","https://agupubs.onlinelibrary.wiley.com/journal/23284277","2080","2.444","","",""
"Ecography","Applied Ecology","John Wiley & Sons","For-profit on behalf of a society","OA","Nordic Society Oikos","Society","USA","https://onlinelibrary.wiley.com/journal/16000587","2480","2.37","","",""
"Ecohealth","Health","Springer Nature","For-profit","Hybrid","EcoHealth Alliance","other","Germany/UK","https://www.springer.com/journal/10393","2790","0.916","","",""
"Ecologia Mediterranea","Basic Ecology","Naturalia Publications","Non-profit","Subscription","Institut Mediterraneen de Biodiversite et d'Ecologie","Uni/Gov","","https://ecologia-mediterranea.univ-avignon.fr/","","0.154","","",""
"Ecological Applications","Applied Ecology","John Wiley & Sons","For-profit on behalf of a society","Hybrid","Ecological Society of America","Society","USA","https://esajournals.onlinelibrary.wiley.com/journal/19395582","3000","1.726","","",""
"Ecological Entomology","Zoology","John Wiley & Sons","For-profit on behalf of a society","Hybrid","Royal Entomological Society","Society","USA","https://onlinelibrary.wiley.com/journal/13652311","3500","0.726","","",""
"Ecological Monographs","Basic Ecology","John Wiley & Sons","For-profit on behalf of a society","Hybrid","Ecological Society of America","Society","USA","https://esajournals.onlinelibrary.wiley.com/journal/15577015","3000","3.58","","",""
"Ecological Research","Basic Ecology","John Wiley & Sons","For-profit on behalf of a society","Hybrid","The Ecological Society of Japan","Society","USA","https://esj-journals.onlinelibrary.wiley.com/journal/14401703","2500","0.575","","",""
"Ecological Solutions & Evidence","Applied Ecology","John Wiley & Sons","For-profit on behalf of a society","OA","British Ecological Society","Society","USA","https://besjournals.onlinelibrary.wiley.com/journal/26888319","2000","","","",""
"Ecology","Basic Ecology","John Wiley & Sons","For-profit on behalf of a society","Hybrid","Ecological Society of America","Society","USA","https://esajournals.onlinelibrary.wiley.com/journal/19399170","3000","2.021","","",""
"Ecology Letters","Basic Ecology","John Wiley & Sons","For-profit on behalf of a university or government institution","Hybrid","Centre National de la Recherche Scientifique","Uni/Gov","USA","https://onlinelibrary.wiley.com/journal/14610248","4230","5.673","","","PCI friendly"
"Ecology and Society","Applied Ecology","Resilience Alliance/Ecology & Society","Non-profit","OA","Ecology & Society","Society","","https://ecologyandsociety.org/","893","1.188","","",""
"Ecoscience","Basic Ecology","Taylor & Francis Group","For-profit on behalf of a university or government institution","Hybrid","Universite Laval","Uni/Gov","USA","https://www.tandfonline.com/toc/teco20/current","3170","0.387","","",""
"Ecosphere","Basic Ecology","John Wiley & Sons","For-profit on behalf of a society","OA","Ecological Society of America","Society","USA","https://esajournals.onlinelibrary.wiley.com/journal/21508925","1700","1.151","","",""
"Egyptian Journal of Botany","Botany","Egyptian Academy of Scientific Research and Technology","Non-profit","OA diamond","Egyptian Botanical Society","Society","","https://ejbo.journals.ekb.eg/","0","0.308","","",""
"Elementa","Applied Ecology","University of California Press","University Press on behalf of a university or government institution","OA","University of California","Uni/Gov","","https://online.ucpress.edu/elementa/","1787","1.037","","",""
"Emerging Infectious Diseases","Health","Centers for Disease Control and Prevention","Non-profit","OA diamond","Centers for Disease Control and Prevention","other","","https://wwwnc.cdc.gov/eid/","0","3.05","","",""
"Emerging Microbes and Infection","Molecular & Cellular Biology","Taylor & Francis Group","For-profit","","Shanghai Shangyixun Cultural Communication Co","","USA","https://www.tandfonline.com/journals/temi20","","","","",""
"Emotion","Cognitive Neuroscience","American Psychological Association (APA)","Non-profit","Hybrid","American Psychological Association","Society","USA","https://www.apa.org/pubs/journals/emo","","1.986","","",""
"Emotion Review","Cognitive Neuroscience","Sage Publishing","For-profit on behalf of a society","Hybrid","the International Society for Research on Emotions (ISRE)","Society","USA","https://au.sagepub.com/en-gb/oce/journal/emotion-review","","1.407","","",""
"Entomologia Experimentalis et Applicata","Zoology","John Wiley & Sons","For-profit on behalf of a society","Hybrid","Netherlands Entomological Society","Society","USA","https://onlinelibrary.wiley.com/journal/15707458","3500","0.645","","",""
"Environmental Archaeology","Archaeo Anthropo","Routledge","For-profit on behalf of a society","Hybrid","Association for Environmental Archaeology","Society","","https://www.tandfonline.com/YENV","2710","","","",""
"Environmental Carcinogenesis and Ecotoxicology Reviews/Journal of Environmental Science and Health, part C: Toxicology and Carcinogenesis","Cancer Biology","Taylor & Francis Group","For-profit","","","","USA","https://www.tandfonline.com/journals/lesc20","","","","",""
"Environmental Entomology","Zoology","Oxford University Press (OUP)","University Press on behalf of a society","Hybrid","Entomological Society of America","Society","","https://academic.oup.com/ee","3651","0.62","","",""
"Environmental Microbiology","Microbiology","","For-profit","","","","","https://enviromicro-journals.onlinelibrary.wiley.com/journal/14622920","","","","",""
"Environmental Science and Pollution Research","Applied Ecology","Springer Nature","For-profit on behalf of a society","Hybrid","European Chemical Society","Society","Germany/UK","https://www.springer.com/journal/11356","2890","0.94","","",""
"Environmental Toxicology and Chemistry","Applied Ecology","John Wiley & Sons","For-profit on behalf of a society","Hybrid","Society of Environmental Toxicology and Chemistry","Society","USA","https://setac.onlinelibrary.wiley.com/journal/15528618","2270","1.025","","",""
"Epidemiology","Immunology","Wolters Kluwer","For-profit","","","","","https://journals.lww.com/epidem/Pages/default.aspx","","1.831","","",""
"Epidemiology and Infection","Immunology","Cambridge University Press (CUP)","University Press","","","","UK","https://www.cambridge.org/core/journals/epidemiology-and-infection","","0.72","","",""
"Epigenetics","Genetics & Genomics","Taylor & Francis Group","For-profit","OA","","","USA","https://www.tandfonline.com/journals/kepi20","3170","1.071","","",""
"Epigenetics & Chromatin","Genetics & Genomics","Springer Nature (BioMed Central)","For-profit","OA","","","","https://epigeneticsandchromatin.biomedcentral.com/","2590","1.781","","",""
"Epigenetics Insights","Genetics & Genomics","Sage Publishing","For-profit","","","","USA","https://journals.sagepub.com/home/gaeb","","0.81","","",""
"Epigenomics","Genetics & Genomics","Taylor & Francis Group","For-profit","","","","USA","https://www.tandfonline.com/journals/iepi20","","0.69","","",""
"Epilepsy Currents","Clinical Neuroscience","Sage Publishing","For-profit on behalf of a society","","American Epilepsy Society","Society","USA","https://journals.sagepub.com/home/epib","","0.354","","",""
"Estonian Journal of Archaeology","Archaeo Anthropo","Estonian Academy Publishers","Non-profit","OA","Institute of History and Archaeology at the University of Tartu / Archaeological Research Collection of Tallinn University","Uni/Gov","","https://kirj.ee/archaeology/","250","","","",""
"Estuarine Coastal and Shelf Science","Basic Ecology","Elsevier","For-profit on behalf of a society","Hybrid","Estuarine Coastal Sciences Association","Society","Netherlands","https://www.journals.elsevier.com/estuarine-coastal-and-shelf-science","3026","0.875","","",""
"Estudos do Quaternario","Archaeo Anthropo","Associacao Portuguesa para o Estudo do Quaternario","Non-profit","Subscription","Associacao Portuguesa para o Estudo do Quaternario","Society","","https://www.apeq.pt/ojs/index.php/apeq","","0.28","","",""
"European Journal of Archaeology","Archaeo Anthropo","Cambridge University Press (CUP)","University Press on behalf of a society","Hybrid","European Association of Archaeologists","Society","","https://www.cambridge.org/core/journals/european-journal-of-archaeology","2100","0.841","","",""
"European Journal of Cancer","Generalist","Elsevier","For-profit","","","","Netherlands","https://www.ejcancer.com/","","","","",""
"European Journal of Cell Biology","Molecular & Cellular Biology","Elsevier","For-profit","OA","","","Netherlands","https://www.sciencedirect.com/journal/european-journal-of-cell-biology","2363","1.491","","",""
"European Journal of Entomology","Zoology","Czech Academy of Sciences","Non-profit","OA","Czech Academy of Sciences","Uni/Gov","","https://www.eje.cz/","200","0.361","","",""
"European Journal of Human Genetics","Genetics & Genomics","Springer Nature","For-profit on behalf of a society","Hybrid","European Society of Human Genetics","Society","Germany/UK","https://www.nature.com/ejhg/","2990","1.713","","",""
"European Journal of Immunology","Generalist","John Wiley & Sons","For-profit on behalf of a society","Hybrid","European Federation of Immunological Societies","Society","Allemagne","https://onlinelibrary.wiley.com/journal/15214141","","1.86","","",""
"European Journal of Inflammation","Inflammation","Sage Publishing","For-profit","OA","","","USA","https://journals.sagepub.com/home/ejia","2294","0.26","","",""
"European Journal of Medical Genetics","Medical Genetics","Elsevier","For-profit","","","","Netherlands","https://www.sciencedirect.com/journal/european-journal-of-medical-genetics","","","","",""
"European Journal of Neurology","Clinical Neuroscience","John Wiley & Sons","For-profit","","","","USA","https://onlinelibrary.wiley.com/journal/14681331","","","","",""
"European Journal of Neuroscience","Generalist","John Wiley & Sons","For-profit on behalf of a society","Hybrid","Federation of European Neuroscience Societies","","USA","https://onlinelibrary.wiley.com/journal/14609568","2980","1.153","","",""
"European Journal of Pain","Neurophysiology","John Wiley & Sons","For-profit on behalf of a society","","European Pain Federation (EFIC)","","USA","https://onlinelibrary.wiley.com/journal/15322149","","","","",""
"European Journal of Phycology","Botany","Taylor & Francis Group","For-profit on behalf of a society","Hybrid","British Phycological Society","Society","USA","https://www.tandfonline.com/toc/tejp20/current","3190","0.608","","",""
"European Journal of Plant Pathology","Plant Biology","Springer Nature","For-profit","","","","Germany/UK","https://link.springer.com/journal/10658","","0.477","","",""
"European Journal of Soil Science","Basic Ecology","John Wiley & Sons","For-profit on behalf of a society","Hybrid","British Society of Soil Science","Society","USA","https://bsssjournals.onlinelibrary.wiley.com/journal/13652389","3700","1.4","","",""
"European Journal of Taxonomy","Evolution","European Journal of Taxonomy Consortium","Non-profit","OA diamond","European Journal of Taxonomy Consortium","Museum","","https://europeanjournaloftaxonomy.eu/index.php/ejt","0","0.563","","","PCI friendly"
"European Neuropsychopharmacology","Molecular And Cellular Neuroscience","Elsevier","For-profit","","","","Netherlands","https://www.journals.elsevier.com/european-neuropsychopharmacology","","1.934","","",""
"European Psychiatry","Clinical Neuroscience","Cambridge University Press (CUP)","University Press on behalf of a society","","European Psychiatric Association","Society","UK","https://www.cambridge.org/core/journals/european-psychiatry","","1.989","","",""
"European Stroke Journal","Clinical Neuroscience","Sage Publishing","For-profit on behalf of a society","","European Stroke Organization","","USA","https://journals.sagepub.com/home/esoa","","2.433","","",""
"European Zoological Journal","Zoology","Taylor & Francis Group","For-profit on behalf of a society","OA","Italian Society of Zoologists","Society","USA","https://www.tandfonline.com/journals/tizo21","965","0.436","","","PCI friendly"
"Eurosurveillance","Health","European Centre for Disease Prevention and Control","Non-profit","OA diamond","European Centre for Disease Prevention and Control","Uni/Gov","","https://www.eurosurveillance.org/","0","4.145","","",""
"Eventum - A journal of Medieval Arts and Rituals","Archaeo Anthropo","Milano Univerity Press","University Press on behalf of a university or government institution","OA diamond","University of Cyprus","Uni/Gov","","https://riviste.unimi.it/index.php/eventum/index","0","","","",""
"EvoDevo / Developmental Biology Advances","Development","Springer Nature","For-profit","OA","-","","Germany/UK","https://evodevojournal.biomedcentral.com/","2290","1.351","","",""
"Evolution","Evolution","Oxford University Press (OUP)","University Press on behalf of a society","Hybrid","Society for the Study of Evolution","Society","","https://academic.oup.com/evolut","2752","1.56","","","PCI friendly"
"Evolution Letters","Genetics & Genomics","Oxford University Press (OUP)","University Press on behalf of a society","OA","Society for the Study of Evolution / European Society for Evolutionary Biology","Society","UK","https://academic.oup.com/evlett/","2293","2.775","","","PCI friendly"
"Evolution Medicine and Public Health","Health","Oxford University Press (OUP)","University Press on behalf of a society","OA","International Society for Evolution Medicine and Public Health","Society","","https://academic.oup.com/emph","3200","0.945","","",""
"Evolution and Development","Generalist","John Wiley & Sons","For-profit","","","","USA","https://onlinelibrary.wiley.com/journal/1525142x","","","","",""
"Evolution and Human Behavior","Archaeo Anthropo","Elsevier","For-profit on behalf of a society","Hybrid","Human Behavior and Evolution Society","Society","Netherlands","https://www.journals.elsevier.com/evolution-and-human-behavior","3430","1.676","","",""
"Evolutionary Applications","Genetics & Genomics","John Wiley & Sons","For-profit","OA","","","USA","https://onlinelibrary.wiley.com/journal/17524571","3010","1.362","","",""
"Evolutionary Behavioral Sciences","Behavioral Neuroscience","American Psychological Association (APA)","Non-profit","Hybrid","American Psychological Association","Society","USA","https://www.apa.org/pubs/journals/ebs","","0.454","","",""
"Evolutionary Human Sciences","Archaeo Anthropo","Cambridge University Press (CUP)","University Press on behalf of a society","OA","European Human Behaviour and Evolution Association","Society","","https://www.cambridge.org/core/journals/evolutionary-human-sciences","2986","1.039","","",""
"Evolutionary Journal of the Linnean Society","Evolution","Oxford University Press (OUP)","University Press on behalf of a society","OA","Linnean Society","Society","","https://academic.oup.com/evolinnean","1868","","","",""
"Evolutionary Systematics","Evolution","Pensoft","For-profit on behalf of a university or government institution","OA","Center of Natural History at the University of Hamburg","Uni/Gov","","https://evolsyst.pensoft.net/","420","0.568","","",""
"Experimental Brain Research","Generalist","Springer Nature","For-profit","Hybrid","","","Germany","https://link.springer.com/journal/221","","0.637","","",""
"Experimental Cell Research","Cellular Biology","Elsevier","For-profit","","","","Netherlands","https://www.sciencedirect.com/journal/experimental-cell-research","","1.012","","",""
"Experimental Hematology & Oncology","Cancer Biology","Springer Nature (BioMed Central)","For-profit","OA","","","","https://ehoonline.biomedcentral.com/","2790","3.092","","",""
"Expert Review of Vaccines","Vaccinology","Taylor & Francis Group","For-profit","Hybrid","","","USA","https://www.tandfonline.com/journals/ierv20","4060","1.255","","",""
"FEBS Journal","Molecular & Cellular Biology","John Wiley & Sons","For-profit on behalf of a society","Hybrid","Federation of the European Biochemical Societies","","UK","https://febs.onlinelibrary.wiley.com/journal/17424658","4160","2.212","","",""
"FEBS Letters","Molecular And Cellular Neuroscience","John Wiley & Sons","For-profit on behalf of a society","Hybrid","Federation of European Biochemical Societies (FEBS)","Society","USA","https://febs.onlinelibrary.wiley.com/journal/18733468","3170","1.222","","",""
"FEBS Open Bio","Generalist","John Wiley & Sons","For-profit on behalf of a society","OA","Federation of European Biochemical Societies","","UK","https://febs.onlinelibrary.wiley.com/journal/22115463","1600","0.857","","",""
"FEMS Infectious Diseases","Immunology","Oxford University Press (OUP)","University Press on behalf of a society","","Federation of European Microbiological Societies (FEMS)","Society","UK","https://academic.oup.com/femspd","","","","",""
