"Journal","Field","Publisher","Publisher type","Business model","Institution","Institution type","Country","Website","APC Euros","Scimago Rank","Scimago Quartile","H index","PCI partner","e-ISSN","p-ISSN"
"Gynecological Endocrinology","Endocrinology","International Society of Gynecological Endocrinology","Non-profit","OA","International Society of Gynecological Endocrinology","Society/Association","UK","https://www.isgesociety.com/publications/gynecological-endocrinology/","2946","0.699","Q2 (Obstetrics and Gynecology)","83","No","1473-0766","0951-3590"
"Gériatrie et Psychologie Neuropsychiatrie du Vieillissement","Aging","John Libbey Eurotext","For-profit associated with a society","Hybrid","Société française de gériatrie et de gérontologie (SFGG); Société francophone de psychogériatrie et de psychiatrie de la personne âgée (SF3PA); Association des jeunes gériatres (AJG)","Society/Association","France","https://www.jle.com/fr/revues/gpn/revue.phtml","424","0.154","Q4 (Biological Psychiatry; Geriatrics and Gerontology; Medicine; Neurology; Neuropsychology and Physiological Psychology)","23","No","2115-7863","2115-8789"
"High Altitude Medicine & Biology","Physiology","Sage Publishing (Mary Ann Liebert)","For-profit","Hybrid","","","USA","https://liebertpub.com/loi/HAM","3446","0.413","Q3 (Medicine; Public Health, Environmental and Occupational Health)","67","No","1557-8682","1527-0297"
"Hormone Research in Paediatrics","Endocrinology","Karger Publishers","For-profit associated with a society","Hybrid","European Society for Paediatric Endocrinology; Pediatric Endocrine Society; Sociedade Latino-Americana de Endocrinologia Pediátrica","Society/Association","Switzerland","https://karger.com/HRP","2649","1.038","Q1 (Pediatrics, Perinatology and Child Health)","107","No","1663-2826","1663-2818"
"Hormone and Metabolic Research","Endocrinology","Thieme Group","For-profit","Hybrid","","","Germany","https://lp.thieme.de/journals/hormone-and-metabolic-research/0018-5043","3233","0.709","Q2 (Biochemistry; Clinical Biochemistry; Medicine)","106","No","1439-4286","0018-5043"
"Hormones","Endocrinology","Springer Nature","For-profit associated with a society","Hybrid","Hellenic Endocrine Society","Society/Association","Germany / UK","https://link.springer.com/journal/42000","2444","0.672","Q2 (Medicine)","64","No","2520-8721","1109-3099"
"Hormones and Behavior","Endocrinology","Elsevier","For-profit associated with a society","Hybrid","Society for Behavioral Neuroendocrinology","Society/Association","Netherlands","https://www.sciencedirect.com/journal/hormones-and-behavior","2654","0.876","Q2 (Behavioral Neuroscience; Endocrine and Autonomic Systems; Endocrinology)","171","No","1095-6867","0018-506X"
"Human Movement Science","Sport Science","Elsevier","For-profit","Hybrid","","","Netherlands","https://www.sciencedirect.com/journal/human-movement-science","1910","0.544","Q2 (Medicine)","114","No","1872-7646","0167-9457"
"International Journal of Endocrinology","Endocrinology","John Wiley & Sons","For-profit","OA","","","UK","https://onlinelibrary.wiley.com/journal/1573","1751","0.753","Q2 (Endocrinology, Diabetes and Metabolism)","89","No","1687-8345","1687-8337"
"International Journal of Sports Physiology and Performance","Physiology","Human Kinetics","For-profit","Hybrid","","","USA","https://journals.humankinetics.com/view/journals/ijspp/ijspp-overview.xml","1926","1.833","Q1 (Orthopedics and Sports Medicine; Physical Therapy, Sports Therapy and Rehabilitation; Sports Science)","109","No","1555-0273","1555-0265"
"Journal of Aging Research","Aging","John Wiley & Sons","For-profit","OA","","","UK","https://onlinelibrary.wiley.com/journal/9025","673","0.552","Q3 (Geriatrics and Gerontology)","65","No","2090-2212","2090-2204"
"Journal of Aging Studies","Aging","Elsevier","For-profit","Hybrid","","","Netherlands","https://www.sciencedirect.com/journal/journal-of-aging-studies","2907","0.756","Q1 (Issues, Ethics and Legal Aspects)","92","No","1879-193X","0890-4065"
"Journal of Aging and Health","Aging","Sage Publishing","For-profit","Hybrid","","","USA","https://journals.sagepub.com/home/jah","269","1.146","Q1 (Community and Home Care; Geriatrics and Gerontology; Gerontology; Health; Life-span and Life-course Studies; Sociology and Political Science)","98","No","1552-6887","0898-2643"
"Journal of Anatomy","Anatomy","John Wiley & Sons","For-profit","Hybrid","","","USA","https://onlinelibrary.wiley.com/journal/14697580","2164","0.694","Q1 (Anatomy; Ecology, Evolution, Behavior and Systematics)","145","No","1469-7580","0021-8782"
"Journal of Applied Physiology","Physiology","American Physiological Society (APS)","Non-profit","Hybrid","American Physiological Society","Society/Association","USA","https://journals.physiology.org/journal/jappl","862","1.106","Q1 (Medicine)","276","No","1522-1601","8750-7587"
"Journal of Biological Rhythms","Physiology","Sage Publishing","For-profit associated with a society","Hybrid","Society for Research on Biological Rhythms","Society/Association","USA","https://journals.sagepub.com/home/jbr","1603","1.154","Q1 (Physiology)","121","No","1552-4531","0748-7304"
"Journal of Breath Research","Physiology","Institute of Physics (IOP) Publishing","Non-profit","Hybrid","International Association for Breath Research (IABR)","Society/Association","UK","https://iopscience.iop.org/journal/1752-7163","1808","0.523","Q3 (Pulmonary and Respiratory Medicine)","76","No","1752-7163","1752-7155"
"Journal of Comparative Physiology A Neuroethology Sensory Neural and Behavioral Physiology","Physiology","Springer Nature","For-profit","Hybrid","","","Germany / UK","https://link.springer.com/journal/359","3039","0.768","Q1 (Animal Science and Zoology; Ecology, Evolution, Behavior and Systematics)","109","No","1432-1351","0340-7594"
"Journal of Comparative Physiology B Biochemical Systemic and Environmental Physiology","Physiology","Springer Nature","For-profit","Hybrid","","","Germany / UK","https://link.springer.com/journal/360","","0.561","Q1 (Animal Science and Zoology)","98","No","1432-136X","0174-1578"
"Journal of Endocrinology","Endocrinology","Bioscientifica Ltd","Non-profit","Hybrid","Society for Endocrinology","Society/Association","UK","https://joe.bioscientifica.com/","3368","1.579","Q1 (Endocrinology; Endocrinology, Diabetes and Metabolism)","178","No","1479-6805","0022-0795"
"Journal of General Physiology","Physiology","Rockefeller University Press","University Press associated with a society","Hybrid","the Society of General Physiologists","Society/Association","USA","https://rupress.org/jgp","1881","1.128","Q2 (Physiology)","145","No","1540-7748","0022-1295"
"Journal of Neurophysiology","Physiology","American Physiological Society (APS)","Non-profit","Hybrid","American Physiological Society","Society/Association","USA","https://journals.physiology.org/journal/jn","2807","0.828","Q2 (Neuroscience; Physiology)","279","No","1522-1598","0022-3077"
"Journal of Physical Activity and Health","Sport Science","Human Kinetics","For-profit associated with a society","Hybrid","International Society for Physical Activity and Health","Society/Association","USA","https://journals.humankinetics.com/view/journals/jpah/jpah-overview.xml","2043","0.845","Q1 (Physical Therapy, Sports Therapy and Rehabilitation)","100","No","1543-5474","1543-3080"
"Journal of Physiology","Physiology","John Wiley & Sons","For-profit associated with a society","Hybrid","The Physiology Society","Society/Association","USA","https://physoc.onlinelibrary.wiley.com/journal/14697793","756","1.476","Q1 (Physiology; Sports Science)","285","No","1469-7793","0022-3751"
"Journal of Science and Medicine in Sport","Sport Science","Elsevier","For-profit associated with a society","Hybrid","Sports Medicine Australia (SMA); Australasian Academy of Podiatric Sports Medicine (AAPSM); Exercise and Sports Science Australia (ESSA); Australian Physiotherapy Association - Sports Physiotherapy Australia (SPA); College of Sport Psychologists (COSP); Sports Dietitians Australia (SDA); Australasian College of Sports & Exercise Physicians (ACSEP)","Society/Association","Netherlands","https://www.sciencedirect.com/journal/journal-of-science-and-medicine-in-sport","2364","1.52","Q1 (Orthopedics and Sports Medicine; Physical Therapy, Sports Therapy and Rehabilitation; Sports Science)","141","No","1878-1861","1440-2440"
"Journal of Sport and Health Science","Sport Science","Elsevier","For-profit","OA diamond","Shanghai University of Sport","University/Government","Netherlands","https://www.sciencedirect.com/journal/journal-of-sport-and-health-science","0","3.715","Q1 (Orthopedics and Sports Medicine; Physical Therapy, Sports Therapy and Rehabilitation)","87","No","2213-2961","2095-2546"
"Journal of the Endocrine Society","Endocrinology","Oxford University Press (OUP)","University Press associated with a society","OA","Endocrine Society","Society/Association","USA","https://academic.oup.com/jes","2960","1.099","Q2 (Endocrinology, Diabetes and Metabolism)","56","No","2472-1972",""
"Mechanisms of Ageing and Development","Aging","Elsevier","For-profit associated with a society","Hybrid","European Society of Preventive, Regenerative and Anti-aging Medicine (ESAAM)","Society/Association","Netherlands","https://www.journals.elsevier.com/mechanisms-of-ageing-and-development","3891","1.897","Q1 (Aging; Developmental Biology)","146","No","1872-6216","0047-6374"
"Nature Aging","Aging","Springer Nature","For-profit","Hybrid","","","Germany / UK","https://www.nature.com/nataging","12759","9.5","Q1 (Aging; Geriatrics and Gerontology; Neuroscience)","75","No","2662-8465",""
"Pflügers Archiv - European Journal of Physiology","Physiology","Springer Nature","For-profit associated with a society","Hybrid","German Physiological Society","Society/Association","Germany / UK","https://link.springer.com/journal/424","2478","1.066","Q1 (Clinical Biochemistry)","153","No","1432-2013","0031-6768"
"Physiological Genomics","Physiology","American Physiological Society (APS)","Non-profit","Hybrid","American Physiological Society","Society/Association","USA","https://journals.physiology.org/journal/physiolgenomics","1548","0.882","Q2 (Genetics; Physiology)","132","No","1531-2267","1094-8341"
"Physiological Reports","Physiology","John Wiley & Sons","For-profit associated with a society","OA","The Physiological Society; American Physiological Society","Society/Association","USA","https://physoc.onlinelibrary.wiley.com/journal/2051817X","912","0.707","Q2 (Physiology)","72","No","2051-817X","2051-817X"
"Physiological Reviews","Physiology","American Physiological Society (APS)","Non-profit","Hybrid","American Physiological Society","Society/Association","USA","https://journals.physiology.org/journal/physrev","4374","11.493","Q1 (Medicine; Molecular Biology; Physiology)","417","No","1522-1210","0031-9333"
"Physiology","Physiology","American Physiological Society (APS)","Non-profit","Hybrid","American Physiological Society","Society/Association","USA","https://journals.physiology.org/journal/physiologyonline","","2.136","Q1 (Physiology)","154","No","1548-9221","1548-9213"
"The American Journal of Geriatric Psychiatry","Aging","Elsevier","For-profit associated with a society","Hybrid","American Association for Geriatric Psychiatry (AAGP)","Society/Association","Netherlands","https://www.ajgponline.org/","3194","1.515","Q1 (Geriatrics and Gerontology; Psychiatry and Mental Health)","155","No","1545-7214","1064-7481"
"The American Journal of Sports Medicine","Sport Science","Sage Publishing","For-profit associated with a society","","American Orthopaedic Society for Sports Medicine","Society/Association","USA","https://journals.sagepub.com/home/ajs","","2.29","Q1 (Medicine; Orthopedics and Sports Medicine; Physical Therapy, Sports Therapy and Rehabilitation; Sports Science)","292","No","1552-3365","0363-5465"
"The Anatomical Record","Anatomy","John Wiley & Sons","For-profit associated with a society","Hybrid","American Association for Anatomy","Society/Association","USA","https://anatomypubs.onlinelibrary.wiley.com/journal/19328494","2118","0.745","Q1 (Anatomy; Ecology, Evolution, Behavior and Systematics)","109","No","1932-8494","1932-8486"
"The International Journal of Aging and Human Development","Aging","Sage Publishing","For-profit","","-","","USA","https://journals.sagepub.com/home/ahdb","","0.886","Q2 (Developmental and Educational Psychology; Geriatrics and Gerontology)","76","No","1541-3535","0091-4150"
"The Journal of Nutrition Health and Aging","Nutrition","Elsevier","For-profit","OA","SERDI Publisher","","France","https://www.sciencedirect.com/journal/the-journal-of-nutrition-health-and-aging","2550","1.196","Q1 (Geriatrics and Gerontology; Medicine; Nutrition and Dietetics)","116","No","1760-4788","1279-7707"
"The Journal of Physiological Sciences","Physiology","Elsevier","For-profit associated with a society","OA","the Physiological Society of Japan","Society/Association","USA","https://www.sciencedirect.com/journal/the-journal-of-physiological-sciences","920","0.983","Q2 (Physiology)","65","No","1880-6562","1880-6546"
"The Journals of Gerontology Series A: Biological Sciences and Medical Sciences","Aging","Oxford University Press (OUP)","University Press","Hybrid","","","UK","https://academic.oup.com/biomedgerontology?login=false","3782","1.376","Q1 (Geriatrics and Gerontology)","238","No","1758-535X","1079-5006"
"The Journals of Gerontology Series B: Psychological Sciences and Social Sciences","Aging","Oxford University Press (OUP)","University Press","Hybrid","","","UK","https://academic.oup.com/psychsocgerontology?login=false","2999","1.503","Q1 (Clinical Psychology; Geriatrics and Gerontology; Gerontology; Health; Life-span and Life-course Studies; Medicine; Social Psychology; Sociology and Political Science)","193","No","1758-5368","1079-5014"
"The Korean Journal of Physiology & Pharmacology","Physiology","Korean Physiological Society (KPS); Korean Society of Pharmacology (KSP)","Non-profit","OA","Korean Physiological Society (KPS); Korean Society of Pharmacology (KSP)","Society/Association","Republic of Korea (South Korea)","https://www.kjpp.net/main.html","","0.606","Q3 (Pharmacology; Physiology)","46","No","2093-3827","1226-4512"
"npj Gut and Liver","Physiology","Springer Nature","For-profit","Hybrid","","","UK","https://www.nature.com/npjgutliver/","2390","","","","No","3004-9806",""
