"Journal","Field","Publisher","Publisher type","Business model","Institution","Institution type","Country","Website","APC Euros","Scimago Rank","Scimago Quartile","H index","PCI partner"
"Journal of Microbiology Immunology & Infection","Immunopathology","Elsevier","For-profit associated with a society","OA","the Taiwan Society of Microbiology; the Chinese Society of Immunology; the Infectious Diseases Society of Taiwan; the Taiwan Society of Parasitology","Society/Association","Netherlands","https://www.sciencedirect.com/journal/journal-of-microbiology-immunology-and-infection","1144","1.009","Q1 (Immunology and Microbiology; Infectious Diseases; Medicine)","78","No"
"Journal of Microbiology and Biotechnology","Immunopathology","Korean Society for Microbiology and Biotechnology (KMB)","Non-profit","Hybrid","Korean Society for Microbiology and Biotechnology (KMB)","Society/Association","South Korea","https://www.jmb.or.kr/main.html","622","0.684","Q2 (Applied Microbiology and Biotechnology; Biotechnology; Medicine)","89","No"
"Journal of Multiple Sclerosis Research and Neuroimmunology","Neuroimmunology","Korean Society of Neuroimmunology","Non-profit","","Korean Society of Neuroimmunology","Society/Association","","https://jmsni.org/","","","","","No"
"Journal of Neuroimmune Pharmacology","Neuroimmunology","Springer Nature","For-profit","Hybrid","","","Germany / UK","https://link.springer.com/journal/11481","3138","1.251","Q1 (Neuroscience; Pharmacology)","94","No"
"Journal of Neurovirology","Neuroimmunology","Springer Nature","For-profit","Hybrid","","","Germany / UK","https://link.springer.com/journal/13365","2420","0.634","Q3 (Cellular and Molecular Neuroscience; Neurology; Virology)","98","No"
"Journal of Ophthalmic Inflammation and Infection","Inflammation","Springer Nature","For-profit associated with a society","OA","International Ocular Inflammation Society (IOIS)","Society","UK","https://joii-journal.springeropen.com/","1456","0.787","Q2 (Infectious Diseases; Ophthalmology)","40","No"
"Journal of Pathology","Immunopathology","John Wiley & Sons","For-profit associated with a society","Hybrid","The Pathological Society of Great Britain and Ireland","Society","USA","https://pathsocjournals.onlinelibrary.wiley.com/journal/10969896","4277","2.16","Q1 (Pathology and Forensic Medicine)","214","No"
"Journal of Pathology Informatics","Immunopathology","Elsevier","For-profit associated with a society","OA","Association for Pathology Informatics (API)","Society","USA","https://www.sciencedirect.com/journal/journal-of-pathology-informatics","923","0.897","Q1 (Pathology and Forensic Medicine)","31","No"
"Journal of Pathology and Translational Medicine","Immunopathology","The Korean Society of Pathologists and The Korean Society for Cytopathology","Non-profit","OA","","","Korea, Republic of","https://www.jpatholtm.org/","","0.733","Q2 (Histology; Pathology and Forensic Medicine)","39","No"
"Journal of Pathology, Microbiology and Immunology - the APMIS journal","Immunogenetics, Molecular and Cellular Immunology","John Wiley & Sons","For-profit","Hybrid","","","USA","https://onlinelibrary.wiley.com/journal/16000463","2810","0.814","Q1 (Pathology and Forensic Medicine)","103","No"
"Journal of Reproductive Immunology","Reproductive Immunology","Elsevier","For-profit associated with a society","Hybrid","Asian Association for Reproductive Immunology; European Society of Reproductive Immunology; International Society for Immunology of Reproduction; Japanese Society for Immunology of Reproduction","Society","Netherlands","https://www.sciencedirect.com/journal/journal-of-reproductive-immunology","2455","0.857","Q2 (Immunology; Immunology and Allergy; Obstetrics and Gynecology; Reproductive Medicine)","104","No"
"Journal of Toxicologic Pathology","Immunotoxicology","J-STAGE","Non-profit","","Japanese Society of Toxicologic Pathology","Society/Association","","https://www.jstage.jst.go.jp/browse/tox/","","0.327","Q3 (Pathology and Forensic Medicine; Toxicology)","38","No"
"Journal of Translational Autoimmunity","Autoimmunity","Elsevier","For-profit","OA","","","Netherlands","https://www.sciencedirect.com/journal/journal-of-translational-autoimmunity","2461","1.512","Q1 (Immunology; Immunology and Allergy)","27","No"
"Journal of Viral Hepatitis","Virology","John Wiley & Sons","For-profit","Hybrid","","","USA","https://onlinelibrary.wiley.com/journal/13652893","2818","0.813","Q2 (Hepatology; Infectious Diseases; Virology)","112","No"
"Journal of Virological Methods","Virology","Elsevier","For-profit","Hybrid","","","Netherlands","https://www.sciencedirect.com/journal/journal-of-virological-methods","2402","0.488","Q3 (Virology)","119","No"
"Journal of Virology","Virology","American Society for Microbiology (ASM)","Non-profit","Hybrid","American Society for Microbiology (ASM)","Society/Association","USA","https://journals.asm.org/journal/jvi","2560","1.283","Q1 (Insect Science; Microbiology; Virology)","330","No"
"Journal of Virus Eradication","Virology","Elsevier","For-profit","OA","","","UK","https://www.sciencedirect.com/journal/journal-of-virus-eradication","1826","0.574","Q2 (Public Health, Environmental and Occupational Health)","19","No"
"Journal of Wildlife Diseases","Veterinary Immunology","Wildlife Disease Association (WDA)","Non-profit","Hybrid","Wildlife Disease Association (WDA)","Society","","https://meridian.allenpress.com/jwd","1403","0.443","Q2 (Ecology; Ecology, Evolution, Behavior and Systematics)","81","No"
"Journal of the International AIDS Society","Virology","John Wiley & Sons","For-profit associated with a society","OA","International AIDS Society","Society/Association","USA","https://onlinelibrary.wiley.com/journal/17582652","2527","1.769","Q1 (Infectious Diseases; Public Health, Environmental and Occupational Health)","90","No"
"Journal of the Pediatric Infectious Diseases Society","Immunopathology","Oxford University Press (OUP)","University Press associated with a society","Hybrid","Pediatric Infectious Diseases Society","Society/Association","UK","https://academic.oup.com/jpids","3086","0.887","Q1 (Pediatrics, Perinatology and Child Health)","55","No"
"Leprosy Review","Immunopathology","Lepra","Non-profit","OA","British Leprosy Relief Association; Associazione Italiana Amici di Raoul Follereau (AIFO); The Leprosy Mission International; Hope Rises International; Leprosy Relief Canada; German Leprosy and Tuberculosis Relief Association; Damien Foundation Belgium; FAIRMED; Fontilles; Fondation Raoul Follereau; Sasakawa Foundation; NLR International (Netherlands Leprosy Relief)","Society","UK","https://leprosyreview.org/","","0.302","Q3 (Dermatology; Infectious Diseases; Medicine)","52","No"
"Liver Transplantation","Transplant Immunology","Wolters Kluwer (Lippincott)","For-profit associated with a society","Hybrid","American Association for the Study of Liver Diseases (AASLD)","Society","Netherlands / USA","https://journals.lww.com/lt/Pages/default.aspx","1121","1.367","Q1 (Hepatology; Surgery; Transplantation)","172","No"
"Lupus","Autoimmunity","Sage Publishing","For-profit","Hybrid","","","USA","https://journals.sagepub.com/home/lup","595","0.779","Q2 (Rheumatology)","122","No"
"Lupus Science and Medicine","Autoimmunity","BMJ Group","Non-profit","OA","Lupus Foundation of America (LFA)","Non-profit","UK","https://lupus.bmj.com/","2160","1.401","Q1 (Immunology; Medicine; Rheumatology)","43","No"
"Lymphology","Generalist/Classical Immunology","University of Arizona Libraries","University Press associated with a society","OA","International Society of Lymphology","Society/Association","","https://journals.librarypublishing.arizona.edu/lymph/","","0.253","Q4 (Hematology; Immunology and Allergy)","53","No"
"Malaria Journal","Immunopathology","Springer Nature (BioMed Central)","For-profit","OA","","","UK","https://malariajournal.biomedcentral.com/","2175","1.143","Q1 (Infectious Diseases; Parasitology)","126","No"
"Malaysian Journal of Pathology","Immunopathology","College of Pathologists, Academy of Medicine of Malaysia (AMM)","Non-profit","","College of Pathologists, Academy of Medicine of Malaysia (AMM)","","","https://www.mjpath.org.my/","","0.262","Q3 (Medicine; Pathology and Forensic Medicine)","27","No"
"Mediators of Inflammation","Inflammation","John Wiley & Sons","For-profit","OA","","","UK","https://onlinelibrary.wiley.com/journal/4792","1885","1.225","Q2 (Cell Biology; Immunology)","145","No"
"Medical Microbiology and Immunology","Clinical Immunology","Springer Nature","For-profit","Hybrid","","","Germany / UK","https://link.springer.com/journal/430","2642","1.016","Q1 (Medicine)","75","No"
"Medical Mycology","Clinical Immunology","Oxford University Press (OUP)","University Press","Hybrid","","","UK","https://academic.oup.com/mmy","3974","0.589","Q1 (Veterinary)","109","No"
"Mediterranean Journal of Hematology and Infectious Diseases","Immunopathology","PAGEPress Publications","For-profit associated with a society","OA","Università Cattolica del Sacro Cuore","University/Government","Italy","https://www.mjhid.org/index.php/mjhid","459","0.461","Q3 (Hematology; Infectious Diseases)","44","No"
"Microbes and Infection","Immunopathology","Elsevier","For-profit associated with a society","Hybrid","Institut Pasteur","University/Government","Netherlands","https://www.pasteur.fr/fr/ceris/publications-scientifiques/microbes-infection","1734","0.744","Q2 (Infectious Diseases; Microbiology)","160","No"
"Microbial Drug Resistance","Immunopathology","Sage Publishing (Mary-Ann Liebert)","For-profit","Hybrid","","","","https://home.liebertpub.com/publications/microbial-drug-resistance/44/overview","2768","0.627","Q2 (Medicine; Microbiology; Pharmacology)","79","No"
"Microbial Pathogenesis","Immunopathology","Elsevier","For-profit","Hybrid","","","Netherlands","https://www.sciencedirect.com/journal/microbial-pathogenesis","2485","0.825","Q2 (Infectious Diseases; Microbiology)","107","No"
"Microbiology Resource Announcements","Immunopathology","American Society for Microbiology (ASM)","Non-profit","OA","American Society for Microbiology","Society/Association","","https://journals.asm.org/journal/mra","1009","0.266","Q3 (Immunology and Microbiology)","48","No"
"Microbiology and Immunology","Immunopathology","John Wiley & Sons","For-profit associated with a society","Hybrid","Japanese Society for Bacteriology; Japanese Society for Virology; Japanese Society for Host Defense Research","Society/Association","USA","https://onlinelibrary.wiley.com/journal/13480421","2270","0.669","Q3 (Immunology; Microbiology; Virology)","86","No"
"Molecular Immunology","Immunogenetics, Molecular and Cellular Immunology","Elsevier","For-profit","Hybrid","","","Netherlands","https://www.sciencedirect.com/journal/molecular-immunology","2819","0.894","Q2 (Immunology; Molecular Biology)","154","No"
"Mucosal Immunology","Immunopathology","Springer Nature","For-profit associated with a society","Hybrid","Society for Mucosal Immunology","Society/Association","Germany / UK","https://www.nature.com/mi/","3285","3.148","Q1 (Immunology; Immunology and Allergy)","140","No"
"Mycopathologia","Immunopathology","Springer Nature","For-profit","Hybrid","","","Germany/UK","https://link.springer.com/journal/11046","2644","0.588","Q1 (Agronomy and Crop Science; Veterinary)","90","No"
"Mycoses","Immunopathology","Elsevier","For-profit","Hybrid","","","Netherlands","https://onlinelibrary.wiley.com/journal/14390507","3290","0.927","Q1 (Dermatology; Medicine)","91","No"
"Médecine Tropicale et Santé Internationale","Clinical Immunology","Société francophone de médecine tropicale et santé internationale","Non-profit","OA diamond","Société francophone de médecine tropicale et santé internationale (ancienne SPE)","Society","France","https://revuemtsi.societe-mtsi.fr","0","0.186","Q4 (Pathology and Forensic Medicine)","43","No"
"Médecine et Santé Tropicale","Clinical Immunology","John Libbey Eurotext","For-profit","","","","France","https://www.jle.com/fr/revues/mst/revue.phtml","","","","","No"
"Nature Immunology","Generalist/Classical Immunology","Springer Nature","For-profit","Hybrid","","","Germany","https://www.nature.com/ni/","9627","10.39","Q1 (Immunology; Immunology and Allergy)","452","No"
"Nature Reviews Disease Primers","Immunopathology","Springer Nature","For-profit","Hybrid","","","Germany/UK","https://www.nature.com/nrdp/","","17.995","Q1 (Medicine)","210","No"
"Nature Reviews Immunology","Generalist/Classical Immunology","Springer Nature","For-profit","Hybrid","","","Germany/UK","https://www.nature.com/nri/","","17.458","Q1 (Immunology; Immunology and Allergy; Medicine)","486","No"
"Neurobiology of Disease","Neuroimmunology","Elsevier","For-profit","OA","","","Netherlands","https://www.sciencedirect.com/journal/neurobiology-of-disease","2385","2.009","Q1 (Neurology)","199","No"
"Neuroimmunomodulation","Neuroimmunology","Karger Publishers","For-profit","OA","","","Switzerland","https://karger.com/NIM","2371","0.653","Q3 (Endocrine and Autonomic Systems; Endocrinology; Immunology; Neurology)","76","No"
"Neurology Neuroimmunology Neuroinflammation","Neuroimmunology","American Academy of Neurology Journals","Non-profit","OA","American Academy of Neurology Journals","","USA","https://www.neurology.org/journal/nxi","2768","3.008","Q1 (Neurology)","78","No"
"Neuropathology","Neuroimmunology","John Wiley & Sons","For-profit","Hybrid","","","USA","https://onlinelibrary.wiley.com/journal/14401789","1421","0.497","Q2 (Pathology and Forensic Medicine)","72","No"
"OncoImmunology","Immunooncology","Taylor & Francis Group","For-profit","OA","","","UK","https://www.tandfonline.com/journals/koni20","2515","2.542","Q1 (Immunology; Immunology and Allergy; Oncology)","124","No"
"PLOS Pathogens","Immunopathology","Public Library of Science (PLoS)","Non-profit","OA","","","USA","https://journals.plos.org/plospathogens","2466","1.987","Q1 (Genetics; Immunology; Microbiology; Molecular Biology; Parasitology; Virology)","260","No"
"Parasite","Parasitology","CSPM (EDP Sciences, Édition Diffusion Presse Sciences)","For-profit associated with a society","OA","Societe française de parasitologie","Society","China","https://www.parasite-journal.org/","1082","0.65","Q1 (Agricultural and Biological Sciences; Animal Science and Zoology; Insect Science; Veterinary)","58","No"
"Parasites, Hosts and Diseases","Parasitology","The Korean Society for Parasitology and Tropical Medicine","Non-profit","OA","The Korean Society for Parasitology and Tropical Medicine","Society/Association","South Korea","https://www.parahostdis.org/index.php","","0.403","Q3 (Infectious Diseases; Parasitology)","51","No"
"Parasitology International","Parasitology","Elsevier","For-profit associated with a society","Hybrid","Japanese Society of Parasitology","Society/Association","Netherlands","https://www.sciencedirect.com/journal/parasitology-international","2903","0.54","Q2 (Parasitology)","71","No"
"Peer Community In Infections","Immunopathology","Peer Community In","Non-profit","","Peer Community In","","France","https://infections.peercommunityin.org/","","","","","No"
"Peer Community In Microbiology","Immunopathology","Peer Community In","Non-profit","OA diamond","Peer Community In","","France","https://microbiol.peercommunityin.org/","0","","","","No"
"Plos Neglected Tropical Diseases","Immunopathology","Public Library of Science (PLoS)","Non-profit","OA","Public Library of Science (PLoS)","","USA","https://journals.plos.org/plosntds/","2255","1.37","Q1 (Infectious Diseases; Pharmacology, Toxicology and Pharmaceutics; Public Health, Environmental and Occupational Health)","172","No"
"Rapid Reviews\Infectious Diseases","Immunopathology","MIT press direct","University Press","","","","","https://rrid.mitpress.mit.edu/","","","","","No"
"Retrovirology","Virology","Springer Nature (BioMed Central)","For-profit","OA","","","UK","https://retrovirology.biomedcentral.com/","2431","0.982","Q1 (Infectious Diseases)","100","No"
"Reviews in Medical Virology","Virology","John Wiley & Sons","For-profit","Hybrid","","","USA","https://onlinelibrary.wiley.com/journal/10991654","3195","2.091","Q1 (Infectious Diseases; Virology)","110","No"
"Sage Open Pathology","Immunopathology","Sage Publishing","For-profit","","","","USA","https://journals.sagepub.com/home/patd","","","","","No"
"Science Immunology","Generalist/Classical Immunology","American Association for the Advancement of Science (AAAS)","Non-profit","Hybrid","American Association for the Advancement of Science","Society/Association","USA","https://www.science.org/journal/sciimmunol","1690","8.22","Q1 (Immunology; Immunology and Allergy)","123","No"
"Seminars in Immunology","Generalist/Classical Immunology","Elsevier","For-profit","Hybrid","","","Netherlands","https://www.sciencedirect.com/journal/seminars-in-immunology","2763","3.417","Q1 (Immunology; Immunology and Allergy)","153","No"
"Sexually Transmitted Diseases","Virology","Wolters Kluwer","For-profit associated with a society","Hybrid","American Sexually Transmitted Diseases Association (ASTDA)","Society/Association","Netherlands","https://journals.lww.com/stdjournal/pages/default.aspx","2883","0.971","Q1 (Dermatology; Infectious Diseases; Public Health, Environmental and Occupational Health)","115","No"
"Social Psychiatry and Psychiatric Epidemiology","Epidemiology","Springer Nature","For-profit","Hybrid","","","Germany/UK","https://link.springer.com/journal/127","3491","1.887","Q1 (Epidemiology; Health; Psychiatry and Mental Health; Social Psychology)","152","No"
"The AAPS Journal","Veterinary Immunology","Springer Nature","For-profit associated with a society","Hybrid","American Association of Pharmaceutical Scientists (AAPS)","Society","Germany / UK","https://link.springer.com/journal/12248","3138","1.307","Q1 (Pharmaceutical Science)","136","No"
"The American Journal of Pathology","Immunopathology","Elsevier","For-profit associated with a society","Hybrid","American Society for Investigative Pathology","Society/Association","Netherlands","https://www.sciencedirect.com/journal/the-american-journal-of-pathology","2756","1.313","Q1 (Pathology and Forensic Medicine)","313","No"
"The American Journal of Tropical Medicine and Hygiene","Immunopathology","American Society of Tropical Medicine and Hygiene","Non-profit","Hybrid","","","","https://www.ajtmh.org/","2606","0.726","Q2 (Infectious Diseases; Medicine; Parasitology; Virology)","173","No"
"The Brazilian Journal of Infectious Diseases","Immunopathology","Elsevier","For-profit associated with a society","OA","Brazilian Society of Infectious Diseases (SBI)","Society/Association","Netherlands","https://www.sciencedirect.com/journal/the-brazilian-journal-of-infectious-diseases","998","0.644","Q2 (Infectious Diseases; Microbiology)","59","No"
"The Journal of Heart Lung Transplantation","Transplant Immunology","Elsevier","For-profit associated with a society","Hybrid","International Society for Heart and Lung Transplantation","Society/Association","Netherlands","https://www.jhltonline.org/","2742","2.359","Q1 (Cardiology and Cardiovascular Medicine; Pulmonary and Respiratory Medicine; Surgery; Transplantation)","162","No"
"The Journal of Immunology","Generalist/Classical Immunology","Oxford University Press (OUP)","University Press associated with a society","Hybrid","American Association of Immunologists","Society/Association","USA","https://journals.aai.org/jimmunol","2455","1.425","Q1 (Immunology; Immunology and Allergy)","422","No"
"The Journal of Infectious Diseases","Immunopathology","Oxford University Press (OUP)","University Press","OA","","","UK","https://academic.oup.com/jid","3020","2.038","Q1 (Immunology and Allergy; Infectious Diseases)","282","No"
"The Journal of Parasitology","Parasitology","CJK Group (Allen Press)","For-profit associated with a society","OA","American Society of Parasitologists (ASP)","Society","USA","https://journal-of-parasitology.kglmeridian.com/","1114","0.397","Q3 (Ecology, Evolution, Behavior and Systematics; Medicine; Parasitology)","105","No"
"The Journal of Pathology: Clinical Research","Immunopathology","John Wiley & Sons","For-profit associated with a society","OA","The Pathological Society of Great Britain and Ireland","Society","UK","https://pathsocjournals.onlinelibrary.wiley.com/journal/20564538","2388","1.521","Q1 (Pathology and Forensic Medicine)","36","No"
"The Lancet HIV","Virology","Elsevier","For-profit","Hybrid","","","Netherlands","https://www.thelancet.com/journals/lanhiv/home","4577","4.506","Q1 (Epidemiology; Immunology; Infectious Diseases; Virology)","91","No"
"The Lancet Infectious Diseases","Immunopathology","Elsevier","For-profit","Hybrid","","","Netherlands","https://www.thelancet.com/journals/laninf/home","4627","5.446","Q1 (Infectious Diseases)","304","No"
"The Lancet Microbe","Immunopathology","Elsevier","For-profit","OA","","","Netherlands","https://www.thelancet.com/journals/lanmic/home","5053","5.262","Q1 (Infectious Diseases; Microbiology; Virology)","53","No"
"Therapeutic Advances in Infectious Disease","Immunopathology","Sage Publishing","For-profit","OA","","","USA","https://journals.sagepub.com/home/taia","","1.197","Q1 (Infectious Diseases; Pharmacology)","34","No"
"Toxicologic Pathology","Immunotoxicology","Sage Publishing","For-profit associated with a society","Hybrid","Society of Toxicologic Pathology; British Society of Toxicological Pathology; European Society of Toxicologic Pathology","Society","USA","https://journals.sagepub.com/home/tpx","3025","0.545","Q2 (Pathology and Forensic Medicine)","129","No"
"Transboundary and Emerging Diseases","Immunopathology","John Wiley & Sons","For-profit","Hybrid","","","USA","https://onlinelibrary.wiley.com/journal/tbed","3421","0.919","Q1 (Immunology and Microbiology; Medicine; Veterinary)","92","No"
"Transplant Immunology","Transplant Immunology","Elsevier","For-profit","Hybrid","","","Netherlands","https://www.sciencedirect.com/journal/transplant-immunology","3440","0.458","Q2 (Transplantation)","68","No"
"Transplant International","Transplant Immunology","Frontiers Media SA","For-profit associated with a society","OA","European Society for Organ Transplantation (ESOT)","Society/Association","Switzerland","https://www.frontierspartnerships.org/journals/transplant-international","2186","0.909","Q1 (Transplantation)","97","No"
"Transplantation","Transplant Immunology","Wolters Kluwer","For-profit associated with a society","OA","The Transplantation Society","Society/Association","Netherlands","https://journals.lww.com/transplantjournal/pages/default.aspx","","1.325","Q1 (Transplantation)","224","No"
"Transplantation Proceedings","Transplant Immunology","Elsevier","For-profit","Hybrid","","","Netherlands","https://www.sciencedirect.com/journal/transplantation-proceedings","2336","0.298","Q3 (Surgery; Transplantation)","93","No"
"Transplantation Reviews","Transplant Immunology","Elsevier","For-profit","Hybrid","","","Netherlands","https://www.sciencedirect.com/journal/transplantation-reviews","2493","1.153","Q1 (Surgery; Transplantation)","57","No"
"Transplantation and Cellular Therapy","Transplant Immunology","Elsevier","For-profit associated with a society","Hybrid","American Society for Transplantation and Cellular Therapy","Society/Association","Netherlands","https://www.sciencedirect.com/journal/transplantation-and-cellular-therapy","3243","2.195","Q1 (Cell Biology; Hematology; Immunology and Allergy; Molecular Medicine; Transplantation)","147","No"
"Travel Medicine and Infectious Disease","Immunopathology","Elsevier","For-profit associated with a society","OA","Royal College of Physicians and Surgeons of Glasgow, the Latin American Society for Travel Medicine, the German Society for Tropical Medicine and International Health","Society/Association","Netherlands","https://www.sciencedirect.com/journal/travel-medicine-and-infectious-disease","1850","0.955","Q1 (Public Health, Environmental and Occupational Health)","77","No"
"Trends in Immunology","Generalist/Classical Immunology","Elsevier (Cell Press)","For-profit","Hybrid","","","USA","https://www.cell.com/trends/immunology","4053","3.895","Q1 (Immunology; Immunology and Allergy)","265","No"
"Trends in Parasitology","Parasitology","Elsevier","For-profit","Hybrid","Elsevier","","Netherlands","https://www.sciencedirect.com/journal/trends-in-parasitology","3645","1.306","Q1 (Infectious Diseases; Parasitology)","173","No"
"Tumour Virus Research","Virology","Elsevier","For-profit associated with a society","OA","World Society for Virology","Society/Association","Netherlands","https://www.sciencedirect.com/journal/tumour-virus-research","1024","1.889","Q1 (Cancer Research; Infectious Diseases; Virology)","38","No"
"Vaccine","Vaccinology","Elsevier","For-profit","Hybrid","","","Netherlands","https://www.journals.elsevier.com/vaccine","2735","1.248","Q1 (Immunology and Microbiology; Infectious Diseases; Public Health, Environmental and Occupational Health; Veterinary)","222","No"
"Veterinary Pathology","Veterinary Immunology","Sage Publishing","For-profit","Hybrid","","","USA","https://journals.sagepub.com/home/vet","2428","0.776","Q1 (Veterinary)","113","No"
"Viral Immunology","Virology","Sage Publishing","For-profit","Hybrid","","","USA","https://journals.sagepub.com/home/vim","3405","0.349","Q3 (Virology)","71","No"
"Virologica Sinica","Virology","Elsevier","For-profit","Hybrid","","","Netherlands","https://www.sciencedirect.com/journal/virologica-sinica","2330","0.949","Q2 (Immunology; Infectious Diseases; Molecular Medicine; Virology)","50","No"
"Virologie","Virology","John Libbey Eurotext","For-profit associated with a society","Hybrid","Société Française de Virologie","Society/Association","France","https://sfv-virologie.org/revue-virologie","333","0.166","Q4 (Infectious Diseases; Virology)","13","No"
