"Journal","Field","Publisher","Publisher type","Business model","Institution","Institution type","Country","Website","APC Euros","Scimago Rank","Scimago Quartile","H index","PCI partner"
"AIDS","Virology","Wolters Kluwer (Lippincott)","For-profit","Hybrid","","","Netherlands / USA","https://journals.lww.com/aidsonline/pages/default.aspx","3625","1.209","Q1 (Infectious Diseases)","233","No"
"AIDS Research and Human Retroviruses","Virology","Sage Publishing (Mary Ann Liebert)","For-profit","Hybrid","","","USA","https://home.liebertpub.com/publications/aids-research-and-human-retroviruses/2/overview","2791","0.554","Q3 (Immunology; Infectious Diseases; Virology)","99","No"
"AIDS Research and Therapy","Virology","Springer Nature (BioMed Central)","For-profit","OA","","","UK","https://aidsrestherapy.biomedcentral.com/","2217","0.943","Q2 (Molecular Medicine; Pharmacology; Virology)","51","No"
"AIDS Reviews","Virology","Permanyer Publications","For-profit","OA","","","Spain","https://www.aidsreviews.com/","","0.491","Q3 (Infectious Diseases; Medicine; Pharmacology)","63","No"
"AIDS and behavior","Virology","Springer Nature","For-profit","Hybrid","","","Germany / UK","https://link.springer.com/journal/10461","3309","1.251","Q1 (Infectious Diseases; Public Health, Environmental and Occupational Health; Social Psychology)","133","No"
"Acta Parasitologica","Parasitology","Springer Nature","For-profit","Hybrid","","","Germany / UK","https://link.springer.com/journal/11686","2090","0.432","Q3 (Parasitology)","43","No"
"Acta Virologica","Virology","Frontiers Media SA","For-profit","OA","Biomedical Research Centre of the Slovak Academy of Sciences","","Switzerland","https://www.frontierspartnerships.org/journals/acta-virologica","1950","0.36","Q3 (Infectious Diseases; Medicine; Virology)","38","No"
"Acta tropica","Virology","Elsevier","For-profit","Hybrid","","","Netherlands","https://www.sciencedirect.com/journal/acta-tropica","2145","0.752","Q1 (Insect Science; Veterinary)","122","No"
"Advances in Immunology","Generalist/Classical Immunology","Elsevier","For-profit","","","","Netherlands","https://www.sciencedirect.com/bookseries/advances-in-immunology","","","-","118","No"
"Advances in Virus Research","Virology","Elsevier","For-profit","","","","Netherlands","https://www.sciencedirect.com/bookseries/advances-in-virus-research","","","-","108","No"
"Allergologia et Immunopathologia","Allergy and Hypersensitivity","Codon Publications","For-profit associated with a society","Hybrid","Sociedad Española de Inmunología Clínica, Alergología y Asma Pediátrica (SEICAP); Latin American Society of Immunodeficiencies (LASID)","Society","","https://all-imm.com/index.php/aei/index","1221","0.416","Q3 (Immunology; Immunology and Allergy; Medicine; Pulmonary and Respiratory Medicine)","47","No"
"Allergology International","Allergy and Hypersensitivity","Elsevier","For-profit associated with a society","OA","Japanese Society of Allergology","Society/Association","Netherlands","https://www.sciencedirect.com/journal/allergology-international","2080","1.627","Q1 (Immunology and Allergy; Medicine)","82","No"
"Allergy","Allergy and Hypersensitivity","John Wiley & Sons","For-profit","Hybrid","","","USA","https://onlinelibrary.wiley.com/journal/13989995","2590","3.622","Q1 (Immunology; Immunology and Allergy)","213","No"
"Allergy Asthma and Immunology Research","Allergy and Hypersensitivity","Korean Academy of Asthma, Allergy and Clinical Immunology; Korean Academy of Pediatric Allergy and Respiratory Disease","Non-profit","OA","","","","https://e-aair.org/","479","1.294","Q1 (Immunology and Allergy; Pulmonary and Respiratory Medicine)","67","No"
"Allergy, Asthma and Clinical Immunology","Allergy and Hypersensitivity","Springer Nature (BioMed Central)","For-profit associated with a society","OA","Canadian Society of Allergy and Clinical Immunology","Society","UK","https://aacijournal.biomedcentral.com/","1873","0.779","Q2 (Pulmonary and Respiratory Medicine)","56","No"
"American Journal of Epidemiology","Epidemiology","Oxford University Press (OUP)","University Press associated with a society","Hybrid","Johns Hopkins Bloomberg School of Public Health; Society for Epidemiologic Research","Society/Association","UK","https://academic.oup.com/aje/?login=false","3912","2.046","Q1 (Epidemiology)","297","No"
"American Journal of Infection Control","Epidemiology","Elsevier","For-profit associated with a society","Hybrid","Association for Professionals in Infection Control and Epidemiology (APIC)","Society/Association","Netherlands","https://www.ajicjournal.org/","1517","0.911","Q1 (Health Policy)","133","No"
"American Journal of Reproductive Immunology","Reproductive Immunology","John Wiley & Sons","For-profit","Hybrid","","","USA","https://onlinelibrary.wiley.com/journal/16000897","3212","0.835","Q2 (Immunology and Allergy; Obstetrics and Gynecology; Reproductive Medicine)","119","No"
"American Journal of Rhinology and Allergy","Allergy and Hypersensitivity","Sage Publishing","For-profit","","","","USA","https://journals.sagepub.com/home/ajr","","0.914","Q1 (Medicine; Otorhinolaryngology)","91","No"
"American Journal of Transplantation","Transplant Immunology","Elsevier","For-profit associated with a society","Hybrid","American Society of Transplantation; American Society of Transplant Surgeons","Society/Association","Netherlands","https://www.amjtransplant.org/","3418","2.439","Q1 (Immunology and Allergy; Pharmacology; Transplantation)","229","No"
"Annals of Allergy, Asthma and Immunology","Allergy and Hypersensitivity","Elsevier","For-profit associated with a society","Hybrid","American College of Allergy, Asthma & Immunology","","Netherlands","https://www.annallergy.org/","2665","1.082","Q1 (Pulmonary and Respiratory Medicine)","132","No"
"Annals of Clinical Microbiology and Antimicrobials","Immunopathology","Springer Nature (BioMed Central)","For-profit","OA","","","UK","https://ann-clinmicrob.biomedcentral.com/","2856","0.968","Q1 (Medicine)","75","No"
"Annals of Epidemiology","Epidemiology","Elsevier","For-profit associated with a society","Hybrid","American College of Epidemiology","","Netherlands","https://www.sciencedirect.com/journal/annals-of-epidemiology","2643","1.2","Q1 (Epidemiology)","145","No"
"Annals of Transplantation","Transplant Immunology","International Scientific Information Inc.","For-profit","OA","","","USA","https://annalsoftransplantation.com/","1855","0.449","Q2 (Transplantation)","45","No"
"Annual Review of Immunology","Generalist/Classical Immunology","Annual Reviews","Non-profit","Hybrid","Annual Reviews","Non-profit","USA","https://www.annualreviews.org/journal/immunol","","16.428","Q1 (Immunology; Immunology and Allergy)","337","No"
"Annual Review of Pathology: Mechanisms of Disease","Immunopathology","Annual Reviews","Non-profit","","Annual Reviews","Non-profit","USA","https://www.annualreviews.org/content/journals/pathmechdis","","12.185","Q1 (Medicine; Pathology and Forensic Medicine; Plant Science)","156","No"
"Annual Review of Virology","Virology","Annual Reviews","Non-profit","","Annual Reviews","Non-profit","USA","https://www.annualreviews.org/content/journals/virology","","4.025","Q1 (Virology)","72","No"
"Antimicrobial Resistance and Infection Control","Immunopathology","Springer Nature (BioMed Central)","For-profit associated with a society","OA","International Conference for Prevention and Infection Control (ICPIC); Asia Pacific Society of Infection Control (APSIC); Infection Control Africa Network (ICAN)","Society","UK","https://aricjournal.biomedcentral.com/","2465","1.278","Q1 (Infectious Diseases; Microbiology; Pharmacology; Public Health, Environmental and Occupational Health)","77","No"
"Antiviral Research","Virology","Elsevier","For-profit associated with a society","Hybrid","International Society for Antiviral Research","Society/Association","Netherlands","https://www.sciencedirect.com/journal/antiviral-research","2793","1.195","Q1 (Pharmacology; Virology)","157","No"
"Antiviral Therapy","Virology","Sage Publishing","For-profit","OA","","","USA","https://journals.sagepub.com/home/avta","1592","0.627","Q2 (Infectious Diseases; Pharmacology)","94","No"
"Applied Immunohistochemistry & Molecular Morphology","Immunogenetics, Molecular and Cellular Immunology","Wolters Kluwer (Lippincott)","For-profit associated with a society","Hybrid","International Society for Immunohistochemisty and Molecular Morphology","Society/Association","Netherlands / USA","https://journals.lww.com/appliedimmunohist/pages/default.aspx","2633","0.562","Q2 (Histology; Medical Laboratory Technology; Pathology and Forensic Medicine)","82","No"
"Archives of Toxicology","Immunotoxicology","Springer Nature","For-profit","Hybrid","","","Germany / UK","https://link.springer.com/journal/204","2519","1.456","Q1 (Health, Toxicology and Mutagenesis; Medicine; Toxicology)","149","No"
"Archives of Virology","Virology","Springer Nature","For-profit associated with a society","Hybrid","International Union of Microbiological Societies; International Committee on Taxonomy of Viruses (ICTV)","Society/Association","Germany / UK","https://link.springer.com/journal/705","3556","0.671","Q2 (Medicine; Virology)","135","No"
"Autoimmunity","Autoimmunity","Taylor & Francis Group","For-profit","Hybrid","","","USA","https://www.tandfonline.com/journals/iaut20","2644","0.842","Q2 (Immunology; Immunology and Allergy)","84","No"
"Autoimmunity Reviews","Autoimmunity","Elsevier","For-profit","Hybrid","","","Netherlands","https://www.journals.elsevier.com/autoimmunity-reviews","4177","2.844","Q1 (Immunology; Immunology and Allergy)","161","No"
"BMC Immunology","Generalist/Classical Immunology","Springer Nature","For-profit","OA","","","UK","https://bmcimmunol.biomedcentral.com/","2371","0.818","Q3 (Immunology)","76","No"
"BMC Infectious Diseases","Immunopathology","Springer Nature (BioMed Central)","For-profit","OA","","","UK","https://bmcinfectdis.biomedcentral.com/","2246","1.035","Q1 (Infectious Diseases)","137","No"
"BMC Microbiology","Immunogenetics, Molecular and Cellular Immunology","Springer Nature (BioMed Central)","For-profit","OA","","","UK","https://bmcmicrobiol.biomedcentral.com/","2154","1.032","Q1 (Microbiology)","147","No"
"Bone Marrow Transplantation","Transplant Immunology","Springer Nature","For-profit associated with a society","Hybrid","European Society for Blood and Marrow Transplant (EBMT)","Society/Association","Germany / UK","https://www.nature.com/bmt/","3035","1.709","Q1 (Hematology; Transplantation)","149","No"
"Brain, Behavior and Immunity","Neuroimmunology","Elsevier","For-profit associated with a society","Hybrid","Psychoneuroimmunology Research Society (PNIRS)","Society/Association","Netherlands","https://www.sciencedirect.com/journal/brain-behavior-and-immunity","2796","2.704","Q1 (Behavioral Neuroscience; Endocrine and Autonomic Systems; Immunology)","207","No"
"Brain, Behavior and Immunity - Health","Neuroimmunology","Elsevier","For-profit associated with a society","OA","Psychoneuroimmunology Research Society (PNIRS)","Society/Association","Netherlands","https://www.sciencedirect.com/journal/brain-behavior-and-immunity-health","2554","1.249","Q1 (Nephrology; Psychiatry and Mental Health)","35","No"
"Brain, Behavior and Immunity Integrative","Neuroimmunology","Elsevier","For-profit associated with a society","OA","Psychoneuroimmunology Research Society (PNIRS)","Society/Association","Netherlands","https://www.sciencedirect.com/journal/brain-behavior-and-immunity-integrative","2280","","","","No"
"Cancer Immunology Research","Immunooncology","American Association for Cancer Research","Non-profit","Hybrid","American Association for Cancer Research (AACR)","Society/Association","USA","https://aacrjournals.org/cancerimmunolres","5073","3.63","Q1 (Cancer Research; Immunology)","147","No"
"Cancer Immunology, Immunotherapy","Immunooncology","Springer Nature","For-profit","OA","","","Germany/UK","https://link.springer.com/journal/262","2756","1.716","Q1 (Cancer Research; Immunology; Immunology and Allergy; Medicine; Oncology)","142","No"
"Cell Death & Disease","Generalist/Classical Immunology","Springer Nature","For-profit","OA","Associazione Differenziamento e Morte Cellulare","","Germany/UK","https://www.nature.com/cddis/","3668","2.773","Q1 (Cancer Research; Cell Biology; Cellular and Molecular Neuroscience; Immunology; Medicine)","181","No"
"Cell Host and Microbe","Immunopathology","Elsevier (Cell Press)","For-profit","Hybrid","","","USA","https://www.cell.com/cell-host-microbe","7045","7.067","Q1 (Cancer Research; Immunology and Microbiology; Microbiology; Molecular Biology; Parasitology; Virology)","255","No"
"Cellular Immunology","Immunogenetics, Molecular and Cellular Immunology","Elsevier","For-profit","Hybrid","","","Netherlands","https://www.sciencedirect.com/journal/cellular-immunology","2593","1.26","Q2 (Immunology)","111","No"
"Cellular and Molecular Immunology","Immunogenetics, Molecular and Cellular Immunology","Springer Nature","For-profit associated with a society","Hybrid","Chinese Society for Immunology; University of Science and Technology of China","Society/Association","Germany / UK","https://www.nature.com/cmi/","3034","5.916","Q1 (Immunology; Immunology and Allergy; Infectious Diseases; Medicine)","135","No"
"Central European Journal of Immunology","Generalist/Classical Immunology","Polish Society of Experimental and Clinical Immunology","Non-profit","OA","Polish Society of Experimental and Clinical Immunology","Society/Association","Poland","https://ceji.termedia.pl/Journal/Central_European_Journal_of_nbsp_Immunology-10","692","0.447","Q3 (Immunology; Immunology and Allergy)","38","No"
"Clinical Epidemiology","Epidemiology","Taylor & Francis Group","For-profit","OA","","","UK","https://www.tandfonline.com/journals/dcle20","2688","1.641","Q1 (Epidemiology)","85","No"
"Clinical Immunology","Clinical Immunology","Elsevier","For-profit associated with a society","Hybrid","Clinical Immunology Society","Society/Association","USA","https://www.sciencedirect.com/journal/clinical-immunology","3558","1.279","Q2 (Immunology; Immunology and Allergy)","145","No"
"Clinical Infectious Diseases","Immunopathology","Oxford University Press (OUP)","University Press","Hybrid","","","UK","https://academic.oup.com/cid?login=true","3082","2.992","Q1 (Infectious Diseases; Microbiology)","398","No"
"Clinical Microbiology Reviews","Immunopathology","American Society for Microbiology (ASM)","Non-profit","Hybrid","","","","https://journals.asm.org/journal/cmr","3013","5.594","Q1 (Epidemiology; Immunology and Microbiology; Infectious Diseases; Microbiology; Public Health, Environmental and Occupational Health)","340","No"
"Clinical Microbiology and Infection","Immunopathology","Elsevier","For-profit associated with a society","Hybrid","European Society of Clinical Microbiology and Infectious Diseases","Society/Association","Netherlands","https://www.clinicalmicrobiologyandinfection.org/","2684","2.742","Q1 (Infectious Diseases; Medicine; Microbiology)","210","No"
"Clinical Reviews in Allergy and Immunology","Allergy and Hypersensitivity","Springer Nature","For-profit","Hybrid","","","Germany / UK","https://link.springer.com/journal/12016","3606","3.163","Q1 (Immunology and Allergy; Medicine)","108","No"
"Clinical Transplantation","Transplant Immunology","John Wiley & Sons","For-profit","Hybrid","","","USA","https://onlinelibrary.wiley.com/journal/13990012","3160","0.733","Q2 (Transplantation)","90","No"
"Clinical and Experimental Allergy","Allergy and Hypersensitivity","John Wiley & Sons","For-profit associated with a society","Hybrid","British Society for Allergy & Clinical Immunology","Society/Association","USA","https://onlinelibrary.wiley.com/journal/13652222","3281","1.542","Q1 (Immunology; Immunology and Allergy)","176","No"
"Clinical and Experimental Immunology","Clinical Immunology","Oxford University Press (OUP)","University Press associated with a society","Hybrid","British Society for Immunology","Society/Association","UK","https://academic.oup.com/cei/?login=true","2255","1.308","Q1 (Immunology and Allergy)","162","No"
"Clinical and Translational Immunology","Clinical Immunology","John Wiley & Sons","For-profit associated with a society","OA","Australian and New Zealand Society for Immunology","Society/Association","Australia","https://onlinelibrary.wiley.com/journal/20500068","2213","1.472","Q1 (Immunology; Immunology and Allergy; Nursing)","60","No"
"Comparative Immunology, Microbiology and Infectious Diseases","Immunopathology","Elsevier","For-profit","Hybrid","","","Netherlands","https://www.sciencedirect.com/journal/comparative-immunology-microbiology-and-infectious-diseases","2780","0.621","Q1 (Veterinary)","67","No"
"Comparative Parasitology","Parasitology","BioOne","Non-profit","","The Helminthological Society of Washington","Society/Association","USA","https://bioone.org/journals/comparative-parasitology","","0.209","Q4 (Ecology, Evolution, Behavior and Systematics; Parasitology)","34","No"
"Critical Reviews in Immunology","Generalist/Classical Immunology","Begell House","For-profit","","","","USA","https://www.begellhouse.com/journals/critical-reviews-in-immunology.html","","0.454","Q3 (Immunology; Immunology and Allergy)","88","No"
"Critical Reviews in Microbiology","Immunopathology","Taylor & Francis Group","For-profit","Hybrid","","","UK","https://www.tandfonline.com/journals/imby20","2101","1.816","Q1 (Applied Microbiology and Biotechnology; Medicine; Microbiology)","115","No"
"Current Fungal Infection Reports","Immunopathology","Springer Nature","For-profit","Hybrid","","","Germany / UK","https://link.springer.com/journal/12281","2564","0.675","Q2 (Infectious Diseases)","34","No"
"Current HIV/AIDS Reports","Virology","Springer Nature","For-profit","Hybrid","","","Germany / UK","https://link.springer.com/journal/11904","3315","1.663","Q1 (Infectious Diseases; Virology)","77","No"
"Current Opinion in Allergy and Clinical Immunology","Allergy and Hypersensitivity","Wolters Kluwer (Lippincott)","For-profit","Hybrid","","","Netherlands / USA","https://journals.lww.com/co-allergy/pages/default.aspx","2842","0.692","Q3 (Immunology; Immunology and Allergy)","101","No"
"Current Opinion in HIV AIDS","Virology","Wolters Kluwer (Lippincott)","For-profit","Hybrid","","","Netherlands / USA","https://journals.lww.com/co-hivandaids/pages/default.aspx","3663","1.237","Q1 (Hematology; Infectious Diseases; Oncology; Virology)","82","No"
"Current Opinion in Immunology","Generalist/Classical Immunology","Elsevier","For-profit","Hybrid","","","Netherlands","https://www.sciencedirect.com/journal/current-opinion-in-immunology","3523","2.74","Q1 (Immunology; Immunology and Allergy)","215","No"
"Current Opinion in Infectious Diseases","Immunopathology","Wolters Kluwer (Lippincott)","For-profit","Hybrid","","","Netherlands / USA","https://journals.lww.com/co-infectiousdiseases/pages/default.aspx","3632","1.174","Q1 (Infectious Diseases; Microbiology)","122","No"
"Current Opinion in Microbiology","Immunopathology","Elsevier","For-profit","Hybrid","","","Netherlands","https://www.sciencedirect.com/journal/current-opinion-in-microbiology","2875","2.495","Q1 (Infectious Diseases; Microbiology)","208","No"
"Current Opinion in Organ Transplantation","Transplant Immunology","Wolters Kluwer (Lippincott)","For-profit","","","","Netherlands / USA","https://journals.lww.com/co-transplantation/pages/default.aspx","","0.705","Q2 (Transplantation)","64","No"
"Current Opinion in Virology","Virology","Elsevier","For-profit","Hybrid","","","Netherlands","https://www.sciencedirect.com/journal/current-opinion-in-virology","2889","2.034","Q1 (Virology)","102","No"
"Current Topics in Microbiology and Immunology","Immunogenetics, Molecular and Cellular Immunology","Springer Nature","For-profit","","","","Germany / UK","https://link.springer.com/series/82","","","","","No"
"Cytokine","Immunogenetics, Molecular and Cellular Immunology","Elsevier","For-profit","Hybrid","","","Netherlands","https://www.journals.elsevier.com/cytokine","3081","1.108","Q1 (Biochemistry; Hematology)","142","No"
"Cytokine & Growth Factor Reviews","Immunogenetics, Molecular and Cellular Immunology","Elsevier","For-profit","Hybrid","","","Netherlands","https://www.journals.elsevier.com/cytokine-and-growth-factor-reviews","2600","2.877","Q1 (Biochemistry, Genetics and Molecular Biology; Endocrinology, Diabetes and Metabolism; Immunology; Immunology and Allergy)","187","No"
"Developmental & Comparative Immunology","Generalist/Classical Immunology","Elsevier","For-profit associated with a society","Hybrid","International Society of Developmental and Comparative Immunology","Society/Association","Netherlands","https://www.sciencedirect.com/journal/developmental-and-comparative-immunology","3859","0.631","Q2 (Aquatic Science)","137","No"
"Diagnostic Microbiology and Infectious Disease","Immunopathology","Elsevier","For-profit","Hybrid","","","Netherlands","https://www.sciencedirect.com/journal/diagnostic-microbiology-and-infectious-disease","2674","0.633","Q2 (Infectious Diseases; Medicine; Microbiology)","106","No"
"Disease Models and Mechanisms","Immunopathology","The Company of Biologists","Non-profit","OA","","","UK","https://journals.biologists.com/dmm","3215","1.318","Q1 (Biochemistry, Genetics and Molecular Biology; Immunology and Microbiology; Medicine; Neuroscience)","113","No"
"Drug Resistance Updates","Immunopathology","Elsevier","For-profit","Hybrid","","","Netherlands","https://www.journals.elsevier.com/drug-resistance-updates","3755","5.282","Q1 (Cancer Research; Infectious Diseases; Oncology; Pharmacology)","139","No"
"Emerging Infectious Diseases","Immunopathology","Centers for Disease Control and Prevention","Non-profit","OA diamond","","","USA","https://wwwnc.cdc.gov/eid/","0","1.879","Q1 (Epidemiology; Infectious Diseases; Microbiology)","277","No"
"Emerging Microbes and Infections","Immunopathology","Taylor & Francis Group","For-profit","OA","Shanghai Shangyixun Cultural Communication Co","","UK","https://www.tandfonline.com/journals/temi20","2235","2.264","Q1 (Drug Discovery; Epidemiology; Immunology; Infectious Diseases; Medicine; Microbiology; Parasitology; Virology)","104","No"
"Epidemics","Epidemiology","Elsevier","For-profit","OA","","","Netherlands","https://www.sciencedirect.com/journal/epidemics","2025","0.903","Q1 (Parasitology)","56","No"
"Epidemioliology and Infection","Epidemiology","Cambridge University Press (CUP)","University Press","OA","","","UK","https://www.cambridge.org/core/journals/epidemiology-and-infection","2413","0.72","Q2 (Epidemiology; Infectious Diseases)","128","No"
"Epidemiologic Reviews","Epidemiology","Oxford University Press (OUP)","University Press","Hybrid","","","UK","https://academic.oup.com/epirev?login=false","2412","2.053","Q1 (Epidemiology; Medicine)","122","No"
"Epidemiology","Epidemiology","Wolters Kluwer","For-profit","Hybrid","","","Netherlands","https://journals.lww.com/epidem/Pages/default.aspx","3650","1.831","Q1 (Epidemiology)","203","No"
"Epidemiology and Psychiatric Sciences","Epidemiology","Cambridge University Press (CUP)","University Press","OA","","","UK","https://www.cambridge.org/core/journals/epidemiology-and-psychiatric-sciences","2160","2.334","Q1 (Epidemiology; Psychiatry and Mental Health; Public Health, Environmental and Occupational Health)","79","No"
"European Cytokine Network","Immunogenetics, Molecular and Cellular Immunology","John Libbey Eurotext","For-profit","","","","France","https://www.jle.com/en/revues/ecn/revue.phtml","","0.404","Q3 (Clinical Biochemistry; Immunology; Immunology and Allergy)","72","No"
"European Journal of Clinical Microbiology and Infectious Diseases","Immunopathology","Springer Nature","For-profit","Hybrid","","","Germany / UK","https://link.springer.com/journal/10096","3226","0.986","Q1 (Infectious Diseases; Medicine)","127","No"
"European Journal of Epidemiology","Epidemiology","Springer Nature","For-profit","Hybrid","","","Germany / UK","https://link.springer.com/journal/10654","4234","3.241","Q1 (Epidemiology)","147","No"
"European Journal of Immunology","Generalist/Classical Immunology","John Wiley & Sons","For-profit associated with a society","Hybrid","European Federation of Immunological Societies","Society/Association","Allemagne","https://onlinelibrary.wiley.com/journal/15214141","3268","1.86","Q1 (Immunology; Immunology and Allergy)","232","No"
"European Journal of Inflammation","Inflammation","Sage Publishing","For-profit","OA","","","USA","https://journals.sagepub.com/home/ejia","1444","0.26","Q4 (Immunology; Immunology and Allergy)","25","No"
"Eurosurveillance","Epidemiology","European Union","Non-profit","OA diamond","","University/Government","EU","https://www.eurosurveillance.org/","0","2.331","Q1 (Epidemiology; Infectious Diseases; Medicine; Microbiology; Public Health, Environmental and Occupational Health; Virology)","137","No"
"Exercise Immunology Review","Generalist/Classical Immunology","International Society of Exercise and Immunology (ISEI)","Non-profit","","International Society of Exercise and Immunology (ISEI)","Society/Association","","https://exerciseimmunology.com/eir","","1.017","Q1 (Medicine)","63","No"
"Experimental Parasitology","Parasitology","Elsevier","For-profit","Hybrid","","","Netherlands","https://www.sciencedirect.com/journal/experimental-parasitology","2188","0.414","Q3 (Immunology; Infectious Diseases; Medicine; Parasitology)","88","No"
"Experimental and Clinical Transplantation","Transplant Immunology","Middle East Society for Organ Transplantation; Baskent University","Non-profit","","","","Turkey","https://ectrx.org/","","0.263","Q3 (Transplantation)","37","No"
