"Journal","Field","Publisher","Publisher type","Business model","Institution","Institution type","Country","Website","APC Euros","Scimago Rank","Scimago Quartile","H index","PCI partner"
"Virology","Virology","Elsevier","For-profit associated with a society","Hybrid","World Society for Virology","Society/Association","Netherlands","https://www.sciencedirect.com/journal/virology","2243","0.741","Q2 (Virology)","199","No"
"Virology Journal","Virology","Springer Nature (BioMed Central)","For-profit","OA","","","UK","https://virologyj.biomedcentral.com/","2474","0.992","Q1 (Infectious Diseases)","104","No"
"Virulence","Virology","Taylor & Francis Group","For-profit","OA","","","USA","https://www.tandfonline.com/loi/kvir20","2386","1.585","Q1 (Immunology; Infectious Diseases; Microbiology; Parasitology)","100","No"
"Virus Evolution","Virology","Oxford University Press (OUP)","University Press","OA","","","UK","https://academic.oup.com/ve","2610","1.9","Q1 (Microbiology; Virology)","47","No"
"Virus Genes","Virology","Springer Nature","For-profit","Hybrid","","","Germany/UK","https://link.springer.com/journal/11262","2554","0.509","Q3 (Genetics; Medicine; Molecular Biology; Virology)","67","No"
"Virus Research","Virology","Elsevier","For-profit","OA","","","Netherlands","https://www.sciencedirect.com/journal/virus-research","2420","0.709","Q2 (Infectious Diseases; Virology)","151","No"
"World Allergy Organization Journal","Allergy and Hypersensitivity","Elsevier","For-profit","OA","World Allergy Organization","","Netherlands","https://www.worldallergyorganizationjournal.org/","2388","1.273","Q1 (Pulmonary and Respiratory Medicine)","62","No"
"World Journal of Microbiology and Biotechnology","Immunopathology","Springer Nature","For-profit associated with a society","Hybrid","International Union of Microbiological Societies (IUMS)","","Germany / UK","https://link.springer.com/journal/11274","2128","0.892","Q2 (Applied Microbiology and Biotechnology; Biotechnology; Medicine; Physiology)","126","No"
"Xenotransplantation","Transplant Immunology","John Wiley & Sons","For-profit associated with a society","Hybrid","International Xenotransplantation Association","Society/Association","USA","https://onlinelibrary.wiley.com/journal/13993089","1994","0.908","Q2 (Immunology; Transplantation)","71","No"
"npj Vaccines","Vaccinology","Springer Nature","For-profit","OA","Sealy Center for Vaccine Development at the University of Texas Medical Branch","","UK","https://www.nature.com/npjvaccines","2717","2.236","Q1 (Immunology; Infectious Diseases; Pharmacology)","54","No"
