"Journal","Field","Publisher","Publisher type","Business model","Institution","Institution type","Country","Website","APC Euros","Scimago Rank","Scimago Quartile","H index","PCI partner"
"Expert Review of Anti Infective Therapy","Virology","Taylor & Francis Group","For-profit","","","","UK","https://www.tandfonline.com/journals/ierz20","","1.09","Q1 (Infectious Diseases; Microbiology)","103","No"
"Expert Review of Vaccines","Vaccinology","Taylor & Francis Group","For-profit","Hybrid","","","USA","https://www.tandfonline.com/journals/ierv20","4153","1.255","Q1 (Drug Discovery; Pharmacology)","112","No"
"FEBS Letters","Immunogenetics, Molecular and Cellular Immunology","John Wiley & Sons","For-profit associated with a society","Hybrid","Federation of European Biochemical Societies (FEBS)","Society/Association","USA","https://febs.onlinelibrary.wiley.com/journal/18733468","2195","1.222","Q1 (Biochemistry; Biophysics)","289","No"
"FEMS Infectious Diseases","Immunopathology","Oxford University Press (OUP)","University Press associated with a society","Hybrid","Federation of European Microbiological Societies (FEMS)","Society/Association","UK","https://academic.oup.com/femspd","2528","0.742","Q2 (Immunology and Microbiology; Infectious Diseases; Medicine; Microbiology)","123","No"
"Folia Parasitologica","Parasitology","Institute of Parasitology of the Czech Academy of Sciences","Non-profit","OA","Czech Academy of Sciences","University/Government","Czech Republic","https://folia.paru.cas.cz/","164","0.459","Q2 (Parasitology)","51","No"
"Food and Chemical Toxicology","Immunotoxicology","Elsevier","For-profit associated with a society","Hybrid","Chinese Society of Toxicology","Society/Association","Netherlands","https://www.sciencedirect.com/journal/food-and-chemical-toxicology","2255","0.801","Q1 (Food Science)","215","No"
"Food and Environmental Virology","Virology","Springer Nature","For-profit associated with a society","Hybrid","International Society for Food and Environmental Virology","Society/Association","Germany / UK","https://link.springer.com/journal/12560","2840","0.748","Q1 (Food Science)","49","No"
"Frontiers in Bacteriology","Immunopathology","Frontiers Media SA","For-profit","OA","","","Switzerland","https://www.frontiersin.org/journals/bacteriology","1963","","","","No"
"Frontiers in Cellular and Infection Microbiology","Immunopathology","Frontiers Media SA","For-profit","OA","","","Switzerland","https://www.frontiersin.org/journals/cellular-and-infection-microbiology","2567","1.393","Q1 (Immunology; Infectious Diseases; Medicine; Microbiology)","136","No"
"Frontiers in Epidemiology","Epidemiology","Frontiers Media SA","For-profit","OA","","","Switzerland","https://www.frontiersin.org/journals/epidemiology","1734","0.605","Q2 (Health; Infectious Diseases; Public Health, Environmental and Occupational Health)","8","No"
"Frontiers in Immunology","Generalist/Classical Immunology","Frontiers Media SA","For-profit","OA","","","Switzerland","https://www.frontiersin.org/journals/immunology","2595","1.941","Q1 (Immunology; Immunology and Allergy)","259","No"
"Frontiers in Parasitology","Parasitology","Frontiers Media SA","For-profit","OA","","","Switzerland","https://www.frontiersin.org/journals/parasitology","2013","","","","No"
"Frontiers in Tropical Diseases","Immunopathology","Frontiers Media SA","For-profit","OA","","","Switzerland","https://www.frontiersin.org/journals/tropical-diseases","1581","0.649","Q2 (Infectious Diseases; Microbiology; Public Health, Environmental and Occupational Health)","13","No"
"Frontiers in Virology","Virology","Frontiers Media SA","For-profit","OA","","","Switzerland","https://www.frontiersin.org/journals/virology","1679","0.566","Q3 (Applied Microbiology and Biotechnology; Infectious Diseases; Microbiology; Virology)","11","No"
"Future Virology","Virology","Taylor & Francis Group","For-profit","Hybrid","","","UK","https://www.tandfonline.com/journals/ifvl20","2121","0.361","Q3 (Virology)","48","No"
"Genes and Immunity","Immunogenetics, Molecular and Cellular Immunology","Springer Nature","For-profit","Hybrid","","","Germany/UK","https://www.nature.com/gene/","2619","1.672","Q1 (Genetics; Immunology)","111","No"
"Gut Microbes","Immunopathology","Taylor & Francis Group","For-profit","OA","","","USA","https://www.tandfonline.com/journals/kgmi20","2727","3.609","Q1 (Gastroenterology; Infectious Diseases; Microbiology)","129","No"
"Gut Microbes Reports","Immunopathology","Taylor & Francis Group","For-profit","Hybrid","","","UK","https://www.tandfonline.com/journals/kgmr20","1615","","","","No"
"Gut Pathogens","Immunopathology","Springer Nature (BioMed Central)","For-profit associated with a society","OA","The International Society for Genomic and Evolutionary Microbiology","Society","UK","https://gutpathogens.biomedcentral.com/","2280","1.055","Q1 (Gastroenterology; Infectious Diseases; Parasitology)","61","No"
"HIV Medicine","Virology","John Wiley & Sons","For-profit associated with a society","Hybrid","British HIV Association","Society/Association","USA","https://onlinelibrary.wiley.com/journal/14681293","2277","1.123","Q1 (Health Policy; Infectious Diseases; Pharmacology)","88","No"
"HLA","Immunogenetics, Molecular and Cellular Immunology","John Wiley & Sons","For-profit associated with a society","Hybrid","European Federation for Immunogenetics","","USA","https://onlinelibrary.wiley.com/journal/20592310","3500","0.214","Q4 (Genetics; Immunology; Immunology and Allergy)","108","No"
"Helicobacter","Immunopathology","John Wiley & Sons","For-profit","Hybrid","","","USA","https://onlinelibrary.wiley.com/journal/15235378","2284","1.174","Q1 (Gastroenterology; Infectious Diseases; Medicine)","94","No"
"Human Immunology","Generalist/Classical Immunology","Elsevier","For-profit associated with a society","Hybrid","American Society for Histocompatibility and Immunogenetics (ASHI)","Society/Association","Netherlands","https://www.sciencedirect.com/journal/human-immunology","1964","0.895","Q2 (Immunology; Immunology and Allergy; Medicine)","105","No"
"Human Vaccines and Immunotherapeutics","Vaccinology","Taylor & Francis Group","For-profit associated with a society","Hybrid","International Society for Vaccines (ISV); Association for Cancer Immunotherapy (CIMT)","Society/Association","USA","https://www.tandfonline.com/journals/khvi20","2220","0.897","Q2 (Immunology; Immunology and Allergy; Medicine; Pharmacology)","103","No"
"Immune Network","Generalist/Classical Immunology","Korean Association of Immunologists (KAI)","Non-profit","OA","","","","https://immunenetwork.org/","","1.368","Q1 (Immunology; Immunology and Allergy; Infectious Diseases)","48","No"
"Immunity","Generalist/Classical Immunology","Elsevier (Cell Press)","For-profit","Hybrid","","","USA","https://www.cell.com/immunity","6475","12.163","Q1 (Immunology; Immunology and Allergy; Infectious Diseases)","475","No"
"Immunity & Ageing","Generalist/Classical Immunology","Springer Nature (BioMed Central)","For-profit","OA","","","UK","https://immunityageing.biomedcentral.com/","2326","1.76","Q1 (Aging; Immunology)","65","No"
"Immunity Inflammation and Disease","Inflammation","John Wiley & Sons","For-profit","OA","","","UK","https://onlinelibrary.wiley.com/journal/20504527","1789","0.814","Q3 (Immunology; Immunology and Allergy)","38","No"
"Immunobiology","Generalist/Classical Immunology","Elsevier","For-profit","OA","","","Netherlands","https://www.sciencedirect.com/journal/immunobiology","2113","0.694","Q2 (Hematology)","112","No"
"Immunogenetics","Immunogenetics, Molecular and Cellular Immunology","Springer Nature","For-profit","Hybrid","","","Germany / UK","https://link.springer.com/journal/251","2925","0.755","Q2 (Genetics)","104","No"
"Immunologic Research","Generalist/Classical Immunology","Springer Nature","For-profit","Hybrid","","","Germany/UK","https://link.springer.com/journal/12026","2675","0.906","Q2 (Immunology)","106","No"
"Immunological Investigations","Generalist/Classical Immunology","Taylor & Francis Group","For-profit","Hybrid","","","UK","https://www.tandfonline.com/journals/iimm20","2594","0.624","Q2 (Medicine)","56","No"
"Immunological Reviews","Generalist/Classical Immunology","John Wiley & Sons","For-profit","Hybrid","","","USA","https://onlinelibrary.wiley.com/journal/1600065X","3278","3.298","Q1 (Immunology; Immunology and Allergy)","262","No"
"Immunology","Generalist/Classical Immunology","John Wiley & Sons","For-profit","Hybrid","","","USA","https://onlinelibrary.wiley.com/journal/13652567","2264","1.756","Q1 (Immunology; Immunology and Allergy)","164","No"
"Immunology & Cell Biology","Generalist/Classical Immunology","John Wiley & Sons","For-profit associated with a society","Hybrid","Australasian Society for Immunology / Australasian Society","Society/Association","USA","https://onlinelibrary.wiley.com/journal/14401711","3066","1.157","Q2 (Cell Biology; Immunology; Immunology and Allergy)","123","No"
"Immunology Letters","Generalist/Classical Immunology","Elsevier","For-profit","Hybrid","","","Netherlands","https://www.journals.elsevier.com/immunology-letters","1557","0.98","Q2 (Immunology; Immunology and Allergy)","114","No"
"Immunopharmacology and Immunotoxicology","Immunotoxicology","Taylor & Francis Group","For-profit","","","","UK","https://www.tandfonline.com/journals/iipi20","","0.725","Q2 (Medicine; Pharmacology; Toxicology)","63","No"
"Immunotherapy","Immunopathology","Taylor & Francis Group","For-profit","Hybrid","","","UK","https://www.tandfonline.com/journals/iimy20","2767","0.835","Q2 (Immunology and Allergy; Oncology)","69","No"
"Infection","Immunopathology","Springer Nature","For-profit associated with a society","Hybrid","European Society of Clinical Microbiology and Infectious Diseases; Paul-Ehrlich-Gesellschaft für Chemotherapie; Deutsche Gesellschaft für Infektiologie; Deutsche Sepsis-Gesellschaft","Society","Germany / UK","https://link.springer.com/journal/15010","2642","1.167","Q1 (Infectious Diseases; Medicine; Microbiology)","94","No"
"Infection Genetics & Evolution","Immunogenetics, Molecular and Cellular Immunology","Elsevier","For-profit","OA","","","Netherlands","https://www.sciencedirect.com/journal/infection-genetics-and-evolution","1872","0.74","Q1 (Ecology, Evolution, Behavior and Systematics)","118","No"
"Infection and Immunity","Immunopathology","American Society for Microbiology (ASM)","Non-profit","Hybrid","American Society for Microbiology (ASM)","Society/Association","USA","https://journals.asm.org/journal/iai","2753","1.054","Q1 (Infectious Diseases; Parasitology)","249","No"
"Infectious Disease Modelling","Immunopathology","Elsevier","For-profit","OA","","","Netherlands","https://www.sciencedirect.com/journal/infectious-disease-modelling","1188","0.724","Q2 (Applied Mathematics; Health Policy; Infectious Diseases)","38","No"
"Infectious Diseases","Immunopathology","American Medical Association (AMA)","Non-profit","Hybrid","","","USA","https://jamanetwork.com/collections/5702/infectious-diseases","3624","0.957","Q1 (Immunology and Microbiology; Medicine)","84","No"
"Infectious Diseases Now","Immunopathology","Elsevier","For-profit associated with a society","Hybrid","Société de Pathologie Infectieuse de Langue Française (SPILF)","Society/Association","Netherlands","https://www.sciencedirect.com/journal/infectious-diseases-now","886","0.793","Q2 (Infectious Diseases)","54","No"
"Infectious Medicine","Immunopathology","Elsevier","University Press","OA","Tsinghua University Press","","Netherlands","https://www.sciencedirect.com/journal/infectious-medicine","1773","0.72","Q2 (Immunology and Microbiology; Infectious Diseases; Microbiology)","9","No"
"Infectious Microbes and Diseases","Immunopathology","Wolters Kluwer","For-profit","OA","Zhejiang University and the First Affiliated Hospital, school of Medicine, Zhejiang University","","USA","https://journals.lww.com/imd/Pages/default.aspx","","0.425","Q3 (Epidemiology; Infectious Diseases; Microbiology)","14","No"
"Inflammation","Inflammation","Springer Nature","For-profit","OA","","","Germany / UK","https://link.springer.com/journal/10753","2731","1.27","Q2 (Immunology; Immunology and Allergy)","85","No"
"Inflammation Research","Inflammation","Springer Nature","For-profit","Hybrid","","","Germany / UK","https://link.springer.com/journal/11","2268","1.388","Q1 (Immunology; Pharmacology)","112","No"
"Inflammatory Bowel Diseases","Inflammation","Oxford University Press (OUP)","University Press","Hybrid","","","UK","https://academic.oup.com/ibdjournal?login=false","2833","1.78","Q1 (Gastroenterology; Immunology and Allergy)","183","No"
"Inflammopharmacology","Inflammation","Springer Nature","For-profit","Hybrid","Gastrointestinal Section of the International Union of Pharmacology; Hungarian Experimental and Clinical Pharmacology Society","Society/Association","Germany / UK","https://link.springer.com/journal/10787","3894","1.269","Q1 (Pharmacology)","74","No"
"Influenza and Other Respiratory Viruses","Virology","John Wiley & Sons","For-profit","OA","International Society for Respiratory Viruses (ISRV)","Society/Association","UK","https://onlinelibrary.wiley.com/journal/17502659","3242","1.805","Q1 (Epidemiology; Infectious Diseases; Public Health, Environmental and Occupational Health; Pulmonary and Respiratory Medicine)","82","No"
"Innate Immunity","Generalist/Classical Immunology","Sage Publishing","For-profit associated with a society","Hybrid","International Endotoxin & Innate Immunity Society (IEIIS)","Society/Association","UK","https://journals.sagepub.com/home/ini","1506","0.917","Q2 (Immunology; Infectious Diseases; Microbiology; Molecular Biology)","81","No"
"International Forum of Allergy and Rhinology","Allergy and Hypersensitivity","John Wiley & Sons","For-profit associated with a society","Hybrid","American Rhinologic Society (ARS); American Academy of Otolaryngic Allergy (AAOA)","Society/Association","USA","https://onlinelibrary.wiley.com/journal/20426984","2718","1.412","Q1 (Immunology and Allergy; Otorhinolaryngology)","74","No"
"International Immunology","Generalist/Classical Immunology","Oxford University Press (OUP)","For-profit","Hybrid","","","UK","https://academic.oup.com/intimm","2938","1.692","Q1 (Immunology; Immunology and Allergy; Medicine)","152","No"
"International Immunopharmacology","Immunopathology","Elsevier","For-profit","Hybrid","","","Netherlands","https://www.sciencedirect.com/journal/international-immunopharmacology","3055","1.239","Q1 (Pharmacology)","155","No"
"International Journal for Parasitology","Parasitology","Elsevier","For-profit associated with a society","Hybrid","Australian Society for Parasitology","Society/Association","Netherlands","https://www.sciencedirect.com/journal/international-journal-for-parasitology","1894","1.153","Q1 (Infectious Diseases; Parasitology)","163","No"
"International Journal for Parasitology: Parasites and Wildlife","Parasitology","Elsevier","For-profit associated with a society","OA","Australian Society for Parasitology","Society/Association","Netherlands","https://www.sciencedirect.com/journal/international-journal-for-parasitology-parasites-and-wildlife","1898","0.618","Q1 (Animal Science and Zoology)","44","No"
"International Journal of Antimicrobial Agents","Immunopathology","Elsevier","For-profit associated with a society","Hybrid","International Society of Antimicrobial Chemotherapy","Society/Association","Netherlands","https://www.sciencedirect.com/journal/international-journal-of-antimicrobial-agents","2889","0.955","Q1 (Medicine)","161","No"
"International Journal of Epidemiology","Epidemiology","Oxford University Press (OUP)","University Press","Hybrid","","","UK","https://academic.oup.com/ije?login=false","2975","2.695","Q1 (Epidemiology; Medicine)","256","No"
"International Journal of Immunogenetics","Immunogenetics, Molecular and Cellular Immunology","John Wiley & Sons","For-profit","Hybrid","","","USA","https://onlinelibrary.wiley.com/journal/1744313x","2103","0.641","Q2 (Medicine)","51","No"
"International Journal of Immunopathology and Pharmacology","Immunopathology","Sage Publishing","For-profit","OA","","","USA","https://journals.sagepub.com/home/ijia","1462","0.663","Q2 (Pharmacology)","67","No"
"International Journal of Infectious Diseases","Immunopathology","Elsevier","For-profit associated with a society","OA","International Society for Infectious Diseases","Society/Association","Netherlands","https://www.sciencedirect.com/journal/international-journal-of-infectious-diseases","1540","1.323","Q1 (Infectious Diseases; Medicine; Microbiology)","140","No"
"International Journal of STD and AIDS","Virology","Sage Publishing","For-profit associated with a society","Hybrid","British Association for Sexual Health & HIV, International Union against Sexually Transmitted Infections","Society/Association","USA","https://journals.sagepub.com/home/stda","2172","0.583","Q2 (Dermatology; Infectious Diseases; Public Health, Environmental and Occupational Health)","80","No"
"International Reviews of Immunology","Generalist/Classical Immunology","Taylor & Francis Group","For-profit","","","","UK","https://www.tandfonline.com/journals/iiri20","","1.252","Q2 (Immunology; Immunology and Allergy)","80","No"
"Intervirology","Virology","Karger Publishers","For-profit","OA","","","Switzerland","https://karger.com/int","2655","0.562","Q3 (Infectious Diseases; Virology)","69","No"
"Journal for ImmunoTherapy of Cancer","Immunooncology","BMJ Group","Non-profit","OA","Society for Immunotherapy of Cancer (SITC)","Society/Association","UK","https://jitc.bmj.com","2196","4.22","Q1 (Cancer Research; Immunology; Immunology and Allergy; Molecular Medicine; Oncology; Pharmacology)","136","No"
"Journal of Acquired Immune Deficiency Syndromes","Immunopathology","Wolters Kluwer","For-profit","","","","Netherlands","https://journals.lww.com/jaids/pages/default.aspx","","1.04","Q1 (Infectious Diseases; Pharmacology)","176","No"
"Journal of Allergy and Clinical Immunology","Clinical Immunology","Elsevier","For-profit associated with a society","Hybrid","American Academy of Allergy, Asthma and Immunology","","Netherlands","https://www.jacionline.org","2461","3.935","Q1 (Immunology; Immunology and Allergy)","350","No"
"Journal of Analytical Toxicology","Immunotoxicology","Oxford University Press (OUP)","University Press associated with a society","","International Association of Forensic Toxicologists; Society of Forensic Toxicologists","Society","UK","https://academic.oup.com/jat/?login=false","","0.827","Q1 (Analytical Chemistry)","87","No"
"Journal of Applied Toxicology","Immunotoxicology","John Wiley & Sons","For-profit","Hybrid","","","USA","https://analyticalsciencejournals.onlinelibrary.wiley.com/journal/10991263","3207","0.745","Q2 (Toxicology)","106","No"
"Journal of Asthma and Allergy","Allergy and Hypersensitivity","Taylor & Francis Group (Dovepress)","For-profit","OA","","","UK","https://www.dovepress.com/journal-of-asthma-and-allergy-journal","2833","1.063","Q1 (Pulmonary and Respiratory Medicine)","45","No"
"Journal of Autoimmunity","Autoimmunity","Elsevier","For-profit","Hybrid","","","Netherlands","https://www.journals.elsevier.com/journal-of-autoimmunity","4220","2.281","Q1 (Immunology; Immunology and Allergy)","147","No"
"Journal of Biochemical and Molecular Toxicology","Immunotoxicology","John Wiley & Sons","For-profit","Hybrid","","","USA","https://onlinelibrary.wiley.com/journal/10990461","3133","0.772","Q2 (Biochemistry; Health, Toxicology and Mutagenesis; Medicine; Toxicology)","74","No"
"Journal of Clinical Immunology","Clinical Immunology","Springer Nature","For-profit","Hybrid","","","USA","https://link.springer.com/journal/10875","3001","1.928","Q1 (Immunology; Immunology and Allergy)","119","No"
"Journal of Clinical Virology","Virology","Elsevier","For-profit associated with a society","Hybrid","Pan American Society for Clinical Virology; European Society for Clinical Virology","Society/Association","Netherlands","https://www.sciencedirect.com/journal/journal-of-clinical-virology","2534","1.193","Q1 (Infectious Diseases; Virology)","129","No"
"Journal of Crohn's and Colitis","Clinical Immunology","Oxford University Press (OUP)","University Press","Hybrid","","","UK","https://academic.oup.com/ecco-jcc?login=false","2877","2.991","Q1 (Gastroenterology; Medicine)","123","No"
"Journal of Epidemiology","Epidemiology","Immunology","Non-profit","OA","Japan Epidemiological Association","Society/Association","Japan","https://www.jstage.jst.go.jp/browse/jea/","875","1.254","Q1 (Epidemiology; Medicine)","95","No"
"Journal of Epidemiology and Community Health","Epidemiology","BMJ Group","Non-profit","Hybrid","","","UK","https://jech.bmj.com/","3230","1.776","Q1 (Epidemiology; Public Health, Environmental and Occupational Health)","199","No"
"Journal of Epidemiology and Global Health","Epidemiology","Springer Nature","For-profit","OA","","","Switzerland","https://link.springer.com/journal/44197","1927","1.014","Q2 (Epidemiology)","41","No"
"Journal of Epidemiology and Population Health","Epidemiology","Elsevier","For-profit","","","","Netherlands","https://www.sciencedirect.com/journal/journal-of-epidemiology-and-population-health","","0.392","Q3 (Epidemiology; Public Health, Environmental and Occupational Health)","41","No"
"Journal of General Virology","Virology","Microbiology Society","Non-profit","Hybrid","Microbiology Society","Society/Association","","https://www.microbiologyresearch.org/content/journal/jgv","2575","1.07","Q2 (Virology)","193","No"
"Journal of Global Antimicrobial Resistance","Immunopathology","Elsevier","For-profit associated with a society","OA","International Society of Antimicrobial Chemotherapy (ISAC); the Global Chinese Association of Clinical Microbiology and Infectious Diseases (GCACMID); Asia-Pacific Society of Clinical Microbiology and Infection (APSCMI)","Society/Association","UK","https://www.sciencedirect.com/journal/journal-of-global-antimicrobial-resistance","1444","0.992","Q2 (Immunology; Immunology and Allergy; Microbiology)","55","No"
"Journal of Immunoassay & Immunochemistry","Immunogenetics, Molecular and Cellular Immunology","Taylor & Francis Group","For-profit","","","","UK","https://www.tandfonline.com/journals/ljii20","","0.34","Q2 (Medical Laboratory Technology)","33","No"
"Journal of Immunological Methods","Generalist/Classical Immunology","Elsevier","For-profit","Hybrid","","","Netherlands","https://www.journals.elsevier.com/journal-of-immunological-methods","2641","0.53","Q3 (Immunology; Immunology and Allergy)","151","No"
"Journal of Immunology Research","Generalist/Classical Immunology","John Wiley & Sons","For-profit","OA","","","UK","https://onlinelibrary.wiley.com/journal/1607","1947","1.076","Q1 (Medicine)","122","No"
"Journal of Infection","Immunopathology","Elsevier","For-profit associated with a society","Hybrid","British Infection Association","Society/Association","UK","https://www.sciencedirect.com/journal/journal-of-infection","2738","2.046","Q1 (Infectious Diseases; Microbiology)","145","No"
"Journal of Infection Prevention","Immunopathology","Sage Publishing","For-profit associated with a society","","Infection Prevention Society","Society/Association","USA","https://journals.sagepub.com/home/bjib","","0.365","Q2 (Advanced and Specialized Nursing)","26","No"
"Journal of Infection and Chemotherapy","Immunooncology","Elsevier","For-profit associated with a society","Hybrid","The Japanese Society of Chemotherapy; The Japanese Association for Infectious Diseases; The Japanese Society for Infection Prevention and Control","Society/Association","Netherlands","https://www.sciencedirect.com/journal/journal-of-infection-and-chemotherapy","2270","0.584","Q2 (Infectious Diseases; Pharmacology)","76","No"
"Journal of Inflammation","Inflammation","Springer Nature (BioMed Central)","For-profit associated with a society","OA","British Inflammation Research Association","Society","UK","https://journal-inflammation.biomedcentral.com/","3189","1.214","Q1 (Clinical Biochemistry)","69","No"
"Journal of Inflammation Research","Inflammation","Taylor & Francis Group (Dovepress)","For-profit","OA","","","UK","https://www.dovepress.com/journal-of-inflammation-research-journal","2327","1.14","Q2 (Immunology; Immunology and Allergy)","58","No"
"Journal of Innate Immunity","Generalist/Classical Immunology","Karger Publishers","For-profit","OA","","","Switzerland","https://karger.com/jin","2209","1.2","Q2 (Immunology and Allergy)","86","No"
"Journal of Interferon and Cytokine Research","Immunogenetics, Molecular and Cellular Immunology","Sage Publishing (Mary-Ann Liebert)","For-profit associated with a society","Hybrid","International Cytokine and Interferon Society","Society/Association","","https://journals.sagepub.com/home/ifc","3060","0.628","Q2 (Medicine)","108","No"
"Journal of Investigational Allergology and Clinical Immunology","Allergy and Hypersensitivity","Spanish Society of Allergology and Clinical Immunology","Non-profit","OA","Spanish Society of Allergology and Clinical Immunology","Society/Association","","https://www.jiaci.org/","1015","0.811","Q3 (Immunology; Immunology and Allergy)","76","No"
"Journal of Liver Transplantation","Transplant Immunology","Elsevier","For-profit","OA","","","France","https://www.sciencedirect.com/journal/journal-of-liver-transplantation","1800","0.213","Q3 (Gastroenterology; Internal Medicine; Transplantation)","5","No"
"Journal of Medical Virology","Virology","John Wiley & Sons","For-profit","Hybrid","","","USA","https://onlinelibrary.wiley.com/journal/10969071","3170","1.291","Q1 (Infectious Diseases; Virology)","160","No"
