"Journal","Field","Publisher","Publisher type","Business model","Institution","Institution type","Country","Website","APC Euros","Scimago Rank","Scimago Quartile","H index","PCI partner"
"FEBS Letters","Molecular and Cellular Neuroscience","John Wiley & Sons","For-profit associated with a society","Hybrid","Federation of the European Biochemical Societies","Society/Association","UK","https://febs.onlinelibrary.wiley.com/journal/18733468","2195","1.222","Q1 (Biochemistry; Biophysics)","289","No"
"Fluids and Barriers of the CNS","Molecular and Cellular Neuroscience","Springer Nature (BioMed Central)","For-profit associated with a society","OA","International Brain Barriers Society (IBBS); The Hydrocephalus Society","Society/Association","UK","https://fluidsbarrierscns.biomedcentral.com/","2693","1.931","Q1 (Cellular and Molecular Neuroscience; Developmental Neuroscience; Medicine; Neurology)","71","No"
"Focus on Autism and Other Developmental Disabilities","Developmental Neuroscience","Sage Publishing","For-profit associated with a society","","Hammill Institute on Disabilities/Division on Autism and Developmental Disabilities of The Council for Exceptional Children","","USA","https://journals.sagepub.com/home/FOA","","0.808","Q1 (Pediatrics, Perinatology and Child Health)","81","No"
"Frontiers in Aging Neuroscience","Developmental Neuroscience","Frontiers Media SA","For-profit","OA","","","Switzerland","https://www.frontiersin.org/journals/aging-neuroscience","2472","1.479","Q1 (Cognitive Neuroscience)","135","No"
"Frontiers in Behavioral Neuroscience","Behavioral Neuroscience","Frontiers Media SA","For-profit","OA","","","Switzerland","https://www.frontiersin.org/journals/behavioral-neuroscience","2490","1.007","Q1 (Neuropsychology and Physiological Psychology)","106","No"
"Frontiers in Cellular Neuroscience","Molecular and Cellular Neuroscience","Frontiers Media SA","For-profit","OA","","","Switzerland","https://www.frontiersin.org/journals/cellular-neuroscience","2524","1.488","Q1 (Cellular and Molecular Neuroscience)","142","No"
"Frontiers in Child and Adolescent Psychiatry","Developmental Neuroscience","Frontiers Media SA","For-profit","OA","","","Switzerland","https://www.frontiersin.org/journals/child-and-adolescent-psychiatry","2279","","","","No"
"Frontiers in Cognition","Cognitive Neuroscience","Frontiers Media SA","For-profit","OA","","","Switzerland","https://www.frontiersin.org/journals/cognition","1992","","","","No"
"Frontiers in Computational Neuroscience","Methods","Frontiers Media SA","For-profit","OA","","","Switzerland","https://www.frontiersin.org/journals/computational-neuroscience","2365","0.622","Q3 (Neuroscience)","77","No"
"Frontiers in Developmental Psychology","Developmental Neuroscience","Frontiers Media SA","For-profit","OA","","","Switzerland","https://www.frontiersin.org/journals/developmental-psychology","2159","","","","No"
"Frontiers in Evolutionary Neuroscience","Generalist","Frontiers Media SA","For-profit","OA","","","Switzerland","https://www.frontiersin.org/journals/evolutionary-neuroscience","0","","","","No"
"Frontiers in Human Neuroscience","Generalist","Frontiers Media SA","For-profit","OA","","","Switzerland","https://www.frontiersin.org/journals/human-neuroscience","2482","0.904","Q2 (Behavioral Neuroscience; Neurology; Neuropsychology and Physiological Psychology; Psychiatry and Mental Health)","168","No"
"Frontiers in Integrative Neuroscience","Generalist","Frontiers Media SA","For-profit","OA","","","Switzerland","https://www.frontiersin.org/journals/integrative-neuroscience","2457","0.996","Q1 (Sensory Systems)","83","No"
"Frontiers in Molecular Neuroscience","Molecular and Cellular Neuroscience","Frontiers Media SA","For-profit","OA","","","Switzerland","https://www.frontiersin.org/journals/molecular-neuroscience","2763","1.337","Q2 (Cellular and Molecular Neuroscience; Molecular Biology)","110","No"
"Frontiers in Neuroimaging","Methods","Frontiers Media SA","For-profit","OA","","","Switzerland","https://www.frontiersin.org/journals/neuroimaging","1732","","","","No"
"Frontiers in Neuroinformatics","Generalist","Frontiers Media SA","For-profit","OA","","","Switzerland","https://www.frontiersin.org/journals/neuroinformatics","2636","0.71","Q2 (Biomedical Engineering; Computer Science Applications)","83","No"
"Frontiers in Neurology","Clinical Neuroscience","Frontiers Media SA","For-profit","OA","","","Switzerland","https://www.frontiersin.org/journals/neurology","2421","0.993","Q2 (Neurology)","118","No"
"Frontiers in Neuroscience","Generalist","Frontiers Media SA","For-profit","OA","","","Switzerland","https://www.frontiersin.org/journals/neuroscience","2601","1.068","Q2 (Neuroscience)","170","No"
"Frontiers in Psychology","Cognitive Neuroscience","Frontiers Media SA","For-profit","OA","","","Switzerland","https://www.frontiersin.org/journals/psychology","2514","0.872","Q2 (Psychology)","212","No"
"Frontiers in Synaptic Neuroscience","Molecular and Cellular Neuroscience","Frontiers Media SA","For-profit","OA","","","Switzerland","https://www.frontiersin.org/journals/synaptic-neuroscience","1839","1.543","Q1 (Cellular and Molecular Neuroscience)","53","No"
"Frontiers in Systems Neuroscience","Generalist","Frontiers Media SA","For-profit","OA","","","Switzerland","https://www.frontiersin.org/journals/systems-neuroscience","2162","1.296","Q1 (Cognitive Neuroscience; Developmental Neuroscience; Neuroscience)","102","No"
"Genes, Brain and Behavior","Neurogenetics","John Wiley & Sons","For-profit associated with a society","Hybrid","International Behavioural and Neural Genetics Society","Society/Association","USA","https://onlinelibrary.wiley.com/journal/1601183X","3267","0.861","Q2 (Behavioral Neuroscience; Genetics; Neurology)","104","No"
"Glia","Molecular and Cellular Neuroscience","John Wiley & Sons","For-profit","Hybrid","","","USA","https://onlinelibrary.wiley.com/journal/10981136","3903","2.317","Q1 (Cellular and Molecular Neuroscience; Neurology)","194","No"
"Global Spine Journal","Generalist","Sage Publishing","For-profit associated with a society","OA","AO Spine","","USA","https://journals.sagepub.com/home/gsja","","1.153","Q1 (Neurology; Orthopedics and Sports Medicine; Surgery)","59","No"
"Gériatrie et Psychologie Neuropsychiatrie du Vieillissement","Developmental Neuroscience","John Libbery Eurotext","For-profit associated with a society","Hybrid","Société française de gériatrie et de gérontologie (SFGG); Société francophone de psychogériatrie et de psychiatrie de la personne âgée (SF3PA); Association des jeunes gériatres (AJG)","Society/Association","France","https://www.jle.com/fr/revues/gpn/revue.phtml","424","0.19","Q4 (Biological Psychiatry; Geriatrics and Gerontology; Medicine; Neurology; Neuropsychology and Physiological Psychology)","22","No"
"Harvard Review of Psychiatry","Clinical Neuroscience","Wolters Kluwer (Lippincott)","For-profit associated with a society","Hybrid","Departments of Psychiatry, Harvard teaching hospitals","University/Government","Netherlands / USA","https://journals.lww.com/hrpjournal/pages/default.aspx","2020","1.049","Q2 (Psychiatry and Mental Health)","94","No"
"Headache","Clinical Neuroscience","John Wiley & Sons","For-profit associated with a society","","American Headache Society","Society/Association","USA","https://headachejournal.onlinelibrary.wiley.com/","","1.426","Q1 (Neurology)","146","No"
"Hearing Research","Sensory Neuroscience","Elsevier","For-profit","Hybrid","","","Netherlands","https://www.sciencedirect.com/journal/hearing-research","2295","0.814","Q2 (Sensory Systems)","140","No"
"Hippocampus","Generalist","John Wiley & Sons","For-profit","Hybrid","","","USA","https://onlinelibrary.wiley.com/journal/10981063","2999","1.313","Q1 (Cognitive Neuroscience)","174","No"
"Hormones and Behavior","Behavioral Neuroscience","Elsevier","For-profit associated with a society","Hybrid","Society for Behavioral Neuroendocrinology","Society/Association","Netherlands","https://www.sciencedirect.com/journal/hormones-and-behavior","2654","0.822","Q2 (Endocrinology)","166","No"
"Human Brain Mapping","Generalist","John Wiley & Sons","For-profit","OA","","","USA","https://onlinelibrary.wiley.com/journal/10970193","3253","1.584","Q1 (Anatomy; Neurology; Radiological and Ultrasound Technology; Radiology, Nuclear Medicine and Imaging)","225","No"
"IEEE Transactions on Cognitive Development Systems","Developmental Neuroscience","IEEE Computational Intelligence Society (CIS)","Non-profit","","","","","https://ieeexplore.ieee.org/xpl/RecentIssue.jsp?punumber=7274989","","","","","No"
"Imagination, Cognition and Personality","Cognitive Neuroscience","Sage Publishing","For-profit","","","","USA","https://journals.sagepub.com/home/icaa","","0.346","Q3 (Psychology)","36","No"
"Imaging Neuroscience","Cognitive Neuroscience","MIT press direct","University Press","OA","","University/Government","USA","https://direct.mit.edu/imag","1586","","-","0","No"
"International Gambling Studies","Addiction","Taylor & Francis Group","For-profit","Hybrid","","","UK","https://www.tandfonline.com/journals/rigs20","742","1.071","Q2 (Applied Psychology)","45","No"
"International Journal of Audiology","Sensory Neuroscience","Taylor & Francis Group","For-profit associated with a society","Hybrid","","","UK","https://www.tandfonline.com/journals/iija20","2307","0.941","Q1 (Linguistics and Language; Speech and Hearing)","102","No"
"International Journal of Bipolar Disorders","Clinical Neuroscience","Springer Nature","For-profit associated with a society","OA","International Group for The Study of Lithium Treated Patients; Deutsche Gesellschaft für Bipolare Störungen (DGBS)","Society","UK","https://journalbipolardisorders.springeropen.com/","2140","1.325","Q1 (Psychiatry and Mental Health)","37","No"
"International Journal of Developmental Neuroscience","Developmental Neuroscience","John Wiley & Sons","For-profit associated with a society","Hybrid","The International Society for Developmental Neuroscience (ISDN)","Society/Association","UK","https://onlinelibrary.wiley.com/journal/1873474x","2545","0.545","Q3 (Developmental Biology; Developmental Neuroscience)","101","No"
"International Journal of Geriatric Psychiatry","Clinical Neuroscience","John Wiley & Sons","For-profit","Hybrid","","","USA","https://onlinelibrary.wiley.com/journal/10991166","2685","1.221","Q1 (Geriatrics and Gerontology; Psychiatry and Mental Health)","157","No"
"International Journal of Language and Communication Disorders","Cognitive Neuroscience","John Wiley & Sons","For-profit associated with a society","Hybrid","Royal College of Speech and Language Therapists","","USA","https://onlinelibrary.wiley.com/journal/14606984","2251","0.727","Q1 (Linguistics and Language)","89","No"
"International Journal of Mental Health and Addiction","Addiction","Springer Nature","For-profit","Hybrid","","","Germany / UK","https://link.springer.com/journal/11469","2341","1.477","Q1 (Psychiatry and Mental Health)","79","No"
"International Journal of Neuroscience","Generalist","Taylor & Francis Group","For-profit","","","","UK","https://www.tandfonline.com/journals/ines20","","0.569","Q2 (Medicine)","81","No"
"International Journal of Psychophysiology","Neurophysiology","Elsevier","For-profit","Hybrid","","","Netherlands","https://www.sciencedirect.com/journal/international-journal-of-psychophysiology","2530","0.948","Q1 (Neuropsychology and Physiological Psychology)","155","No"
"International Journal of Social Psychiatry","Social Neuroscience","Sage Publishing","For-profit","Hybrid","","","USA","https://journals.sagepub.com/home/ispa","286","1.292","Q1 (Medicine; Psychiatry and Mental Health)","86","No"
"International Journal of Social Psychology","Social Neuroscience","Sage Publishing","For-profit associated with a society","","Fundacion Infanzia y Aprendizaje","Non-profit","USA","https://journals.sagepub.com/home/spja","","0.398","Q3 (Social Psychology)","29","No"
"International Journal of Stroke","Clinical Neuroscience","Sage Publishing","For-profit associated with a society","Hybrid","International Journal of Stroke","","USA","https://journals.sagepub.com/home/wsoa","1271","1.917","Q1 (Neurology)","105","No"
"Interventional Neuroradiology","Clinical Neuroscience","Sage Publishing","For-profit associated with a society","","World Federation of Interventional and Therapeutic Neuroradiology","","USA","https://journals.sagepub.com/home/inea","","0.625","Q2 (Cardiology and Cardiovascular Medicine; Radiology, Nuclear Medicine and Imaging)","46","No"
"Investigative Ophthalmology and Visual Science","Sensory Neuroscience","The Association for Research in Vision and Ophtalmology (ARVO)","Non-profit","OA","The Association for Research in Vision and Ophtalmology (ARVO)","Society/Association","USA","https://iovs.arvojournals.org/","","1.376","Q1 (Ophthalmology; Sensory Systems)","260","No"
"Irish Journal of Psychological Medicine","Clinical Neuroscience","Cambridge University Press (CUP)","University Press associated with a society","","the College of Psychiatrists of Ireland","","UK","https://www.cambridge.org/core/journals/irish-journal-of-psychological-medicine","","0.699","Q1 (History and Philosophy of Science)","37","No"
"JAMA Neurology","Clinical Neuroscience","American Medical Association (AMA)","Non-profit","Hybrid","American Medical Association (AMA)","Society/Association","USA","https://jamanetwork.com/journals/jamaneurology","4372","6.237","Q1 (Neurology)","284","No"
"JAMA Psychiatry","Clinical Neuroscience","American Medical Association (AMA)","Non-profit","Hybrid","American Medical Association (AMA)","Society/Association","USA","https://jamanetwork.com/journals/jamapsychiatry","4822","5.755","Q1 (Medicine; Psychiatry and Mental Health)","417","No"
"Journal of Affective Disorders","Clinical Neuroscience","Elsevier","For-profit associated with a society","Hybrid","International Society for Affective Disorders","Society/Association","Netherlands","https://www.journals.elsevier.com/journal-of-affective-disorders","2842","2.121","Q1 (Clinical Psychology; Psychiatry and Mental Health)","245","No"
"Journal of Affective Disorders Reports","Clinical Neuroscience","Elsevier","For-profit associated with a society","Hybrid","International Society for Affective Disorders","Society/Association","Netherlands","https://www.sciencedirect.com/journal/journal-of-affective-disorders-reports","1647","0.904","Q2 (Clinical Psychology; Psychiatry and Mental Health)","34","No"
"Journal of Alzheimer's Disease","Clinical Neuroscience","Sage Publishing (IOS Press)","For-profit","Hybrid","","","UK / Germany","https://journals.sagepub.com/home/alz","1700","1.166","Q1 (Clinical Psychology; Medicine; Psychiatry and Mental Health)","188","No"
"Journal of Applied Psychology","Cognitive Neuroscience","American Psychological Association (APA)","Non-profit","Hybrid","American Psychological Association","Society/Association","USA","https://www.apa.org/pubs/journals/apl/","","6.803","Q1 (Applied Psychology)","353","No"
"Journal of Attention Disorders","Clinical Neuroscience","Sage Publishing","For-profit associated with a society","Hybrid","American Professional Society of ADHD and Related Disorders (APSARD)","Society/Association","USA","https://journals.sagepub.com/home/JAD","1137","1.212","Q1 (Clinical Psychology; Developmental and Educational Psychology)","93","No"
"Journal of Autism and Developmental Disorders","Clinical Neuroscience","Springer Nature","For-profit","Hybrid","","","Germany / UK","https://link.springer.com/journal/10803","2798","1.233","Q1 (Developmental and Educational Psychology)","217","No"
"Journal of Behavioral Addictions","Addiction","Wolters Kluwer (Akadémiai Kiadó (AK) Journals)","For-profit associated with a society","OA","International Society of Addiction Journal Editors (ISAJE)","Society/Association","Hungary","https://akjournals.com/view/journals/2006/2006-overview.xml","818","2.26","Q1 (Clinical Psychology; Medicine; Psychiatry and Mental Health)","88","No"
"Journal of Central Nervous System Disease","Clinical Neuroscience","Sage Publishing","For-profit","OA","","","USA","https://journals.sagepub.com/home/cnsa","","1.016","Q2 (Cellular and Molecular Neuroscience; Neurology)","15","No"
"Journal of Child Neurology","Developmental Neuroscience","Sage Publishing","For-profit","","","","USA","https://journals.sagepub.com/home/jcna","","0.586","Q2 (Pediatrics, Perinatology and Child Health)","123","No"
"Journal of Cognition","Cognitive Neuroscience","Ubiquity Press Ltd","Non-profit","OA","The European Society for Cognitive Psychology","Society/Association","UK","https://journalofcognition.org/","1077","0.978","Q2 (Experimental and Cognitive Psychology)","22","No"
"Journal of Cognitive Neuroscience","Cognitive Neuroscience","MIT press direct","University Press","Hybrid","","University/Government","USA","https://direct.mit.edu/jocn","1525","1.276","Q1 (Cognitive Neuroscience)","244","No"
"Journal of Cognitive Psychology","Cognitive Neuroscience","Taylor & Francis Group","For-profit","Hybrid","","","UK","https://www.tandfonline.com/journals/pcgn20","3248","0.598","Q3 (Experimental and Cognitive Psychology)","100","No"
"Journal of Comparative Neurology","Generalist","John Wiley & Sons","For-profit","Hybrid","","","USA","https://onlinelibrary.wiley.com/journal/10969861","3045","1.084","Q2 (Neuroscience)","232","No"
"Journal of Comparative Physiology A Neuroethology Sensory Neural and Behavioral Physiology","Generalist","Springer Nature","For-profit","Hybrid","","","Germany / UK","https://link.springer.com/journal/359","","0.637","Q1 (Animal Science and Zoology)","106","No"
"Journal of Comparative Psychology","Cognitive Neuroscience","American Psychological Association (APA)","Non-profit","","American Psychological Association","Society/Association","USA","https://www.apa.org/pubs/journals/com","","0.368","Q3 (Ecology, Evolution, Behavior and Systematics; Psychology)","93","No"
"Journal of Computational Neuroscience","Methods","Springer Nature (BioMed Central)","For-profit","Hybrid","","","Germany / UK","https://link.springer.com/journal/10827","2845","0.444","Q3 (Cognitive Neuroscience)","85","No"
"Journal of ECT","Neuromodulation","Wolters Kluwer (Lippincott)","For-profit associated with a society","Hybrid","International Society for ECT and Neurostimulation","Society/Association","Netherlands / USA","https://journals.lww.com/ectjournal/pages/default.aspx","2838","0.604","Q2 (Medicine)","72","No"
"Journal of Eating Disorders","Clinical Neuroscience","Springer Nature (BioMed Central)","For-profit","OA","","","UK","https://jeatdisord.biomedcentral.com/","1777","1.243","Q1 (Behavioral Neuroscience; Nutrition and Dietetics; Psychiatry and Mental Health)","54","No"
"Journal of Ethnicity in Substance Abuse","Addiction","Taylor & Francis Group","For-profit","Hybrid","","","UK","https://www.tandfonline.com/journals/wesa20","2020","0.442","Q2 (Health)","38","No"
"Journal of Experimental Psychology : Learning, Memory, and Cognition","Behavioral Neuroscience","American Psychological Association (APA)","Non-profit","Hybrid","American Psychological Association","Society/Association","USA","https://www.apa.org/pubs/journals/xlm/","2675","1.227","Q1 (Experimental and Cognitive Psychology; Linguistics and Language)","181","No"
"Journal of Experimental Psychology: General","Behavioral Neuroscience","American Psychological Association (APA)","Non-profit","Hybrid","American Psychological Association","Society/Association","USA","https://www.apa.org/pubs/journals/xge","3552","2.076","Q1 (Developmental Neuroscience; Experimental and Cognitive Psychology; Medicine; Psychology)","196","No"
"Journal of Fluency Disorders","Cognitive Neuroscience","Elsevier","For-profit associated with a society","Hybrid","World Stuttering & Cluttering Organization (WSCO)","","Netherlands","https://www.sciencedirect.com/journal/journal-of-fluency-disorders","2652","0.746","Q1 (Linguistics and Language; LPN and LVN; Speech and Hearing)","69","No"
"Journal of Geriatric Psychiatry and Neurology","Clinical Neuroscience","Sage Publishing","For-profit","","","","USA","https://journals.sagepub.com/home/jgpb","","1.05","Q2 (Geriatrics and Gerontology; Neurology; Psychiatry and Mental Health)","82","No"
"Journal of Integrative Neuroscience","Generalist","IMR","For-profit","OA","","","Singapore","https://www.imrpress.com/journal/JIN","1624","0.764","Q2 (Medicine)","43","No"
"Journal of Molecular Neuroscience","Molecular and Cellular Neuroscience","Springer Nature","For-profit","Hybrid","European Society for Neurochemistry (ESN)","Society/Association","Germany / UK","https://link.springer.com/journal/12031","2908","1.019","Q1 (Medicine)","103","No"
"Journal of Motor Behavior","Neurophysiology","Taylor & Francis Group","For-profit","Hybrid","","","UK","https://www.tandfonline.com/journals/vjmb20","4972","0.488","Q3 (Biophysics; Cognitive Neuroscience; Experimental and Cognitive Psychology; Orthopedics and Sports Medicine; Sports Science)","82","No"
"Journal of Multiple Sclerosis Research","Clinical Neuroscience","Multiple Sclerosis Research Association","Non-profit","","Multiple Sclerosis Research Association","Society/Association","Turkey","https://jmsres.com/","","","","","No"
"Journal of Multiple Sclerosis Research and Neuroimmunology","Neuroimmunology","Korean Society of Neuroimmunology","Non-profit","","Korean Society of Neuroimmunology","Society/Association","","https://jmsni.org/","","","","","No"
"Journal of Musculoskeletal and Neuronal Interactions","Neurophysiology","Hylonome Publications","For-profit associated with a society","Hybrid","International Society of Musculoskeletal and Neuronal Interactions (ISMNI); Hellenic Osteoporosis Foundation (HELIOST)","Society/Association","","https://www.ismni.org/jmni/","263","0.527","Q2 (Orthopedics and Sports Medicine)","74","No"
"Journal of Nervous and Mental Disease","Clinical Neuroscience","Wolters Kluwer (Lippincott)","For-profit","Hybrid","","","Netherlands / USA","https://journals.lww.com/jonmd/pages/currenttoc.aspx","3405","0.593","Q3 (Psychiatry and Mental Health)","142","No"
"Journal of Neural Transmission","Molecular and Cellular Neuroscience","Springer Nature","For-profit","Hybrid","","","Germany / UK","https://link.springer.com/journal/702","3537","1.107","Q1 (Neurology)","134","No"
"Journal of Neuro-Oncology","Clinical Neuroscience","Springer Nature","For-profit","Hybrid","","","Germany / UK","https://link.springer.com/journal/11060","3701","1.139","Q1 (Neurology)","141","No"
"Journal of Neuro-Ophthalmology","Sensory Neuroscience","Wolters Kluwer (Lippincott)","For-profit","Hybrid","","","Netherlands / USA","https://journals.lww.com/jneuro-ophthalmology/Pages/currenttoc.aspx","3226","0.433","Q3 (Medicine; Neurology; Ophthalmology)","74","No"
"Journal of Neurochemistry","Molecular and Cellular Neuroscience","John Wiley & Sons","For-profit associated with a society","Hybrid","International Society for Neurochemistry","Society/Association","USA","https://onlinelibrary.wiley.com/journal/14714159","2066","1.499","Q1 (Biochemistry; Cellular and Molecular Neuroscience)","267","No"
"Journal of Neurodevelopmental Disorders","Developmental Neuroscience","Springer Nature (BioMed Central)","For-profit","OA","","","UK","https://jneurodevdisorders.biomedcentral.com/","2412","1.296","Q1 (Cognitive Neuroscience; Neurology; Pathology and Forensic Medicine; Pediatrics, Perinatology and Child Health)","64","No"
"Journal of Neuroendocrinology","Neurophysiology","John Wiley & Sons","For-profit associated with a society","Hybrid","British Society for Neuroendocrinology","Society/Association","USA","https://onlinelibrary.wiley.com/journal/13652826","2126","1.294","Q1 (Endocrine and Autonomic Systems; Endocrinology; Endocrinology, Diabetes and Metabolism)","130","No"
"Journal of Neuroengineering and Rehabilitation","Clinical Neuroscience","Springer Nature (BioMed Central)","For-profit","OA","","","UK","https://jneuroengrehab.biomedcentral.com/","2471","1.287","Q1 (Health Informatics; Rehabilitation)","129","No"
"Journal of Neurogenetics","Neurogenetics","Taylor & Francis Group","For-profit","Hybrid","","","UK","https://www.tandfonline.com/journals/ineg20","2250","0.542","Q3 (Genetics)","44","No"
"Journal of Neuroimaging","Methods","John Wiley & Sons","For-profit associated with a society","Hybrid","American Society of Neuroimaging","Society/Association","USA","https://onlinelibrary.wiley.com/journal/15526569","3202","0.855","Q1 (Radiology, Nuclear Medicine and Imaging)","75","No"
"Journal of Neuroimmune Pharmacology","Neuroimmunology","Springer Nature","For-profit","Hybrid","","","Germany / UK","https://link.springer.com/journal/11481","3138","1.251","Q1 (Neuroscience; Pharmacology)","94","No"
"Journal of Neuroimmunology","Neuroimmunology","Elsevier","For-profit","Hybrid","","","Netherlands","https://www.sciencedirect.com/journal/journal-of-neuroimmunology","2938","0.903","Q2 (Immunology; Immunology and Allergy; Neurology)","159","No"
"Journal of Neuroinflammation","Neuroimmunology","Springer Nature (BioMed Central)","For-profit","OA","","","Germany/UK","https://jneuroinflammation.biomedcentral.com/","2669","3.183","Q1 (Cellular and Molecular Neuroscience; Immunology; Neurology; Neuroscience)","168","No"
"Journal of Neurolinguistics","Cognitive Neuroscience","Elsevier","For-profit","Hybrid","","","Netherlands","https://www.sciencedirect.com/journal/journal-of-neurolinguistics","2023","0.552","Q1 (Arts and Humanities; Linguistics and Language)","69","No"
"Journal of Neurologic Physical Therapy","Clinical Neuroscience","Wolters Kluwer (Lippincott)","For-profit","","","","Netherlands / USA","https://journals.lww.com/jnpt/pages/default.aspx","","0.956","Q1 (Medicine; Physical Therapy, Sports Therapy and Rehabilitation; Rehabilitation)","67","No"
