"Journal","Field","Publisher","Publisher type","Business model","Institution","Institution type","Country","Website","APC Euros","Scimago Rank","Scimago Quartile","H index","PCI partner","e-ISSN","p-ISSN"
"Quantitative Plant Biology","Generalist","Cambridge University Press (CUP)","University Press","OA","The John Innes Centre","","UK","https://www.cambridge.org/core/journals/quantitative-plant-biology","2402","0.927","Q1 (Plant Science)","12","PCI friendly","2632-8828",""
"Rice","Agriculture","Springer Nature","For-profit","OA","","","Germany / UK","https://link.springer.com/journal/12284","2636","1.524","Q1 (Agronomy and Crop Science; Plant Science; Soil Science)","88","No","1939-8433","1939-8425"
"South African Journal of Botany","Generalist","Elsevier","For-profit associated with a society","Hybrid","South African Association of Botanists","Society/Association","Netherlands","https://www.sciencedirect.com/journal/south-african-journal-of-botany","2477","0.596","Q2 (Plant Science)","98","No","","0254-6299"
"Systematic Botany","Generalist","The American Society of Plant Taxonomists","Non-profit","Hybrid","The American Society of Plant Taxonomists","Society/Association","USA","https://bioone.org/journals/systematic-botany","534","0.305","Q3 (Ecology, Evolution, Behavior and Systematics; Plant Science)","87","No","1548-2324","0363-6445"
"The Botanical Review","Generalist","Springer Nature","For-profit associated with a society","Hybrid","New York Botanical Garden","University/Government","Germany / UK","https://link.springer.com/journal/12229","2624","1.22","Q1 (Ecology, Evolution, Behavior and Systematics; Plant Science)","84","No","1874-9372","0006-8101"
"The Bryologist","Generalist","JSTOR","Non-profit","","American Bryological and Lichenological Society","Society/Association","USA","https://www.jstor.org/journal/bryologist","","0.329","Q3 (Ecology, Evolution, Behavior and Systematics; Plant Science)","57","No","","0007-2745"
"The Lichenologist","Generalist","Cambridge University Press (CUP)","University Press","Hybrid","","","UK","https://www.cambridge.org/core/journals/lichenologist","2132","0.318","Q3 (Ecology, Evolution, Behavior and Systematics)","55","No","1096-1135","0024-2829"
"The Plant Cell","Molecular and Cellular Biology","Oxford University Press (OUP)","University Press","Hybrid","","","UK","https://academic.oup.com/plcell","5165","4.088","Q1 (Cell Biology; Plant Science)","428","No","1532-298X","1040-4651"
"The Plant Genome","Genetics","John Wiley & Sons","For-profit associated with a society","OA","Crop Science Society of America","Society/Association","USA","https://acsess.onlinelibrary.wiley.com/journal/19403372","2287","1.126","Q1 (Agronomy and Crop Science; Plant Science)","78","No","1940-3372","1940-3372"
"The Plant Journal","Generalist","John Wiley & Sons","For-profit associated with a society","Hybrid","Society for Experimental Biology (SEB)","Society/Association","USA","https://onlinelibrary.wiley.com/journal/1365313x","4747","2.14","Q1 (Cell Biology; Genetics; Plant Science)","341","No","1365-313X","0960-7412"
"Tree Physiology","Physiology","Oxford University Press (OUP)","University Press","Hybrid","","","UK","https://academic.oup.com/treephys","3402","1.073","Q1 (Plant Science)","163","No","1758-4469","0829-318X"
"Trends in Plant Science","Generalist","Elsevier (Cell Press)","For-profit","Hybrid","","","USA","https://www.cell.com/trends/plant-science","5872","3.324","Q1 (Plant Science)","336","No","1878-4372","1360-1385"
"Tropical Plant Biology","Generalist","Springer Nature","For-profit","Hybrid","","","Germany / UK","https://link.springer.com/journal/12042","2604","0.395","Q2 (Plant Science)","34","No","1935-9764","1935-9756"
"Weed Science","Agriculture","Cambridge University Press (CUP)","University Press associated with a society","Hybrid","Weed Science Society of America","Society/Association","UK","https://www.cambridge.org/core/journals/weed-science","1615","0.571","Q2 (Agronomy and Crop Science; Plant Science)","113","No","1550-2759","0043-1745"
