"Journal","Field","Publisher","Publisher type","Business model","Institution","Institution type","Country","Website","APC Euros","Scimago Rank","Scimago Quartile","H index","PCI partner"
"The Plant Journal","Generalist","John Wiley & Sons","For-profit associated with a society","Hybrid","Society for Experimental Biology (SEB)","Society/Association","USA","https://onlinelibrary.wiley.com/journal/1365313x","3671","2.275","Q1 (Cell Biology; Genetics; Plant Science)","327","No"
"Tree Physiology","Physiology","Oxford University Press (OUP)","University Press","Hybrid","","","UK","https://academic.oup.com/treephys","2937","1.091","Q1 (Plant Science)","154","No"
"Trends in Plant Science","Generalist","Elsevier (Cell Press)","For-profit","Hybrid","","","USA","https://www.cell.com/trends/plant-science","4457","3.297","Q1 (Plant Science)","325","No"
"Tropical Plant Biology","Generalist","Springer Nature","For-profit","Hybrid","","","Germany/UK","https://link.springer.com/journal/12042","2604","0.396","Q2 (Plant Science)","33","No"
"Weed Science","Agriculture","Cambridge University Press (CUP)","University Press associated with a society","Hybrid","Weed Science Society of America","Society/Association","UK","https://www.cambridge.org/core/journals/weed-science","1615","0.632","Q1 (Agronomy and Crop Science)","109","No"
